,0,1,2,3,4
0,22,209,"'What we\'ve done so far is very sensible, but I would have liked to see a development over a longer period before I dared to say that the curve is broken,"" said Hans Jorn Kolmos, a professor in clinical microbiology at the University of Southern Denmark.\n'",['Hans Jorn Kolmos'],University of Southern Denmark
0,51,539,"'We want to move to a situation where at least by the end of May that we’re able to substitute some less intensive measures, more based on technology and testing, for the complete lockdown we have now,” Imperial College London epidemiologist Neil Ferguson told the BBC.\n'",['Neil Ferguson'],Imperial College London
0,69,748,"'The situation\xa0calls for “a better national policy of widespread testing, to isolate cases,” said Ali S. Khan, the dean of the College of Public Health at the University of Nebraska Medical Center.\n'",['Ali S. Khan'],University of Nebraska Medical Center
0,104,1023,"""In an interview with Forbes, Purdue University professor of mechanical engineering Qingyan said there is a “very easy way to help prevent the spread of coronavirus: 'Close the lid and then flush.'”\nCLICK HERE FOR COMPLETE\xa0 CORONAVIRUS COVERAGE\n""",['Qingyan'],Purdue University
0,117,1088,"""In an interview with Forbes, Purdue University professor of mechanical engineering Qingyan said there is a “very easy way to help prevent the spread of coronavirus: 'Close the lid and then flush.'”\nCLICK HERE FOR COMPLETE\xa0 CORONAVIRUS COVERAGE\n""",['Qingyan'],Purdue University
0,123,1163,"'This is a very important contribution to understanding both the natural history of COVID-19 clinical disease as well as the public health implications of viral shedding,"" Michael Osterholm, director of the University of Minnesota\'s Center for Infectious Disease Research and Policy,\xa0told Stat News.\n'",['Michael Osterholm'],University of Minnesota
0,136,1266,"'He was recorded as saying that appointing then-Secretary of State Jesse White would ""cover you on the African-American thing"" and that he was the ""least offensive"" candidate.'",['Jesse White'],Pennsylvania State University
0,147,1329,"'The United States and Mexico have agreed to restrict nonessential travel across our shared border,” Secretary of State Mike Pompeo said during a White House press briefing with other top officials. \n'",['Mike Pompeo'],Pennsylvania State University
0,200,1842,"'There’s no ventilator for the brain,” Dr. Sherry H-Y. Chou, a neurologist at the University of Pittsburgh School of Medicine, told The Times.'",['Sherry H-Y. Chou'],University of Pittsburgh
0,214,1957,"'""Harvard has been looking at the symptoms we see from COVID-19, and they\'ve discovered something we\'ve been talking about recently, which is the [loss of] sense of smell called Anosmia,"" Siegel said.\xa0'",['Siegel'],Harvard University
0,246,2124,"'The number of confirmed cases in China by day 50 (February 19) of the epidemic, was around 30,000,"" said Christopher Dye, visiting professor of zoology and visiting fellow at the Oxford Martin School, University of Oxford, in a statement.'",['Christopher Dye'],University of Oxford
0,278,2400,"'It\'s impossible for North Korea not to have a single case of coronavirus,"" Jung H. Pak, a former CIA analyst on North Korea,\xa0previously told Fox News.\n'",['Jung H. Pak'],University of Valencia
0,330,2767,"'I think we’ll get our results soon because the enrollment pace is very quick,” said principal investigator Dr. Babafemi Taiwo, chief of infectious diseases at Northwestern University Feinberg School of Medicine and Northwestern Medicine.'",['Babafemi Taiwo'],Northwestern University
0,344,2903,"'""Other things to consider is the environment, where one lives certainly plays a role,"" said Dr. Attila Hertelendy, a professor in emergency and disaster management at Georgetown University.'",['Attila Hertelendy'],Georgetown University
0,372,3149,"'The sheriff, joined by State Attorney Andrew Warren and Bishop Thomas Scott,\xa0made it clear: ""We\'re hoping that this serves as a deterrent.'","['Andrew Warren', 'Bishop Thomas Scott,\\xa0made']",Pennsylvania State University
0,381,3191,"'UAW president Rory Gamble applauded Ford’s decision, saying it is the right one “for our members, their families and our nation.'",['Rory Gamble'],University of Oxford
0,382,3194,"'UAW president Rory Gamble applauded Ford’s decision, saying it is the right one “for our members, their families and our nation.'",['Rory Gamble'],University of Oxford
0,393,3324,"'If you\'ve heard the stories of what the State Department\'s done to get people out of places like Bhutan, an impossible place to get to,"" Pompeo added.\xa0'",['Pompeo'],Pennsylvania State University
0,394,3342,"'We treasure the support we receive from our music industry colleagues and all of Nashville’s outstanding artists,"" Jeff Balser, MD, PhD, president and CEO of VUMC and dean of the Vanderbilt University School of Medicine, told Billboard in a statement.'",['Jeff Balser'],Vanderbilt University
0,400,3355,"'Fox News medical contributor\xa0Dr. Marty Makary,\xa0professor of public health at Johns Hopkins University, joined\xa0""Special Report with Bret Baier"" to answer more viewer questions regarding the continuing coronavirus outbreak.\n'","['Marty Makary,\\xa0professor']",Johns Hopkins University
0,404,3388,"'Don\'t worry though, there will be an album this year, I promise!""\nJON BON JOVI DISCUSSES PRINCE HARRY COLLABORATION'",['DISCUSSES PRINCE'],University of Bonn
0,409,3433,"'A lot of people have been trying to figure out Mars\' water history,"" University of Arizona planetary scientist Jessica Barnes said in a statement.'",['Jessica Barnes'],University of Arizona
0,422,3627,"'There are a TON of take aways from #TigerKing, but the one that will really stick for me: \'Hey all you cool cats and kittens,\'"" wrote Colin Hanks.\n'","[""Colin Hanks.\\n'""]",Princeton University
0,472,3980,"'The air is definitely much healthier,” said Professor James Lee at York University and the NCAS, who analyzed the data.'",['James Lee'],York University
0,493,4163,"'He’s making himself irrelevant,” Saikat Chakrabarti, a former chief of staff to Queens Rep. Alexandria Ocasio-Cortez, told The Post, saying the virtual broadcasts were not helping.'",['Alexandria Ocasio-Cortez'],The University of Queensland
0,508,4414,"'In another high-profile moment, Lowery drew a standing ovation at the 2006 funeral of King’s widow, Coretta Scott King, when he criticized the war in Iraq, saying, ""For war, billions more, but no more for the poor.'","['Coretta Scott King', 'Lowery']",King’s College London
0,509,4421,"'The witnesses and medical workers believed he was purposely disregarding space and safety concerns involving the coronavirus pandemic,” University of Connecticut spokeswoman Stephanie Reitz told the paper.\n'",['Stephanie Reitz'],University of Connecticut
0,543,4733,"'""The initial data from Wuhan, China, indicated that the majority of people who were hospitalized and/or required ICU admission, sometimes then later resulting in fatalities due to coronavirus, were those who are older – over the age of 65, especially over 85,"" said Dr. Roger McIntyre, president, and CEO of CRTCE, professor of psychiatry and pharmacology at the University of Toronto and head of the Mood Disorders Psychopharmacology Unit at the University Health Network.'",['Roger McIntyre'],University of Toronto
0,553,4788,"'President Trump tweeted on Friday that discussions to purchase ventilators from GM was not working out and urged GM and Ford to ""START MAKING VENTILATORS, NOW!!!!!!'",['Trump'],University of Oxford
0,557,4869,"'Former Secretary of State John Kerry blasted GOP Rep.\xa0Thomas Massie on Friday in colorful terms over his possible bid to delay a vote on the coronavirus\xa0stimulus package, saying he has “tested positive for being an a--hole.', 'Breaking news: Congressman Massie has tested positive for being an a--hole.'",['John Kerry'],Pennsylvania State University
0,600,5171,"'Only Iran knows for certain what happened to Bob since his abduction more than 13 years ago,""\xa0Secretary of State Mike Pompeo said in a statement on Thursday.'",['Mike Pompeo'],Pennsylvania State University
0,617,5316,"""The Pennsylvania Supreme Court had narrowly dismissed Prince's suit, which challenged Wolf’s authority to shutter businesses deemed “non-life-sustaining,” but in a dissenting statement joined by two other justices, Justice David Wecht said Wolf’s order amounts to “an absolute and indefinite prohibition upon the acquisition of firearms by the citizens of this commonwealth — a result in clear tension with the Second Amendment” and the state constitution.\n""","['Wolf', 'David Wecht']",Princeton University
0,621,5333,"'We\'ve gone back and gotten samples from patients who had SARS in 2003 and 2004, and as of this year, we can detect antibodies,"" Stanley Perlman, a professor of microbiology and immunology at the University of Iowa, also told NPR.'",['Stanley Perlman'],University of Iowa
0,636,5466,"'""GM and Ford understand that buyers want more SUVs and trucks, but they\'re also trying to play to Wall Street, which thinks the future is all about electric vehicles,"" Sam Fiorani, vice president, global vehicle forecasting at AutoForecast, which provided some of the data, told Reuters.\n'",['Sam Fiorani'],University of Oxford
0,644,5538,"'There is too much mathematical modeling going on,” Siegel told “Fox  Friends.”\nSiegel said that projections from Johns Hopkins University and other institutions are based on “numbers they don’t really know.”\n“'",['Siegel'],Johns Hopkins University
0,645,5538,"'There is too much mathematical modeling going on,” Siegel told “Fox  Friends.”\nSiegel said that projections from Johns Hopkins University and other institutions are based on “numbers they don’t really know.”\n“'",['Siegel'],Johns Hopkins University
0,651,5568,"'Later, President Trump suggested reopening parts of the U.S. economy by Easter, which falls on April 12 this year, and argued he doesn’t want “to turn the country off” and see a continued economic downfall from the pandemic.\n'",['Trump'],Northeastern University
0,664,5629,"'On Tuesday, UAW president Rory Gamble told UAW members that the union and Ford “will be collaborating to find ways to help improve and protect lives across the country during this crisis.'",['Rory Gamble'],University of Oxford
0,711,5986,"'What we are seeing is a lot of panic buying,” said Morris Cohen, a panasonic professor of manufacturing and logistics at the Wharton School of the University of Pennsylvania. \n'",['Morris Cohen'],University of Pennsylvania
0,739,6228,"'It\'s impossible for North Korea not to have a single case of coronavirus,"" Jung H. Pak, a former CIA analyst on North Korea,\xa0previously told Fox News.\n\n      '","['Jung H. Pak', 'Fox News.\\n\\n']",University of Valencia
0,742,6236,"'Appearing on ""Fox  Friends"" with host Steve Doocy, Cotton said that while he would love to see America back up and running by Easter –\xa0as President Trump suggested Tuesday –\xa0the one thing that can\'t happen is a ""relaxing of some of the restrictions on public activities and then a resurgence of the pandemic.'","['Steve Doocy', 'Trump']",Northeastern University
0,754,6413,"'Certain types of drugs are still on the move,” Anna Sergi, a criminologist at Britain’s University of Essex, told the Organized Crime and Corruption Reporting Project (OCCRP).'",['Anna Sergi'],University of Essex
0,755,6413,"'The problem is who is going to pick them up?”\nOther crime experts, like Oxford University Professor Federico Varese, have forecasted that organized crime will continue to suffer as Italy’s economy contracts. \n'",['Federico Varese'],University of Oxford
0,756,6414,"'If the data supports it, I\'m for it,"" Graham\xa0said of the Easter date, urging Trump to follow the advice of task force Drs.'",['Drs'],Northeastern University
0,763,6477,"'Saying the county was nearing the\xa0""the end of our historic battle"" with ""the invisible enemy"" of coronavirus, President Trump began Tuesday\'s White House coronavirus task force briefing by emphasizing\xa0his hope that the country will largely reopen for business by Easter -- as his top economic advisor suggested Congress may soon pass an unprecedented fiscal stimulus package.\n'",['Trump'],Northeastern University
0,764,6487,"'Saying the county was nearing the\xa0""the end of our historic battle"" with coronavirus, President Trump began Tuesday\'s White House coronavirus task force briefing by emphasizing\xa0his hope that the country will largely reopen for business by Easter -- as his top economic advisor suggested Congress may soon pass an unprecedented fiscal stimulus package.\n'",['Trump'],Northeastern University
0,769,6559,"'Andrew D. Hamilton, president of New York University, told the crowd that day that McNally put a “unique stamp on American drama by probing the urgent need for connection that resonates at the core of human experience.'","['Andrew D. Hamilton', 'McNally']",New York University
0,770,6563,"'""More people at home means more people online – with big bandwidth appetites,"" Paul Raschky, an economist at Monash University in Melbourne and co-founder of KASPR Datahaus, told The Daily Mail.\n'",['Paul Raschky'],Monash University
0,810,6897,"'Dr. Jen Caudle, a family physician and associate professor at Rowan University in New Jersey, told the AP that “depending on how hot the blow dryer gets, I would be concerned with some adverse effects.'",['Jen Caudle'],Brown University
0,824,7076,"""According to the University of Queensland's Jonathan Aitchison, the finding revises the long-held understanding of the location of one of biology and geography's most significant barriers -- known as the Wallace line.\n""","['Wallace', 'Jonathan Aitchison']",The University of Queensland
0,826,7101,"'""The handling of these situations vary, but ultimately we can say our system has been ill-equipped to deal with something of this magnitude and the prison system can no longer be society\'s afterthought,"" said Michael Mendoza, National Director of #cut50, a campaign to reduce crime and incarceration levels in all states.'",['Michael Mendoza'],National University of Singapore
0,831,7159,"'It’s going to make them feel differently about their mortality, possibly, what the world offers, what security looks like,” said Cathy Cohen, a political science professor at the University of Chicago, who regularly tracks the views of young people.\n'",['Cathy Cohen'],University of Chicago
0,852,7430,"'Then we proceed from there to an ante room right in front of the Oval Office to talk about what are going to be the messages,” Dr. Fauci told Science.'",['Fauci'],London School of Economics and Political Science
0,853,7430,"'Dr. Fauci, the National Institutes of Health infectious diseases expert, told Science magazine on Sunday before heading to the White House that the typical routine is for the task force to “sit down for an hour and a half, go over all the issues on the agenda” before providing an update to the president.\n'",['Fauci'],London School of Economics and Political Science
0,878,7594,"'In a statement, Duke coach Mike Krzyzewski called Jones “the heart and soul of our program” over his two seasons and “such a pleasure to coach.”\n'",['Mike Krzyzewski'],Duke University
0,879,7594,"'In a statement, Duke coach Mike Krzyzewski called Jones “the heart and soul of our program” over his two seasons and “such a pleasure to coach.”\n'",['Mike Krzyzewski'],Duke University
0,899,7950,"'Yesterday I was complaining to my friend that I was bored with my hair, and I kept seeing tutorials on TikTok about how to get natural, nice-looking bangs,” Christine Thomas, a senior at Purdue University who’s staying with her parents in Noblesville, Ind., to ride out the pandemic, tells The Post.\n'",['Christine Thomas'],Purdue University
0,951,8557,"'Surgical masks will not prevent your acquiring diseases,”\xa0 Dr. William Schaffner, a professor of preventive medicine and infectious diseases at Vanderbilt University, and the medical director of the National Foundation for Infectious Diseases, previously told Fox News.'",['William Schaffner'],Vanderbilt University
0,967,8772,"'It\'s really hard on the priests not to be able to give the blessed sacrament of the Mass, so I was trying to think about what we could do,"" Holmer told ""Fox  Friends"" Friday morning.\n'",['Holmer'],University of Massachusetts
0,981,8860,"'The big limitation of this study … is that it\'s really a short-term rechallenge study,"" meaning the monkeys were ""rechallenged"" with the virus soon after recovering from the first infection, said Dr. Dean Winslow, a professor of hospital medicine at Stanford University Medical Center who specializes in infectious diseases.\n'",['Dean Winslow'],Stanford University
0,995,9057,"'Some set of people is still going about their daily lives, and that needs to change pretty rapidly,” said Caroline Pearson, senior vice president at NORC at the University of Chicago and a health policy expert.'",['Caroline Pearson'],University of Chicago
0,996,9058,"'We are seeing year after year how the rising incidence of extreme events is causing significant impacts on people and ecosystems,” Stanford University climate scientist Noah Diffenbaugh said in a statement.'",['Noah Diffenbaugh'],Stanford University
0,1011,9231,"'I am expecting to see increases in unlinked local cases within the next two weeks -- cases in Hong Kong or Singapore who do not know how they got infected,” Ben Cowling, an epidemiologist at the University of Hong Kong, told the paper.'",['Ben Cowling'],University of Hong Kong
0,1022,9336,"'The Chinese government has been trying to project Chinese state power beyond its borders and establish China as a global leader, not dissimilar to what the U.S. government has been doing for the better part of a century, and the distribution of medical aid is part of that mission,"" Dr. Yangyang Cheng, a postdoctoral research associate at Cornell University, told The Intercept.\n'",['Yangyang Cheng'],Cornell University
0,1029,9381,"'We’re trying to leverage the science to see if we can do something in addition to minimizing contacts,” Dr. Jakub Tolar, dean of the University of Minnesota Medical School and vice president for clinical affairs, told Reuters.'",['Jakub Tolar'],University of Minnesota
0,1033,9427,"'But Cuccinelli, saying that “the health and safety of Americans is paramount,” promised that ICE will “conduct enforcement operations that protect our communities and uphold our laws.'",['Cuccinelli'],Rice University
0,1079,9805,"'If odor could be used to elicit the rich recollection of a memory -- even of a traumatic experience -- we could take advantage of that [therapeutically],"" said Boston University neuroscientist Steve Ramirez, assistant professor of psychology and brain sciences and senior author of the study, in a statement.\n'",['Steve Ramirez'],Boston University
0,1109,10091,"'It\'s impossible for North Korea not to have a single case of coronavirus,"" Jung H. Pak, a former CIA analyst on North Korea,\xa0told Fox News on Tuesday.\n'",['Jung H. Pak'],University of Valencia
0,1152,10567,"'We are confident voters can safely and securely cast a ballot,” Florida Secretary of State Laurel Lee said Monday during a press conference. \n'",['Laurel Lee'],Pennsylvania State University
0,1174,10790,"'""People were really keyed up to thinking about a new pandemic virus and they were worried this could be it,"" said\xa0Dr. Amesh Adalja, a senior scholar at the Johns Hopkins University Center for Health Security.'",['Amesh Adalja'],Johns Hopkins University
0,1203,11028,"'Secretary of State Katie Hobbs explained ""this decision was not made lightly and what it all comes down to is that we have no guarantee that there will be a safer time to hold this election in the near future.""\n'",['Katie Hobbs'],Pennsylvania State University
0,1231,11367,"'Economy Minister Peter Altmaier, speaking on ARD television, said that “Germany is not for sale.'",['Peter Altmaier'],Harvard University
0,1237,11452,"'It was a virus that was likely derived mostly from an avian species, meaning it came from birds and jumped directly into humans,"" said\xa0Dr. Amesh Adalja, a senior scholar at the Johns Hopkins University Center for Health Security.\xa0'",['Amesh Adalja'],Johns Hopkins University
0,1239,11453,"'""Events are moving rapidly and my highest priority is protecting the health of our poll workers, their families, and the community at large,"" said Secretary of State Brad Raffensperger.\n'","[""Brad Raffensperger.\\n'""]",Pennsylvania State University
0,1298,12381,"'""The data confirmed a lot of what we already know,"" said Ali Khan, a professor of epidemiology\xa0at the University of Nebraska Medical Center.\n'",['Ali Khan'],University of Nebraska Medical Center
0,1308,12487,"'I think it’s the height of hypocrisy,” acting ICE Director Matthew Albence told Fox News.'",['Matthew Albence'],Rice University
0,1311,12521,"'Disinfecting these ""high touch"" areas is a surefire way to fight germs, according to Ohio State University infectious disease specialist Debra A. Goff, Pharm.'",['Debra A. Goff'],Ohio State University
0,1329,12708,"'Surgical masks will not prevent your acquiring diseases,” said Dr. William Schaffner, a professor of preventive medicine and infectious diseases at Vanderbilt University, and the medical director of the National Foundation for Infectious Diseases.'",['William Schaffner'],Vanderbilt University
0,1391,13617,"'David Jacobson, a\xa0professor of global business strategy at SMU\'s Cox School of Business and a visiting professor at Tsinghua University in Beijing, told Fox News earlier this month\xa0that Germany had ""taken this disease seriously since December.'",['David Jacobson'],Tsinghua University
0,1421,14019,"'It is obvious that Xi could not have visited Wuhan earlier because the risk of him contracting the virus there was initially too high,” Zhang Ming, a professor at Renmin University in Beijing, told Reuters.\n'",['” Zhang Ming'],Renmin University of China
0,1431,14052,"'We don’t know anything about this virus,"" said Dr. Angela Rasmussen, a virologist at Columbia University.'",['Angela Rasmussen'],Columbia University
0,1451,14218,"'This time, however, not only is Biden doing much better among the demographic groups that live there compared with Sanders in the 18 states that have already voted, Sanders is less focused on them, according to Michigan State University political science professor Matt Grossman.'",['Matt Grossman'],Michigan State University
0,1458,14261,"'""With only one location to perform tests for the whole country, there was limited capacity [to confirm or rule-out a positive diagnosis],” Samuel Sia, Ph.D. and professor of biomedical engineering, Columbia University, told Fox News.\xa0'","['Ph.D.', 'Samuel Sia']",Columbia University
0,1460,14295,"'""With only one location to perform tests for the whole country, there was limited capacity [to confirm or rule-out a positive diagnosis],” Samuel Sia, Ph.D. and professor of biomedical engineering, Columbia University, told Fox News.\xa0'","['Ph.D.', 'Samuel Sia']",Columbia University
0,1465,14452,"'It’s basically Darwinian evolution, where it’s survival of the fittest,” University of North Carolina epidemiologist Timothy Sheahan told NBC.\xa0'",['Timothy Sheahan'],University of South Carolina
0,1524,15306,"'Our initial checks showed no previously cataloged object in that position in space,” Branden Allen, a Harvard research scientist and student supervisor who first spotted the source in the REXIS data, said in a statement.\n'",['Branden Allen'],Harvard University
0,1586,15878,"'This is just an example of President’s critics, criticizing anything that he does,” Cotton told “Hannity.”\nFORMER SEN.'",['Cotton'],Sun Yat-sen University
0,1590,15890,"'Unfortunately, our Congress has been captive to raw partisanship instead of compromise and accomplishment,” Hagel, who spent to terms representing Nebraska in the Senate and served as defense secretary from 2013 to 2015 under Barack Obama,\xa0told “The Story.'",['Hagel'],University of Nebraska-Lincoln
0,1625,16198,"'Surgical masks will not prevent your acquiring diseases,” Dr. William Schaffner, a professor of preventative medicine and infectious diseases at Vanderbilt University, and the medical director of the National Foundation for Infectious Diseases, previously told Fox News.\n'",['William Schaffner'],Vanderbilt University
0,1626,16199,"'Disinfecting these ""high touch"" areas is a surefure way to fight germs, according to Ohio State University infectious disease specialist Debra A. Goff, Pharm.'",['Debra A. Goff'],Ohio State University
0,1648,16486,"'Many different countries around the world may be sources of COVID-19 infections,” Mark Woolhouse, a professor of infectious disease epidemiology at the University of Edinburgh, told The Associated Press.\xa0'",['Mark Woolhouse'],University of Edinburgh
0,1658,16652,"'Frostbite is a severe injury to a body part or parts resulting from freezing of the soft tissue,” Dr. Amalia Cochran, director of the Burn Center at The Ohio State University Wexner Medical Center, told Fox News.'",['Amalia Cochran'],Ohio State University
0,1662,16700,"'Health care and housing can no longer be divorced,” Newsom said in his State of the State address.'",['Newsom'],Pennsylvania State University
