,0,1,2,3,4
0,2913,27382,"'We always encourage pregnant women to trust websites that are reliable and that are vouched by medical professionals as being accurate and informative,” Dr. Jonathan Schaffir, OB/GYN at The Ohio State University Wexner Medical Center, said.\n'",['Jonathan Schaffir'],Ohio State University
0,2917,27400,"'Usually you sort of put a brave face on and you just get on with your day,"" Mukherjee, who graduated from the University of Nottingham just two weeks before she was crowned Miss England last August, adds.'",['Mukherjee'],University of Nottingham
0,2923,27578,"'It will motivate additional searches among bright, relatively nearby stars,” said Ohio State University astronomer Todd Thompson, who wasn’t part of the research.\n'",['Todd Thompson'],Ohio State University
0,2926,27586,"'If the allegation against Biden were being decided by the kind of adjudication system that he helped enshrine on college campuses, it\'s quite likely that he would be found guilty,"" wrote Reason\'s Robby Soave, who has spent years chronicling apparent problems with how colleges adjudicate sexual assault cases -- including the 2017 expulsion of University of Southern California student Matthew Boermeester for assault ""even though the purported victim, his girlfriend,\xa0emphatically denied\xa0that he had done anything wrong.'","['Matthew Boermeester', 'Robby Soave']",University of Southern California
0,2937,27670,"'If the allegation against Biden were being decided by the kind of adjudication system that he helped enshrine on college campuses, it\'s quite likely that he would be found guilty,"" wrote Reason\'s Robby Soave, who has spent years chronicling apparent problems with how colleges adjudicate sexual assault cases -- including the 2017 expulsion of University of Southern California student Matthew Boermeester for assault ""even though the purported victim, his girlfriend,\xa0emphatically denied\xa0that he had done anything wrong.'","['Matthew Boermeester', 'Robby Soave']",University of Southern California
0,2952,27809,"'The sweet spot is being able to detect a resurgence of cases early,” Kara Nelson, a professor in civil and environmental engineering at the University of California, Berkeley, who specializes in studying pathogens that can be transmitted through water pipes, explained to The Journal.\n'",['Kara Nelson'],"University of California, Berkeley"
0,2976,27973,"'""We have received hundreds of notes, emails, and comments,"" said Ben Collier, a student at Brown University who joined the project.'",['Ben Collier'],Brown University
0,2984,27995,"'The days of the ‘moderate’ Democrat party are over,” ACU Chairman Matt Schlapp said in a statement.'",['Matt Schlapp'],Syracuse University
0,3012,28188,"'Their secret space program advances technologies used in nuclear weapons delivery systems,” Secretary of State Mike Pompeo warned in a\xa0tweet\xa0last month.\n'",['Mike Pompeo'],Pennsylvania State University
0,3023,28254,"'Almost everybody has heard of the infamous ocean \'garbage patches\' of floating plastic, but we were shocked at the high concentrations of microplastics we found in the deep-seafloor,"" said the study\'s lead author, Ian Kane of The University of Manchester.'",['Ian Kane'],University of Manchester
0,3038,28333,"'He said\xa0several of the disgruntled Venezuelan men involved were\xa0lured under the false pretenses, and were told Goudreau was ""Trump\'s bodyguard, a Delta Force special operator, and a CIA agent.'",['Goudreau'],University of Valencia
0,3041,28336,"'He said\xa0several of the disgruntled Venezuelan men involved were\xa0lured under the false pretenses, and were told Goudreau was ""Trump\'s bodyguard, a Delta Force special operator, and a CIA agent.'",['Goudreau'],University of Valencia
0,3043,28344,"'These findings suggest both B and T cells participate in immune-mediated protection against the viral infection,"" co-senior study author Chen Dong of Tsinghua University said in a statement.\n'",['Chen Dong'],Tsinghua University
0,3057,28455,"'As federal and state governments are deliberating about reopening, we need to address the needs of parents and children and child care workers who are essential to reigniting the economy,”\xa0Child Care Aware of America executive director Lynette Fraga told ""America\'s Newsroom.""\nAMERICA’S ROAD TO REOPENING: STATES INCLUDING FLORIDA, COLORADO AND ARIZONA EASE CORONAVIRUS RESTRICTIONS\n'",['Lynette Fraga'],University of Colorado Boulder
0,3084,28718,"'If you look at the Los Angeles Lakers or Milwaukee Bucks, they are in first place when the season got suspended,” Tsai said last week during a virtual call with students at Stanford, where his daughter is a junior.'",['Tsai'],Stanford University
0,3122,28995,"'The world of birds is so much more vibrant and active than I’d ever realized, and once I paid attention, it just hit me in the face,” said Conner Brown, a 25-year-old law student at Stanford University.'",['Conner Brown'],Stanford University
0,3142,29109,"'""The purpose of an antibody test is, instead of asking you whether or not you felt sick with COVID-19, we could instead ask your immune system if your immune system has seen the coronavirus,"" said Daniel Larremore, an assistant professor in the Department of Computer Science and the BioFrontiers Institute at the University of Colorado Boulder.\n'",['Daniel Larremore'],University of Colorado Boulder
0,3150,29173,"'What is important about this pandemic is that it has shined a spotlight on workers who have been essential but before this were invisible,” said David Michaels, a professor of environmental and occupational health at the Milken Institute School of Public Health at George Washington University.\n'",['David Michaels'],George Washington University
0,3190,29546,"'With more people hanging around and available to each other, I would expect shootings to stay the same or go up,” John Roman, a University of Chicago economist who studies crime patterns,\xa0told The Trace.\n'",['John Roman'],University of Chicago
0,3204,29739,"'We were surprised to see such favorable outcomes in [the] well-controlled blood glucose group among patients with COVID-19 and pre-existing Type 2 diabetes,"" senior study author Hongliang Li, at Renmin Hospital of Wuhan University, said in a statement.\n'",['Hongliang Li'],Wuhan University
0,3206,29749,"'For more information on\xa0the coronavirus\xa0pandemic, watch\xa0""America Vs Virus""\xa0with\xa0Dr. Mehmet Oz,\xa0""Pandemics and Epidemics 101,""\xa0with Dr. Nicole\xa0Saphier,\xa0a full-time practicing physician at Memorial Sloan Kettering Cancer Center and\xa0""Fox Nation 101: Making Vaccines,""\xa0with\xa0Dr.\xa0Amesh Adalja, a senior scholar at the Johns Hopkins University Center for Health Security.\n'","['Nicole\\xa0Saphier,\\xa0a']",Johns Hopkins University
0,3219,29798,"'""The leadership in NYC has moved slowly, offering inconsistent messages and didn\'t let the scientists\' voices emerge as leaders,"" conjectured Dr. Attila Hertelendy, a professor in emergency and disaster management at Georgetown University.'",['Attila Hertelendy'],Georgetown University
0,3253,29980,"'“Coach Forbes has an incredible track record of success, matched only by his reputation for building strong and lasting relationships,” Wake Forest athletic director John Currie said in a statement.'",['John Currie'],Wake Forest University
0,3258,30080,"'""Sounds good to me,"" Cuomo responded, adding: ""It all started in Queens.'",['Cuomo'],The University of Queensland
0,3263,30116,"'To people of faith in our nation, houses of worship are sacred places,"" Assistant State Attorney General Eric Dreiband said in a statement.'",['Eric Dreiband'],Pennsylvania State University
0,3279,30210,"'In 2018, Sen. Amy\xa0Klobuchar said\xa0that she Ford “more credible” because Ford “had mentioned [the alleged Kavanaugh assault] before.'",['Amy\\xa0Klobuchar'],University of Oxford
0,3291,30238,"'These significant findings are consistent with independent observations in Europe and United States, and call for systematic studies addressing skin injury and repair in COVID-19+ patients as well as in their health care providers,"" said editor-in-chief Chandan K. Sen, distinguished professor at the Indiana University School of Medicine and executive director of Indiana University Health Comprehensive Wound Center, in a statement.\n'",['Chandan K. Sen'],Indiana University
0,3311,30368,"'According to Ohio Secretary of State Frank LaRose, another Republican, 1.9 million Ohioans requested vote-by-mail ballots, and more than 1.4 million cast their vote before the primary.\xa0'",['Frank LaRose'],Pennsylvania State University
0,3318,30408,"'As authorities try to address economic considerations without losing any hard-won gains from social distancing strategies, Josh Santarpia, a microbiology expert at the University of Nebraska Medical Center, said, “There will never be a perfect amount of protection.”\nCLICK HERE TO GET THE FOX NEWS APP\n'",['Josh Santarpia'],University of Nebraska Medical Center
0,3345,30520,"'This will be the final message from Saigon station,” CIA Chief Thomas Polgar wired to Washington.'",['Thomas Polgar'],University of Valencia
0,3356,30636,"'The experimental coronavirus treatment remdesivir has shortened the recovery time for COVID-19 patients, according to data from a new study cited by the U.S. government; insight from Fox News contributor Dr. Marty Makary, Johns Hopkins health policy expert.\n\n\n\n\n'",['Marty Makary'],Johns Hopkins University
0,3366,30710,"'Every opportunity and detail to recalibrate our acute neurological workflow to protect our frontline health care workers, our families, our colleagues and our patients should be sought, implemented and adapted to a resource-constrained environment,"" corresponding author Thanh Nguyen, professor of neurology, neurosurgery and radiology at Boston University School of Medicine (BUSM) and director of the neuroendovascular service at Boston Medical Center, said in a statement.\n'",['Thanh Nguyen'],Boston University
0,3405,30951,"'Personally I have a high degree of confidence about this vaccine because it’s technology that I’ve used before,” Sarah Gilbert, professor of vaccinology at Oxford University, told CBS News.\n'",['Sarah Gilbert'],University of Oxford
0,3432,31103,"'In fact, Ford\'s friend Leland Keyser would contradict her narrative, saying it ""just didn\'t make any sense.'",['Leland Keyser'],University of Oxford
0,3433,31111,"'Right now, we’re at the very beginning of trying to understand what that represents,” Dr. Mark Gorelik, of\xa0Columbia University Medical Center, told Reuters.\n'",['Mark Gorelik'],University of Nebraska Medical Center
0,3434,31163,"'I suspect this is America’s COVID Achilles heel and may cause higher morbidity and mortality rates than other regions,” Dr. Jennifer Lighter, hospital epidemiologist at New York University’s Langone Health, told Fox News.'",['Jennifer Lighter'],New York University
0,3486,31617,"'I suspect this is America’s COVID Achilles heel and may cause higher morbidity and mortality rates than other regions,” Dr. Jennifer Lighter, hospital epidemiologist at New York University’s Langone Health, told Fox News.'",['Jennifer Lighter'],New York University
0,3488,31621,"'By and large, there’s been enough food,"" Jayson Lusk, an economist at Purdue University, told the outlet.'",['Jayson Lusk'],Purdue University
0,3538,32074,"'And for more information on\xa0the coronavirus\xa0pandemic, watch\xa0""America Vs Virus""\xa0with\xa0Dr. Mehmet Oz,\xa0""Pandemics and Epidemics 101,""\xa0with Dr. Nicole\xa0Saphier,\xa0a full-time practicing physician at Memorial Sloan Kettering Cancer Center and\xa0""Fox Nation 101: Making Vaccines,""\xa0with\xa0Dr.\xa0Amesh Adalja, a senior scholar at the Johns Hopkins University Center for Health Security.\n'","['Nicole\\xa0Saphier,\\xa0a']",Johns Hopkins University
0,3550,32126,"'Debris and huge ancient beams that burned like kindling must be cleared from the soaring vaults, according to Notre Dame chaplain Brice de Malherbe.'",['Brice de Malherbe'],University of Notre Dame
0,3575,32347,"'Their secret space program advances technologies used in nuclear weapons delivery systems,” Secretary of State Mike Pompeo warned in a tweet Saturday.\n'",['Mike Pompeo'],Pennsylvania State University
0,3613,32685,"'Our study provides strong and convincing evidence of a link between coffee brewing methods, heart attacks and longevity,” said University of Gothenburg professor Dag S. Thelle.'",['Dag S. Thelle'],University of Gothenburg
0,3627,32839,'Beshear said that the recommendations from Republican Secretary of State Michael Adams would “ensure that Kentuckians can exercise their right to vote while remaining healthy at home.',['Michael Adams'],Pennsylvania State University
0,3634,32900,"'""What we celebrate at Easter reminds me of this virus that\'s going through our nation,"" said Deen.\n'",['Deen.\\n'],Northeastern University
0,3650,33066,"'""The behavior that\'s been revealed about Ellen is rat poison to the Ellen DeGeneres brand,"" brand expert Eric Schiffer, chairman of Reputation Management Consultants, told Fox News.'",['Eric Schiffer'],Stellenbosch University
0,3666,33140,"'On average, someone arrested for a homicide or shooting in Chicago had nearly 12 prior arrests, according to a University of Chicago study cited by Mangual.'",['Mangual'],University of Chicago
0,3676,33221,"'Secretary of State Mike Pompeo on Thursday said ""China caused an enormous amount of pain, loss of life and now a huge challenge for the global economy and the American economy as well by not sharing the information they had,” adding that the Communist Party still isn’t being transparent with the U.S.'",['Mike Pompeo'],Pennsylvania State University
0,3677,33244,"'Secretary of State Mike Pompeo told ""Hannity""\xa0Thursday that he knows many\xa0Americans are angry at China over the Beijing government\'s handling of the coronavirus outbreak in Wuhan and disclosed ""I know that the president feels the same way.""\n""China caused an enormous amount of pain, loss of life and now a huge challenge for the global economy and the American economy as well by not sharing the information they had,"" Pompeo said.\n'",['Mike Pompeo'],Pennsylvania State University
0,3678,33244,"'Secretary of State Mike Pompeo told ""Hannity""\xa0Thursday that he knows many\xa0Americans are angry at China over the Beijing government\'s handling of the coronavirus outbreak in Wuhan and disclosed ""I know that the president feels the same way.""\n""China caused an enormous amount of pain, loss of life and now a huge challenge for the global economy and the American economy as well by not sharing the information they had,"" Pompeo said.\n'",['Mike Pompeo'],Pennsylvania State University
0,3701,33520,"""Because we have this incredible repository of information, we were able to begin to look at what would be likely target cells for infection,” Alex Shalek, the paper's\xa0author and chemist at the Massachusetts Institute of Technology, told DailyMail UK.\n""",['Alex Shalek'],Massachusetts Institute of Technology
0,3731,33710,"'“Ford has always used motorsport to demonstrate innovation,” Ford’s Global Director of its Icon models, Dave Pericak, said in a press release.'",['Dave Pericak'],University of Oxford
0,3736,33754,"'Staying locked up in your house during the\xa0coronavirus pandemic can lead to stress and anxiety, triggering other potential health issues,\xa0according to Columbia University Lab Director Carol Ewing-Garber.\n'","[""Carol Ewing-Garber.\\n'""]",Columbia University
0,3761,33962,"'Our engineering students are hungry and eager to use their skills to do something to help out with this pandemic,” said Dr. Shreek Mandayam, a professor of electrical and computer engineering at Rowan University. \n\n      '",['Shreek Mandayam'],Brown University
0,3809,34281,"'""Times are tough for most Americans and most businesses,"" said Lahren, ""However, times don\'t appear to be that tough for Harvard University, which, according to its own annual financial report, celebrated its sixth budget surplus in June 2019, a\xa0budget surplus of dang-near $300 million dollars.'",['Lahren'],Harvard University
0,3817,34313,"'“Harvard did not apply for, nor has it received any funds through the U.S. Small Business Administration’s Paycheck Protection Program for small businesses,” Harvard spokesman Jason Newton said in a statement late Tuesday.'",['Jason Newton'],Harvard University
0,3820,34341,"'From the original SARS outbreak in 2003, we see that psychiatric illness is the most notable long-term outcome,” said Dr. Melissa Nolan, an infectious disease expert, and professor at the University of South Carolina.'",['Melissa Nolan'],University of South Carolina
0,3823,34364,"'It\'s a recognition of how difficult the situation could get in Russia,"" Ben Noble, a Russia expert at University College London told Foreign Policy. ""'",['Ben Noble'],University College London
0,3825,34373,"'The COVID infection is substantially more common in the population than\xa0we\'d realized prior to this study,""\xa0said Stanford University professor of medicine\xa0Dr. Jay Bhattacharya\xa0on Fox Nation\'s ""Uncommon Knowledge with Peter Robinson"".\n', 'To hear all of\xa0Dr. Jay Bhattacharya\'s interview, including why he said it is likely impossible to fully eradicate COVID-19, watch ""Uncommon Knowledge with Peter Robinson"" on Fox Nation.\n'","[""Jay Bhattacharya\\xa0on Fox Nation\\'s"", 'medicine\\xa0Dr']",Stanford University
0,3878,34853,"'I want to take this opportunity to say to people who actually didn’t cut their hair at home - thank you very much,” Erik Bjornsson, a hairdresser at Street Cut salon in downtown Copenhagen, told Reuters.\n'",['Erik Bjornsson'],University of Copenhagen
0,3881,34857,"'I want to take this opportunity to say to people who actually didn’t cut their hair at home - thank you very much,” Erik Bjornsson, a hairdresser at Street Cut salon in downtown Copenhagen, told Reuters.\n'",['Erik Bjornsson'],University of Copenhagen
0,3910,35103,"'This is a devastatingly racist Biden ad,"" The Nation senior editor Christopher Shay declared.\n'",['Christopher Shay'],National University of Singapore
0,3948,35427,"'We\'re partnering with researchers at Carnegie Mellon University to run a widespread survey across Facebook asking people what kind of symptoms they\'re feeling,"" Zuckerberg\xa0told George Stephanopoulos.\n'","[""George Stephanopoulos.\\n'""]",Carnegie Mellon University
0,3973,35592,"'We’re noticing that a lot of these individuals, once we believe that they have some systemic symptoms and should be tested, they’re testing positive,” Dr. Marjon Vatanchi, of Brown University Dermatology, told WLNE.'",['Marjon Vatanchi'],Brown University
0,4019,36048,"'We still probably need to be doing three times more testing than we’re doing now,” said Dr. Ashish K. Jha, director of the Global Health Institute at Harvard.'",['Ashish K. Jha'],Harvard University
0,4029,36091,"'We were not actively discussing going test-optional this spring,” Dean Joseph Duck of Tufts University told Fox News.'",['Joseph Duck'],Tufts University
0,4032,36152,"""It’s a little bit like forecasting the weather,” \xa0Dr. Christopher Murray, who helps create the model from the University of Washington's Institute for Health Metrics and Evaluation, told “America’s Newsroom” anchor Ed Henry on Friday.\n""","['Christopher Murray', 'Ed Henry']",University of Washington
0,4054,36334,"'It was immediate tears to the face and a call to my mom,"" says\xa0Amanda Sivin, a graduating senior at University of Michigan.'",['Sivin'],University of Michigan
0,4055,36334,"'Dr. Mike Haynie, Syracuse vice chancellor for strategic initiatives and innovation, says the move is to ""create a pathway for them to return to Syracuse University as graduate students, given the challenges that many of them may face on the job market.'",['Mike Haynie'],Syracuse University
0,4079,36502,"'If there is any uncertainty, do not respond to requests for information, and go straight to the source to verify legitimacy if possible,"" Owen said, adding that ""when Wells Fargo contacts a customer, for example, we will never ask for a card PIN, access code, or online banking password.'",['Owen'],Linköping University
0,4117,36823,"'CNN anchor Brooke Baldwin called Ford\'s testimony to the Senate Judiciary Committee was ""nothing short of extraordinary"" and a ""pivotal moment in American history.'",['Brooke Baldwin'],University of Oxford
0,4120,36823,"'Her colleague Brian Williams mocked GOP lawmakers for their tepid responses to Ford\'s allegation amid the Kavanaugh confirmation, saying, ""1965 called, wants their quotes back.'","['Brian Williams', 'Kavanaugh']",University of Oxford
0,4155,37050,"""The Duke and Duchess of Cambridge updated their charitable foundation's website and announced that it “will do all it can to support those on the front line of responding to COVID-19 in the U.K.”\nPRINCE WILLIAM, KATE MIDDLETON SNAG PRINCE HARRY, MEGHAN MARKLE'S SOCIAL MEDIA STAFFER AFTER SUSSEX ROYAL ENDS\nKATE MIDDLETON REVEALS THE 'BEST FAMOUS PERSON'""","[""MEGHAN MARKLE'S""]",William & Mary
0,4159,37073,"'Murray’s comments came after Dr. Ali Mokdad, the physician behind the influential coronavirus pandemic model at the University of Washington\'s Institute for Health Metrics and Evaluation, told Fox News last Friday that ""the worst is behind us as a country.', ""It's very positive as we move forward that the worst is behind us as a country.""",['Ali Mokdad'],University of Washington
0,4171,37155,"'Good hygiene is the number one precaution every person can take to protect themselves from COVID-19 and other viral infections,” Dr. David Cohn,\xa0chief medical officer and a gynecologic oncologist with The Ohio State University Comprehensive Cancer Center – Arthur G. James Cancer Hospital and Richard J. Solove Research Institute, told Fox News.'","['David Cohn,\\xa0chief']",Ohio State University
0,4176,37210,"'It\'s impossible for North Korea not to have a single case of coronavirus,"" Jung H. Pak, a former CIA analyst on North Korea,\xa0previously told Fox News.\n'",['Jung H. Pak'],University of Valencia
0,4248,37801,"'If the check you’re waiting for is delayed, you can thank this man,"" Harvard law professor Lawrence Tribe said in a tweet Wednesday morning.\xa0'",['Lawrence Tribe'],Harvard University
0,4257,37851,"'If the check you’re waiting for is delayed, you can thank this man,"" Harvard law professor Lawrence Tribe said in a tweet Wednesday morning.\xa0'",['Lawrence Tribe'],Harvard University
0,4265,37893,"'""To me, this study conveys one useful piece of information, which is that chloroquine causes a dose-dependent increase in an abnormality in the [electrocardiogram] that could predispose people to sudden cardiac death,"" Dr. David Juurlink, head of the division of clinical pharmacology at the University of Toronto, who was not involved with the study, told\xa0The New York Times.\n'",['David Juurlink'],University of Toronto
0,4279,38016,"'""Our men\'s soccer student-athletes have been outstanding representatives of the University in the classroom and on the field,” Cunningham continued.'",['Cunningham'],Ulm University
0,4285,38072,"'The University of Washington professor behind one of the most influential modelings of the\xa0coronavirus\xa0pandemic told ""Bill Hemmer Reports"" Tuesday that ""the worst is behind us as a country.""\n""As I said before,\xa0many states are seeing a decline.'",['Bill Hemmer'],University of Washington
0,4310,38201,"'It\'s impossible to build walls around something that spreads so insidiously,"" said Dr. Danny Avula, the state health department\'s area director who has noted that Canterbury has been doing its best.\n'",['Danny Avula'],University of Canterbury
0,4332,38340,"""Now that the primary season is over, President Obama can play the role of unifier-in-chief within the Democratic Party,” said Mo Elleithee, the founding executive director of Georgetown University's Institute of Politics and Public Service and a Fox News contributor.\n""",['Mo Elleithee'],Georgetown University
0,4372,38660,"'New York Presbyterian director of global health and emergency medicine\xa0Dr. Craig Spencer told Fox News Monday that New York City\xa0is ""not on the back side"" of the coronavirus pandemic yet, despite optimism from some officials that the curve of cases is beginning to flatten.\n'","['Craig Spencer', 'medicine\\xa0Dr']",New York University
0,4415,39049,"'While it is possible to contract the virus [from contaminated surfaces], the majority of transmission is probably going to be from respiratory droplets, which you\'re exposed to when you\'re around other people,"" Angela Rasmussen, a virologist at the Center for Infection and Immunity at Columbia University\'s Mailman School of Public Health told NPR.\n'",['Angela Rasmussen'],Columbia University
0,4417,39060,"'Michael McDonald, a political scientist at the University of Florida, told NPR that Wisconsin could prove to be a “canary in a coal mine” for November.\n'",['Michael McDonald'],University of Florida
0,4423,39096,"'The plan: for Brees to ""be groomed as the potential replacement for Cris Collinsworth on \'Sunday Night Football.\'""\nNBC Sports wants Brees to start working as an analyst for Notre Dame football games on Saturdays, and as a studio analyst for ""Football Night in America"" on Sundays, before potentially joining Mike Tirico, the eventual successor of Al Michaels, on ""Sunday Night Football,"" the Post added.\n'","['Cris Collinsworth', 'Mike Tirico']",University of Notre Dame
