,0,1,2,3,4
0,1669,16858,"'I suspect people were not as isolated from other people as we would have thought,” said Dr. Paul Hunter, a professor of medicine at the University of East Anglia in England.\n'",['Paul Hunter'],University of East Anglia
0,1670,16858,"""Obviously the quarantine hasn't worked, and this ship has now become a source of infection,” said Dr. Nathalie MacDermott, an outbreak expert at King's College London.\n""",['Nathalie MacDermott'],King’s College London
0,1671,16858,"'Boats are notorious places for being incubators for viruses,” said Arthur Caplan, a professor of bioethics at the New York University School of Medicine.'",['Arthur Caplan'],New York University
0,1682,17010,"""They don't get tired, they can be deployed all over a hospital, supervised by a small number of humans, to multiply a workforce,” said robotics expert Marcia O'Malley, a professor of mechanical engineering at Rice University in Houston, Texas.""","[""Marcia O'Malley""]",Rice University
0,1685,17015,"'Social support is a buffer and protective factor, so being in a state of isolation could make it very difficult to mourn loss and start with the grieving process,” Dr. Reggie Ferreira, associate professor at Tulane University within the School of Social Work, told Fox News.'",['Reggie Ferreira'],Tulane University
0,1738,17579,"""Other marine mammal species can produce similar types of percussive sound by slapping the water with their body or tail,”\xa0 Monash University's Alistair Evans, who was also involved in the study, said in a statement.\n""",['Alistair Evans'],Monash University
0,1740,17600,"'It normally takes years to develop a vaccine and bring it to the point that it is approved for use in humans,” Professor Brenda Hogue, of the Biodesign Institute Center for Immunotherapy, Vaccines and Virotherapy at Arizona State University, told Newsweek.'",['Brenda Hogue'],Arizona State University
0,1754,17753,"'Former Secretary of State John Kerry, who is in Des Moines as a Joe Biden surrogate, was overheard in a hotel restaurant Sunday warning of the very real ""possibility of Bernie Sanders taking down the Democratic Party -- down whole,"" according to an NBC News report.\n'","['John Kerry', 'Joe Biden']",Pennsylvania State University
0,1756,17801,"'""We saw this with avian influenza H5 N1, for example, in poultry markets... a similar situation,"" said Dr. Stephen Morse, who is a professor of epidemiology\xa0at the Columbia University Medical Center.\n'",['Stephen Morse'],Columbia University
0,1760,17844,"'Lewis continued in his berating of the Asian population and alleged that while he was a student at the University of Southern California, “[in] my experience, the Asians were the biggest cheaters of all.'",['Lewis'],University of Southern California
0,1775,18075,"'The risk of coronavirus to Americans without travel to endemic parts of China is considered low,” said Melissa Nolan, an assistant professor at the University of South Carolina’s School of Public Health, to Fox News.\n'","['Melissa Nolan', ""Fox News.\\n'""]",University of South Carolina
0,1780,18206,"'""I immediately ordered a box of masks online after I heard of the first US case,"" said Tina Liu, a Chinese student at the University of Washington, not far from Seattle.\n'",['Tina Liu'],University of Washington
0,1782,18208,"'""I immediately ordered a box of masks online after I heard of the first US case,"" said Tina Liu, a Chinese student at the University of Washington, not far from Seattle.\n'",['Tina Liu'],University of Washington
0,1793,18378,"'“Surgical masks will not prevent your acquiring diseases,” said Dr. William Schaffner, a professor of preventive medicine and infectious diseases at Vanderbilt University, and the medical director of the National Foundation for Infectious Diseases, to Fox News.\n'",['William Schaffner'],Vanderbilt University
0,1820,18766,"'As Secretary of State Mike Pompeo said in a\xa0statement,\xa0""No reasonable person can assert today that Hong Kong maintains a high degree of autonomy from China, given facts on the ground.'",['Mike Pompeo'],Pennsylvania State University
0,1845,19002,"'When the delivery platform takes 30 percent, it means almost all restaurants that are using the delivery platforms are running at break-even or actually at a loss for every time you place an order,""\xa0Travis Stoliker, co-owner of Saddleback BBQ in Lansing, Mich., said previously to the\xa0Lansing State Journal.\n'",['Stoliker'],Pennsylvania State University
0,1852,19021,"'We know our restaurants, Monarch Seafood, commercial fishermen, they\'ve all been hit by this,"" said Christy Passion, registered nurse at Queen\'s Medical Center, to Hawaii News Now.'","['Monarch Seafood', 'Christy Passion']",University of Nebraska Medical Center
0,1863,19058,"'We still do not have solid guidelines from the State and cannot in good faith, ask thousands of visitors to begin paying deposits and making travel plans without knowing the full commitment of the Governor, elected officials and other stakeholders in supporting the Convention.”\nMcDaniel and Kelly went on to say that a “successful convention” under RNC rules require “delegates, alternates, elected officials, guests and media to be in attendance as President Trump is nominated for a second term.'",['Kelly'],Pennsylvania State University
0,1890,19311,"'""Absentee ballots remain the largest source of potential voter fraud,""\xa0read\xa0the conclusion of a bipartisan 2005 report authored by the Commission on Federal Election Reform, which was chaired by former President Jimmy Carter and former Secretary of State James Baker.\n'","[""James Baker.\\n'"", 'Jimmy Carter']",Pennsylvania State University
0,1894,19317,"'""Absentee ballots remain the largest source of potential voter fraud,""\xa0read\xa0the conclusion of a bipartisan 2005 report authored by the Commission on Federal Election Reform, which was chaired by former President Jimmy Carter and former Secretary of State James Baker.\n'","[""James Baker.\\n'"", 'Jimmy Carter']",Pennsylvania State University
0,1898,19370,"'The last time there were two named storms before June was 2016, according to Phil Klotzbach, a research scientist with Colorado State University’s atmospheric science department.\n'",['Phil Klotzbach'],Colorado State University
0,1915,19470,"'""It is difficult to find a reliable estimate of the number of COVID positive patients who have no symptoms,"" Alan Smyth, the editor-in-chief of Thorax and professor at the University of Nottingham said in a statement.\n'","['Thorax', 'Alan Smyth']",University of Nottingham
0,1932,19634,"'""Absentee ballots remain the largest source of potential voter fraud,""\xa0read\xa0the conclusion of a bipartisan 2005 report authored by the Commission on Federal Election Reform, which was chaired by former President Jimmy Carter and former Secretary of State James Baker.\n'","[""James Baker.\\n'"", 'Jimmy Carter']",Pennsylvania State University
0,1935,19639,"'""Absentee ballots remain the largest source of potential voter fraud,""\xa0read\xa0the conclusion of a bipartisan 2005 report authored by the Commission on Federal Election Reform, which was chaired by former President Jimmy Carter and former Secretary of State James Baker.\n'","[""James Baker.\\n'"", 'Jimmy Carter']",Pennsylvania State University
0,1950,19718,"'State Rep. Savannah Maddox, R- Dry Ridge, had said Kentucky’s government made people ""prisoners in your own homes"" by restricting where they can and can\'t go.\n'","['Savannah Maddox', 'R- Dry Ridge']",Pennsylvania State University
0,1953,19740,"'Most of these babies were delivered full-term after otherwise normal pregnancies, so you wouldn’t expect to find anything wrong with the placentas, but this virus appears to be inducing some injury in the placenta,” said senior author Dr. Jeffrey Goldstein, assistant professor of pathology at Northwestern University Feinberg School of Medicine and a Northwestern Medicine pathologist.'",['Jeffrey Goldstein'],Northwestern University
0,1964,19838,"'CAN RETURN\nScottsale Mayor Jim Lane was less than pleased when the video turned up, telling the outlet that the images were “disturbing” and showed “a real lack of common sense and civic responsibility.'",['Jim Lane'],University of Canterbury
0,1973,19890,"'Our analyzer could be used to conduct other bio tests if suitable reagents are developed,"" said professor Manabu Tokeshi of Hokkaido University’s Faculty of Engineering\xa0in the statement.'",['Manabu Tokeshi'],Hokkaido University
0,1988,19956,"'Yoel says on his personal website that he received his PhD in Communication from the University of Pennsylvania by ""studying privacy and safety on gay social networks.'",['Yoel'],University of Pennsylvania
0,1989,19956,"'""Absentee ballots remain the largest source of potential voter fraud,""\xa0read\xa0the conclusion of a bipartisan 2005 report authored by the Commission on Federal Election Reform, which was chaired by former President Jimmy Carter and former Secretary of State James Baker.\n'","[""James Baker.\\n'"", 'Jimmy Carter']",Pennsylvania State University
0,1994,19961,"'""Absentee ballots remain the largest source of potential voter fraud,""\xa0read\xa0the conclusion of a bipartisan 2005 report authored by the Commission on Federal Election Reform, which was chaired by former President Jimmy Carter and former Secretary of State James Baker.\n'","[""James Baker.\\n'"", 'Jimmy Carter']",Pennsylvania State University
0,1998,19962,"'""Absentee ballots remain the largest source of potential voter fraud,""\xa0read\xa0the conclusion of a bipartisan 2005 report authored by the Commission on Federal Election Reform, which was chaired by former President Jimmy Carter and former Secretary of State James Baker.\n'","[""James Baker.\\n'"", 'Jimmy Carter']",Pennsylvania State University
0,2004,19983,"'Men are having worse health outcomes if they become infected, but when we think about the secondary impacts, here we see that women are being disproportionately affected,"" Canadian research\xa0Julie Smith from Simon Fraser University told CNN.'",['Smith'],Simon Fraser University
0,2018,20081,"'If you are breathing and talking, obviously droplets don’t travel as far, but they can travel far enough to affect your friend sitting opposite you, or someone who’s chatting to you,"" Julian Tang, a respiratory scientist at the University of Leicester, said on BBC News.\n'",['Julian Tang'],University of Leicester
0,2019,20084,"'If you are breathing and talking, obviously droplets don’t travel as far, but they can travel far enough to affect your friend sitting opposite you, or someone who’s chatting to you,"" Julian Tang, a respiratory scientist at the University of Leicester, said on BBC News.\n'",['Julian Tang'],University of Leicester
0,2021,20125,"'There is no doubt that college football will be played this upcoming season, according to Iowa State athletic director Jamie Pollard.\n'","[""Jamie Pollard.\\n'""]",Iowa State University
0,2029,20148,"'My wife, Clara, and I have always felt that we are very deep-rooted in New York,” Joe Tsai said in an interview on YES, which will be aired on Wednesday.'",['Joe Tsai'],Yeshiva University
0,2074,20536,"'""We know that our military has to stand ready to fight, regardless of COVID-19, and we just wanted to make a donation giving back to our service members,""\xa0Vanessa Benson, Ford\'s military ambassador and a retired Army colonel, told Fox News.\n'","[""Fox News.\\n'""]",University of Oxford
0,2082,20627,"'Two weeks after Denmark reopened their schools, a scientist in the Department of Infectious Diseases at Aarhus University said, ""There are no signs whatsoever that the partial reopening has caused the biggest spread of infection.'",['Denmark'],Aarhus University
0,2091,20716,"'Medicaid is open year round if you are a parent with kids who need coverage,” said Joan Alker, director of the Center for Children and Families at Georgetown University.'",['Joan Alker'],Georgetown University
0,2093,20717,'U.S. Secretary of State Mike Pompeo has called the proposal “a death knell for the high degree of autonomy” that Beijing promised the former British colony when it was returned to China in 1997.\n',['Mike Pompeo'],Pennsylvania State University
0,2105,20820,"'However, U.S. Secretary of State Mike Pompeo has called the proposal “a death knell for the high degree of autonomy” that Beijing promised the former British colony when it was returned to China in 1997.\n'",['Mike Pompeo'],Pennsylvania State University
0,2130,21096,"'The former full-time cast member of ""The Real Housewives of Beverly Hills"" shares sons Mason, 16, and Jake, 13, with her ex-husband, Eddie Cibrian.'",['Eddie Cibrian'],George Mason University
0,2132,21115,"'Once we get to college football season, our goal right now is to have college football season start as planned, with fans in stands,” Abbott said in an interview with Austin television station KXAN.'",['Abbott'],University of Texas at Austin
0,2158,21283,"'Mason later clarified to McEnany that he and his press colleagues ""celebrate"" the First Amendment right to freedom of religion but that the questions are not about whether President Trump is allowing Americans to ""pray,"" which McEnany shot back that he\'s allowing people to ""gather in their places of worship.""\nKAYLEIGH MCENANY CALLS OUT CNN FOR HAVING GUESTS WHO PUSHED RUSSIA COLLUSION, FOLLOWING TRANSCRIPT REVELATIONS\n'","['McEnany', 'Trump']",George Mason University
0,2169,21354,"'This mission’s incredible performance so far is a testament to the extraordinary skill and dedication of the OSIRIS-REx team,” said Dante Lauretta, OSIRIS-REx principal investigator at the University of Arizona, Tucson.'",['Dante Lauretta'],University of Arizona
0,2171,21376,"'""We all know these people: it\'s around one percent of the population,"" said Josef Penninger, the director of the Life Sciences Institute and professor of the department of medical genetics at the University of British Columbia, in a recent press release.'",['Josef Penninger'],University of British Columbia
0,2183,21439,"'U.S. Secretary of State Mike Pompeo accused Iranian Foreign Minister Javid Zarif of ""echoing Hitler\'s call for genocide""\xa0in a Friday morning tweet regarding an Iranian push for what organizers call a ""final solution"" referendum aimed at creating an official Palestinian state.\n'","['Javid Zarif', 'Mike Pompeo']",Pennsylvania State University
0,2218,21639,"'The spike is ""coming to us from somewhere and we want to make sure that we don\'t overwhelm either one of the hospitals and overwhelm the system with COVID patients to the point that we can\'t take care of you,"" said Dr. Adolphe Edward, El Centro Regional Medical Center\'s chief executive officer, in a video posted on his hospital\'s Facebook page.\n'",['Adolphe Edward'],Wageningen University and Research Center
0,2250,21808,"'The fact that Iran is behaving so aggressively, and trying to disrupt critical services in Israel, is very disturbing,” David Kennedy, founder/CEO of TrustedSec, and a former hacker for the NSA and U.S. Marine Corps told Fox News.'",['David Kennedy'],Kansas State University
0,2258,21884,"'just flip a switch and go from real low absentee ballots to 100 percent vote-by-mail,\xa0according\xa0to Washington Secretary of State Kim Wyman.'",['Kim Wyman'],Pennsylvania State University
0,2270,21974,"'The Baptist pastor posted video of the shredding on Twitter, in which he can be heard preaching: ""With this cease-and-desist letter in my hand, the Bible says to the New Testament church \'not forsaking the assembling of yourselves together as the manner of some is, but so much more as you see the day approaching,\' and the closer we get to Jesus coming back, the more church we ought to be having, not less church.'",['Jesus'],University of Notre Dame
0,2296,22189,"'I just wanted to try to urge you to see if there\'s a way to get by this problem of replacing the prosecutor general, you know, Shokin because per my perception, he\'s blocked the cleanup of the Prosecutor General\'s Office,"" then-Secretary of State John Kerry purportedly says at the beginning of one of the calls, on Dec. 3, 2015.\n'",['John Kerry'],Pennsylvania State University
0,2311,22256,"'I just wanted to try to urge you to see if there\'s a way to get by this problem of replacing the prosecutor general, you know, Shokin because per my perception, he\'s blocked the cleanup of the Prosecutor General\'s Office,"" then-Secretary of State John Kerry purportedly says at the beginning of one of the calls, on Dec. 3, 2015.\n'",['John Kerry'],Pennsylvania State University
0,2340,22320,"'Parts of the email had been\xa0previously released, but a\xa0section stating that\xa0then-FBI\xa0Director\xa0James Comey\xa0had suggested\xa0that the National Security Council (NSC)\xa0might not want to pass “sensitive information related to\xa0Russia” to Rice\'s designated sucessor, Michael Flynn, had been classified as ""TOP SECRET"" until Tuesday.\n'",['Michael Flynn'],Rice University
0,2390,22544,"'The idea that there will be a lot of “coronababies” is “widely perceived as a myth,” said Hans-Peter Kohler, a University of Pennsylvania fertility researcher.\n'",['Hans-Peter Kohler'],University of Pennsylvania
0,2391,22544,"'This unpredictable environment, and anxiety about the future, is going to make women think twice about having children,” said Dr. Denise Jamieson, chair of obstetrics and gynecology at Emory University.\n'",['Denise Jamieson'],Emory University
0,2397,22564,"'If just one out of every four former transit commuter switched to driving, the average car trip would increase by over seven minutes,\xa0according to an analysis\xa0by Vanderbilt University engineering professor Dan Work.\n'","[""Dan Work.\\n'""]",Vanderbilt University
0,2408,22588,"'Avery W. Katz, formerly a vice dean at the law school whom Columbia currently\xa0bills as a ""Professor of Organizational Character,"" lashed out when Fox News pointed out that he signed the\xa0open letter\xa0in the Times\xa0calling for Kavanaugh\'s nomination to be pulled in 2018 amid sexual assault allegations.'",['W. Katz'],Columbia University
0,2411,22588,"'Gordon told Fox News, however, that he\xa0""tended to believe Ford\'s allegations.'",['Gordon'],University of Oxford
0,2421,22723,"'Manke’s attorney, Dave Kallman, told the\xa0Lansing State Journal\xa0that the state’s action against the 77-year-old barber was “an abuse of power.”\n'","['Dave Kallman', 'Manke']",Pennsylvania State University
0,2423,22739,"'Kylie Jenner attends The Metropolitan Museum of Art\'s Costume Institute benefit gala celebrating the opening of the ""Camp: Notes on Fashion"" exhibition on Monday, May 6, 2019, in New York.\n      '",['Kylie Jenner'],Dartmouth College
0,2453,22936,"'As self-isolation escalates and people find themselves working from home and unable to physically catch up with their friends and family, we’re likely to see more people feel lonely and disconnected,” said lead researcher and University of South Australia PhD candidate Jacinta Brinsley, in a statement.\n      ', 'As self-isolation escalates and people find themselves working from home and unable to physically catch up with their friends and family, we’re likely to see more people feel lonely and disconnected,” said lead researcher and University of South Australia Ph.D. candidate Jacinta Brinsley, in a statement.'",['Jacinta Brinsley'],University of South Australia
0,2454,22936,"'As self-isolation escalates and people find themselves working from home and unable to physically catch up with their friends and family, we’re likely to see more people feel lonely and disconnected,” said lead researcher and University of South Australia PhD candidate Jacinta Brinsley, in a statement.\n      ', 'As self-isolation escalates and people find themselves working from home and unable to physically catch up with their friends and family, we’re likely to see more people feel lonely and disconnected,” said lead researcher and University of South Australia Ph.D. candidate Jacinta Brinsley, in a statement.'",['Jacinta Brinsley'],University of South Australia
0,2473,23017,"'Long Island State Veterans Home in Stony Brook, L.I.\xa0(Google Maps)\n      \n\n\nOn Monday at his daily coronavirus news briefing, Cuomo appeared to walk back remarks he made the previous day saying older people are going to die from the virus, ""despite whatever you do,"" according to WRGB-TV.\n'","['L.I.\\xa0(Google', 'Cuomo']",Stony Brook University
0,2479,23070,"'By mailing applications, we have ensured that no Michigander has to choose between their health and their right to vote,” Secretary of State Jocelyn Benson wrote in a statement.\n'",['Jocelyn Benson'],Pennsylvania State University
0,2480,23077,"'We know that these markers are present in the very sick patients and at lower levels in some patients with normal Kawasaki disease,” Michael Levin, a professor of pediatrics and international child health at Imperial, told The Guardian.\n'",['Michael Levin'],Imperial College London
0,2491,23157,"'Royal author Leslie Carroll, who detailed the couple’s courtship in her book “American Princess: The Love Story of Meghan Markle and Prince Harry,” told Fox News she suspects their relationship will only flourish in America, a place far away from British tabloids that provides them the freedom to pursue life on their terms.\n'",['Leslie Carroll'],"Royal Holloway, University of London"
0,2518,23303,"'GIANT SANDSTORM LOOMS OVER CITY IN INDIA, DRAMATIC PHOTOS REVEAL\n""ACTIV’s partners have embraced the spirit of a principle attributed to President Harry S. Truman: \'It is amazing what you can accomplish if you do not care who gets the credit,\'"" the scientists conclude.'",['Harry S. Truman'],Indiana University
0,2541,23516,"'Royal expert Katie Nicholl has no doubt that the Duke and Duchess of Sussex “had an agenda from the outset” to become independent.\n', 'They had an agenda from the outset —\xa0to be international royals,” she said, adding there were signs early on in their relationship that the couple was determined to do things differently.\n'",['Katie Nicholl'],"Royal Holloway, University of London"
0,2543,23544,"'While rural areas are typically under-resourced and disadvantaged as it comes to health and health care, a model like this shows that rural places can be particularly nimble and flexible,” Carrie Henning-Smith, the deputy director of the University of Minnesota’s Rural Health Research Center, told the New York Times.\xa0\n'",['Carrie Henning-Smith'],University of Minnesota
0,2600,24203,"'When people get asked about God, they often interpret it immediately as power,” said Lofton, who collaborated with researchers from the University of Chicago and other universities, along with The Associated Press, on the design of the new poll.'",['Lofton'],University of Chicago
0,2601,24203,"'David Emmanuel Goatley, a professor at Duke University’s divinity school who was not involved with the survey, said religious black Americans’ view of godly protection could convey “confidence or hope that God is able to provide -- that does not relinquish personal responsibility, but it says God is able.'",['David Emmanuel Goatley'],Duke University
0,2608,24235,"'The best way to control infectious disease [is] where a vaccine comes in,""\xa0Dr. Amesh Adalja, a Senior Scholar with the Johns Hopkins University Center for Health Security tells Fox News.'",['Amesh Adalja'],Johns Hopkins University
0,2739,26074,"'However, Melissa Nolan, and assistant professor of epidemiology and biostatistics at the University of South Carolina, contended that the seven-day rule might be sufficient and that the ""original 14-day quarantine isolation window was a conservative estimate of what the anticipated incubation period might be.'",['Melissa Nolan'],University of South Carolina
0,2762,26234,"'We’re risking a backslide that will be intolerable,” said Dr. Ian Lipkin of Columbia University’s Center for Infection and Immunity.\n'",['Ian Lipkin'],Columbia University
0,2792,26460,"'In a piece in The New York Times, Apoorva Mandavilli writes, ""Jennifer Nuzzo, an epidemiologist at Johns Hopkins University\'s Bloomberg School of Public Health, said the decision to reopen schools cannot be made based solely on trying to prevent transmission.'","['Jennifer Nuzzo', 'Apoorva Mandavilli']",Johns Hopkins University
0,2829,26807,"'Dr. Jason’s updates and the daily diaries from the neonatal [unit] were my lifelines,” said Stuart, who shares two other children with Dawson: Grace, 5, and Ava, 11 months.\n'","['Dawson', 'Stuart', 'Grace']",Laval University
0,2865,26968,"'If you could do a brilliant job,” Walder writes of her time at CIA, “nothing outside of that\xa0—\xa0not race, religion, or sexual orientation mattered.”\n'",['Walder'],University of Valencia
0,2883,27182,"'It really shows that most people do develop antibodies and that there’s very good correlation between those antibodies and their capability to neutralize the virus,” Columbia University virologist Dr. Angela Rasmussen told The Times.\n'",['Angela Rasmussen'],Columbia University
0,2899,27321,"'And for more information on\xa0the coronavirus\xa0pandemic, watch\xa0""America Vs Virus""\xa0with\xa0Dr. Mehmet Oz,\xa0""Pandemics and Epidemics 101,""\xa0with Dr. Nicole\xa0Saphier,\xa0a full-time practicing physician at Memorial Sloan Kettering Cancer Center and\xa0""Fox Nation 101: Making Vaccines,""\xa0with\xa0Dr.\xa0Amesh Adalja, a senior scholar at the Johns Hopkins University Center for Health Security.\n'","['Nicole\\xa0Saphier,\\xa0a']",Johns Hopkins University
