,0,1,2,3,4
0,4284,340.0,"['Barr made his remarks at the Center for Strategic and International Studies in Washington, reminding his audience that the Communist Party remains in control of the Chinese economy and is “authoritarian through and through.”\nCHINA OPENS SECOND NEW HOSPITAL BUILT FOR CORONAVIRUS PATIENTS\n\n\n“Their goal is the eventual demise of capitalism,” the attorney general said.']",['Barr'],Center for Strategic and International Studies
0,4286,342.0,"['“China wants the fruits of America’s brainpower to harvest the seeds of its planned economic dominance,” said\xa0John Demers,\xa0the assistant attorney general for the National Security Division.']",['John Demers'],Vision
0,4312,371.0,"['""I am directing all APA pilots to cease flight operations between the United States and China,"" said APA president Eric Ferguson.']",['Eric Ferguson'],Asian Forum Japan
0,4380,442.0,"['”The whole airport screening exercise is to simply give people comfort that there is some government action to protect the public,” Ramanan Laxminarayan, director of the Center for Disease Dynamics, Economics  Policy in Washington, D.C., said, according to Bloomberg.']",['Ramanan Laxminarayan'],"The Center for Disease Dynamics, Economics & Policy"
0,4387,449.0,"['""Investigations into this novel coronavirus are ongoing and we are monitoring and responding to this evolving situation,” said Martin Cetron,\xa0director of the CDC’s Division of Global Migration and Quarantine.']",['Martin Cetron'],Vision
0,4390,452.0,"['Ahead of the 80th anniversary of D-Day in 2024, Hervé Morin, president of the Normandy region, said he hopes to create a permanent attraction marking the historic invasion, The Local reported on Tuesday.']",['Hervé Morin'],Foundation for Local Government Reform 
0,4405,468.0,"['""I think the populations in\xa0those countries are now seeing most clearly the risk the Chinese Communist Party presents,"" Pompeo said.']",['Pompeo'],Party School of the Communist Party of China Inner Mongolia Autonomous Region
0,4429,495.0,"['Marshall said,\xa0in her view, this could disqualify top contenders like Sens.']",['Marshall'],Copenhagen Consensus Center
0,4443,512.0,"['“Voting by mail is now common enough and problematic enough that election experts say there have been multiple elections in which no one can say with confidence which candidate was the deserved winner.”\nThe old Times piece also noted, “voting in person is more reliable, particularly since election administrators made improvements to voting equipment after the 2000 presidential election.”\nTHE LATEST FROM FOX NEWS ON THE 2020 PRESIDENTIAL CAMPAIGN\nEarlier this month, Trump turned up the volume in his full-court press against the moves by some states to make voting by mail easier due to\xa0health concerns with in-person voting amid\xa0the coronavirus pandemic.']",['Trump'],The Times Think Tank
0,4445,514.0,"['“Eight years ago, the Times declared that ‘the flaws of absentee voting raise questions about the most elementary promises of democracy.’ Now that Trump is raising those same questions, the publication says doing so is illegitimate.']",['Trump'],The Times Think Tank
0,4459,531.0,"['You see states doing very different things,” said Todd Myers, an author and the director of the Center for the Environment at the Washington Policy Center.']",['Todd Myers'],Center for Development and the Environment
0,4509,582.0,['Sources within the Democratic Party say that Biden’s team say the two top contenders for the nod are Sens.'],['Biden'],Copenhagen Consensus Center
0,4513,587.0,"['“It was a very useful meeting and, as we had said from the start, football was always going to resume when we had the conditions to ensure safety and the CTS gave the all-clear to the protocols,” Spadafora said.']",['Spadafora'],Public Policy Projects
0,4540,616.0,"['For me, that’s my biggest worry,” said Thompson, who signed with the Jacksonville Jaguars this month after seven seasons with the Washington Redskins.']",['Thompson'],EDSK
0,4542,618.0,"['“You’d have these billionaire (team) owners that are probably social distancing in their boxes, while you have guys on the field playing a game with no fans,” said Kelvin Beachum, an NFL free agent.']",['Kelvin Beachum'],Dragonfly
0,4599,685.0,"['CLICK HERE TO GET THE FOX NEWS APP \n""Despite the terrible losses seen and the many difficulties Americans have faced to-date in this pandemic, we\'re still probably only in the early stages,"" said Josh Michaud, associate director of global health policy with the Kaiser Family Foundation in Washington, D.C.\n""In the U.S., we could be looking at a long pandemic summer with a slow burn of cases and deaths.']",['Josh Michaud'],Kaiser Family Foundation
0,4628,717.0,"['“Our system needs no input from people from order to delivery, and tables were sparsely arranged to ensure smooth movements of the robots, which fits with the current ‘untact’ and distancing campaign,” said Lee Dong-bae, the director of research at Vision Semicon, per Reuters.']",['Lee Dong-bae'],Vision
0,4636,725.0,"['“Sleep can, at times, seem like an expendable luxury,” said Orfeu M Buxton, PhD, with Harvard’s Division of Sleep Medicine, had previously said on the findings of similar research.']",['Orfeu M Buxton'],Vision
0,4637,726.0,"['Every time I tweet about China, calling them out about covering up the virus, calling them out for the repressing of millions of Muslims, its own citizens, and its maleficence around the world, there is an explosion of kind of counter-attacks.”\nCLICK HERE FOR FULL CORONAVIRUS MAP\nMeantime, Waltz said that the Heritage Foundation found 24 cases of voter fraud, including seven involving mail-in ballots since 2015.']",['Waltz'],Heritage Foundation
0,4722,837.0,['Miami Dolphins team owner Stephen Ross said Tuesday he was confident the 2020 NFL season will restart soon\xa0and he is planning on having fans in the stadiums despite the ongoing coronavirus pandemic.'],['Stephen Ross'],Dragonfly
0,4792,917.0,"[""So we're planning for full stadiums.”\nVincent said that while packed stadiums is the goal, the NFL is also making plans for adjusted capacities depending on the state of the coronavirus pandemic when the season begins.""]",['Vincent'],Dragonfly
0,4803,929.0,"['""It\'s something that just\xa0stirs your blood a little bit,""\xa0said Jones, a Fox News contributor, on ""Fox  Friends"" Monday, calling it a ""cheap"" attempt by the Times to generate attention and ""relevance.""']",['Jones'],The Times Think Tank
0,4821,948.0,"['Perry said he believed he’s ready to move forward at Tyler Perry Studios to produce his own content such as the BET series “Sistas” and “The Oval.” The Hollywood Reporter obtained\xa0a 30-page production protocol document to cast, detailing health measures from testing in their hometown, traveling on a Perry-arranged private jet and doing another rapid test.']",['Perry'],Better Cities Project
0,4852,979.0,"['Coronavirus lockdowns may be ""killing"" just as many people as the virus because many people with serious conditions unrelated to the virus have been skipping treatment, Hoover Institution senior fellow Dr. Scott Atlas said Saturday on ""Fox Report.""']",['Scott Atlas'],"Hoover Institution on War, Revolution and Peace"
0,4868,995.0,"['He’s a Superbowl QB  should be playing bc [sic] his stats show that,” she said in a tweet with a screenshot of Kapernick’s player profile page on the NFL’s website which, at the time, listed him as retired.']",['Kapernick'],Dragonfly
0,4871,998.0,"['As China continues to bully economies, Matthew Henderson -- director of the Asia Studies Center at the Henry Jackson Society, and one of the authors of the report -- said that to turn this around requires a ""decoupling"" of the U.S. and Chinese economy and the forming of new partnerships in the Indo-Pacific region.']",['Matthew Henderson'],Henry Jackson Society
0,4895,1023.0,"['“The @nytimes is a total mess!”\nEarlier this month, the Times said one of its reporters “went too far” in criticizing the Trump administration’s response to the coronavirus outbreak.']",['Trump'],The Times Think Tank
0,4917,1050.0,"['Robert Sirico, president of the Acton Institute for the Study of Religion and Liberty, said Friday that churches have been prepared to combat coronavirus and have been planning how to mitigate risks as parishioners seek to return to the pews.']",['Robert Sirico'],Acton Institute
0,4930,1063.0,"['“You can make a mask for someone, you can go to the store or deliver someone’s groceries for them,” said Dhani Jones, former NFL linebacker and Stand Together Live host.']",['Dhani Jones'],Dragonfly
0,4939,1072.0,"[""Someone who helped\xa0organize the event tested positive for the virus and came into contact with other workers,\xa0said\xa0Kris Ehresmann, director of the state Health Department's\xa0Infectious Disease Division.""]",['Kris Ehresmann'],Vision
0,5022,1158.0,"['""My filet mignon says you’re wrong,"" filmmaker Robby Starbuck told the Times.']",['Robby Starbuck'],The Times Think Tank
0,5084,1226.0,"['We are using the most up-to-date data and resources to support our team members, and we are committed to ensuring they feel safe and secure when they come to work.”\nCLICK HERE TO GET THE FOX NEWS APP\n“Our team members are essential to helping to feed the nation, and their health and safety is always our first priority,” Complex Manager Kevin Taylor said.']",['Kevin Taylor'],International Science Complex Astana
0,5097,1240.0,"['What we found is that these children can be the most effective lobbyist on the Hill,” McCaul said.']",['McCaul'],The Beacon Hill Institute
0,5174,1326.0,"['“I don’t have to say it if they feel so strongly about it, we’ll see.”\nHarris, along with Sens.']",['Harris'],Copenhagen Consensus Center
0,5178,1330.0,"['""The Iraqi Security Forces conducted more than 25 operations against ISIS terrorists in the past week,"" Col. Myles B. Caggins III, Coalition spokesman, said\xa0on Wednesday.']",['Myles B. Caggins III'],International Crisis Group
0,5179,1331.0,"['""With its continued spree of attacks in Africa, ISIS has made special mention of attacks on Christians, part of its Ramadan conquest,"" Gluck said.']",['Gluck'],International Crisis Group
0,5185,1337.0,"[""OCASIO-CORTEZ CHEERS AS AMAZON REPORTEDLY RECONSIDERS NY HQ AFTER FIERCE OPPOSITION\n“With New York City expected to lose 500,000 jobs due to the pandemic, AOC's brand of left-wing politics has no place in New York or anywhere else,” he said.""]",['OCASIO-CORTEZ'],Amazon Environmental Research Institute
0,5199,1355.0,"['“Our goal is 50,000 runners committed to running or walking in honor of the fallen,” Hallett said, noting that the organization has partnered with Amazon, VISA and more to make the event happen.']",['Hallett'],Amazon Environmental Research Institute
0,5270,1429.0,"['“That protocol was developed with a lot of input from not only infectious disease and public health expects, but the CDC and others,"" Dr. Allen Sills, the NFL\'s chief medical officers, said of the league\'s phased program for reopenings.']",['Allen Sills'],Dragonfly
0,5296,1457.0,"['NFL ANNOUNCES NEW STEPS TO ENHANCE DIVERSITY\n“I also want to be on the field, and that’s why I’m still doing it, is because I still enjoy playing the game,” Fitzpatrick said.']",['Fitzpatrick'],Dragonfly
0,5301,1462.0,"['""We believe these new policies demonstrate the NFL Owners\' commitment to diversity, equity\xa0and inclusion in the NFL,"" Pittsburgh Steelers owner and Chairman of the Workplace Diversity Committee Art Rooney II said in a statement.']",['Art Rooney II'],Dragonfly
0,5302,1463.0,"['“The NFL is committed to diversity, equity, and inclusion, which I believe is critical to our continued success,"" Goodell said in a statement.']",['Goodell'],Dragonfly
0,5313,1475.0,"['“This defendant allegedly sought to steal millions of dollars in loans intended to aid legitimate small businesses grappling with the economic effects of COVID-19,” said Assistant Attorney General Brian A. Benczkowski of the Justice Department’s Criminal Division.']",['Brian A. Benczkowski'],Vision
0,5438,1604.0,"['“Qatari authorities should move quickly to avoid wider spread of coronavirus that risks infecting prisoners, prison staff, and Doha residents,” said\xa0Michael Page, deputy Middle East director at Human Rights Watch.']",['Michael Page'],Human Rights Watch
0,5478,1647.0,"['Rated: TV-PG\nWhere to stream it: Hulu, Amazon Prime, CBS All Access\nTHE BEST REALITY SHOWS ON AMAZON PRIME VIDEO\n""Hell\'s Kitchen""\n\n      Gordon Ramsay, host of \'Hell\'s Kitchen.\'']",['Gordon Ramsay'],Amazon Environmental Research Institute
0,5484,1653.0,['Spanish Prime Minister Pedro Sánchez on Saturday said he will ask Parliament for what he hopes will be the last extension of the state of emergency.'],['Pedro Sánchez'],Parliamentary Institute of Benin
0,5486,1655.0,"['“We are seeing that in places that are opening, we’re not seeing this spike in cases,” Azar said on CNN’s “State of the Union” program.']",['Azar'],The Union of Albanian Roma 
0,5563,1739.0,"['Fox 31 obtained a statement from Polis’ office after the death count was reduced that said the governor fully supported efforts by the health department to specify how many deaths were specifically due to COVID-19 “and not just specific to CDC guidelines that include people who died with Coronavirus but not necessarily from it.”\nCLICK HERE TO GET THE FOX NEWS APP\n“State epidemiologists believe that once the data is up to date then the number will, unfortunately, be higher,” the statement concluded.']",['Fox 31'],POLIS Institute
0,5622,1806.0,"['""I think we take our eye off the ball, in something like a pandemic, and ISIS drives a truck right through it —\xa0literally,"" said Mann on ""Fox and Friends"" on Friday.']",['Mann'],International Crisis Group
0,5623,1807.0,"['“We don’t believe this syndrome is very common, but several cases have been reported elsewhere in association with COVID-19,” said Dr. Paul Cieslak, the medical director for infectious diseases and immunizations at the OHA Public Health Division, in a statement.']",['Paul Cieslak'],Brookings Doha Center
0,5664,1849.0,"['While Yellow later tested positive for COVID-19, Deavers said his death\xa0had nothing to do with the coronavirus.']",['Deavers'],Yellowhead Institute
0,5724,1909.0,"['ILO Director-General Guy Ryder told the briefing that by comparison, only 22 million full-time jobs were lost immediately when the financial crisis hit in 2008-2009, “so you can see we’re in an entirely different place.”\nRyder said it’s also often forgotten that 60 percent of the global workforce of 3.3 billion have jobs in the informal economy, most of them women.']",['Guy Ryder'],Bariloche Foundation
0,5725,1910.0,"['I call on all ASEAN governments to do the same,"" Pompeo said in a statement last month, according to NPR.']",['Pompeo'],ASEAN Parliamentarians for Human Rights
0,5765,1953.0,"[""NFL ROOKIES SURPRISE THEIR MOMS WITH NEW CARS ON MOTHER'S DAY\n“Sweat does not do it,” Fauci said.""]",['Fauci'],Dragonfly
0,5768,1956.0,"['“We found it was easier to tell the guests where not to stand and then leave the empty space where they can stand,” said Andrew Bolstein, the SVP of operations at Shanghai Disneyland, during a tour of the park, per the O.C.']",['Andrew Bolstein'],Kyoto Club
0,5796,1986.0,"['""Even though the relationship of this syndrome to COVID-19 is not yet defined, and not all of these cases have tested positive for COVID-19 by either DNA test or serology, the clinical nature of this virus is such that we are asking all providers to contact us immediately if they see patients who meet the criteria we’ve outlined,"" Dr. Oxiris Barbot, the commissioner of the New York\xa0City\xa0Department of\xa0Health\xa0and Mental Hygiene, said in a statement, the Times reported.']",['Oxiris Barbot'],The Times Think Tank
0,5807,1997.0,"['“It’s hard to think of another census when there’s been this disruption nationwide,” said D’Vera Cohn, a census expert at the Pew Research Center.']",['D’Vera Cohn'],Pew Research Center
0,5822,2012.0,"['“If we relax these measures without having the proper public health safeguards in place, we can expect many more cases and, unfortunately, more deaths,” said Josh Michaud, associate director of global health policy with the Kaiser Family Foundation in Washington.']",['Josh Michaud'],Kaiser Family Foundation
0,5885,2080.0,"['CLICK HERE TO GET THE FOX NEWS APP\n“In preparing to play the season as scheduled,"" NFL Commissioner Roger Goodell said, ""we will continue to make our decisions based on the latest medical and public health advice, in compliance with government regulations, and with appropriate safety protocols to protect the health of our fans, players, club and league personnel, and our communities.""']",['Roger Goodell'],Dragonfly
0,5896,2091.0,"['No NFL drafts,” Ferguson said.']",['Ferguson'],Dragonfly
0,5912,2108.0,"['“I think that the commonality is that we all know there’s a problem there,” said Greg Lawson, a research fellow at the right-leaning Buckeye Institute.']",['Greg Lawson'],Buckeye Institute
0,5942,2139.0,"[""World Vision site manager Sandy Aguila-Rosa said the number of families he's reaching\xa0is significant, even in the peak of the outbreak.""]",['Sandy Aguila-Rosa'],Vision
0,6001,2202.0,"['(AP)\n\n\n""We have to prepare ourselves for the hardest, ugliest part,"" said Dr. Mauricio Rodríguez\xa0of Mexico\'s National Autonomous University.']",['Mauricio Rodríguez'],Centre for Interdisciplinary Research in Sciences and Humanities - National Autonomous University of Mexico
0,6013,2215.0,"[""Despite being on a seven-game winning streak when the season was suspended on March 12 due to the coronavirus pandemic, the Kings are still 14 points behind the Nashville Predators and Vancouver Canucks for the second wild card in\xa0the Western Conference -- but Blake says that's no reason that the team should have any less interest in resuming the current season.""]",['Blake'],Brookings Doha Center
0,6015,2217.0,"['But Karl Hamalainene,\xa0chief researcher at the VATT Institute for Economic Research, said a universal basic income would be ""expensive” and, based on the results of the study, “unsustainable.”\n“This was a big carrot, and we can see it didn’t fully work,” he said.']",['Karl Hamalainene'],Economic Research Institute
0,6037,2240.0,"['“If I were to name the number of tests that I was asked about in teleconferences with other professional leagues, with American professional leagues, with clubs from the NFL, the NHL, Major League Baseball and others, and I tell them how many tests are possible in Germany, they generally check, or there’s silence, because it’s just unimaginable in the situation over there.”\nOnly about a third of Germany’s massive testing capacity of almost 1 million a week is being currently used, said Lars Schaade, the deputy head of the Robert Koch Institute.']",['Lars Schaade'],Dragonfly
0,6045,2248.0,"['Manuel Gil, of llenatubar.com, a company that makes the screens, said: “They allow you to see each other but the famous drops (of saliva) cannot reach the other person,” he told Telemadrid television.']",['Manuel Gil'],Vision
0,6130,2338.0,"['Canadian farmers are a driving force in our business and we hope Canadians\' love for our fries will allow us to not only make a significant donation to the Canadian Red Cross, but also reinforce our support for Canadian potato farmers while making a positive impact on their business.”\nFOLLOW US ON FACEBOOK FOR MORE FOX LIFESTYLE NEWS\n“This is a unique time for Canadians as local communities prepare for and respond to disasters, while also trying to mitigate the impact of COVID-19 and other unforeseen events that may occur,"" Canadian Red Cross President and CEO Conrad Sauvé said.']",['Conrad Sauvé'],Red Cross / Red Crescent Climate Centre
0,6179,2393.0,"[""However, while Ocasio-Cortez has not given much indication she’s eyeing up a spot at Turtle Bay, the Times said that the column got her attention, and she noted the U.N. headquarters'\xa0closeness to her own district in Queens.""]",['Ocasio-Cortez'],The Times Think Tank
0,6180,2394.0,"['The Times profile says she barely hides her lack of enthusiasm for Biden but gave some thin praise by saying he has a “soothing effect” on traditional voters, which could give him some room to shift to the left.']",['Biden'],The Times Think Tank
0,6203,2424.0,"['Six days after the warning from Taiwan, the WHO released a statement claiming that “based on the preliminary information from the Chinese investigative team, no evidence of significant human-to-human transmission and no health care worker infections have been reported.”\nTaiwanese officials reportedly received an email from the WHO, instead, saying that their inquiry “would not be posted on the organization’s international website for the benefit of member countries.”\nTaiwan’s vice president also accused the WHO of ignoring their warning, saying: “While the WHO’s IHR internal website provides a platform for all countries to share information on epidemics and their response, none of the information shared by our country’s CDC was put up there.”\n“When you look at what our committee has discovered so far, it seems pretty clear that the WHO under Tedros’ leadership ignored its own legally binding regulations by ignoring warnings from Taiwan and from their own collaborating center,” Foreign Affairs GOP committee spokesperson Leslie Shedd told Fox News.']",['Leslie Shedd'],Eurasian Council on Foreign Affairs
0,6298,2526.0,"['But\xa0Drollinger said his words were misrepresented by the mainstream media, and HUD blasted the media for being ""nothing more than activists with a political agenda"" after the headlines linked the pastor\'s blog post to coronavirus and\xa0homosexuality.']",['Drollinger'],Hudson Institute
0,6309,2538.0,"['“While we believe the best measure to keep everyone healthy is to require face coverings, for those who want an empty seat next to them for extra peace of mind or simply additional comfort, we are now offering ‘More Room,’” said Frontier CEO Barry Biffle in a media release.']",['Barry Biffle'],Frontier Centre for Public Policy
0,6361,2599.0,"['""I\'m 100 percent convinced that without Chinese Communist Party deception the virus wouldn\'t be here in\xa0the United States,"" Graham said.']",['Graham'],Party School of the Communist Party of China Inner Mongolia Autonomous Region
0,6416,2656.0,"[""“While the NFL's many fans in London, the UK, and Europe will obviously be disappointed by this news, it is absolutely the right decision to ensure the safety of everyone involved in the sport,” London Mayor Sadiq Khan said.""]",['Sadiq Khan'],Dragonfly
0,6478,2723.0,"['With its schedule set for release next week, NFL spokesman Brian McCarthy said that the regular season is expected to start as planned on Sept. 10, and the Super Bowl in Tampa Bay is still set for Feb. 7, ESPN reported.']",['Brian McCarthy'],Dragonfly
0,6542,2789.0,"[""If NFL does not come back for betting action this Fall, I can't imagine what the books are going to look like,” Sevransky said, adding that “a lot of sports betters are going to have to make some hard choices.” \nLAS VEGAS REELING FROM CORONAVIRUS' ECONOMIC IMPACT: MILLIONS OF TOURISTS TO 'VIRTUALLY ZERO'\nSportsbooks have already missed out on the NCAA basketball tournament, which brought in nearly $500 million in bets and over $35 million in winnings for Nevada sportsbooks, according to the Las Vegas Review-Journal.""]",['Sevransky'],Dragonfly
0,6543,2790.0,"[""Whether it's NFL and empty stadiums, as it's likely to be, that league is too big to shut down,” Sevransky said, adding that he wouldn’t be surprised to see the NBA, MLB, and NHL all try\xa0to get going again as the country starts to reopen in summer and spring months.""]",['Sevransky'],Dragonfly
0,6558,2807.0,"['This is certainly true in forecasting a pandemic involving a novel –or new – virus about which not a lot is known,"" said Peter Brookes, a senior research fellow at The Heritage Foundation.']",['Peter Brookes'],Heritage Foundation
0,6560,2809.0,"['“China has traditionally operated in the information space as an actor that tries to prop itself up,” said Kristine Lee, an associate fellow with the Asia-Pacific Security Program at the Center for a New American Security.']",['Kristine Lee'],Center for a New American Security
0,6586,2838.0,"['— Richard McGregor, senior fellow Lowy Institute\xa0""If they are sending much-needed equipment, it is a good thing, but it also has a geopolitical aspect,"" he said.']",['Richard McGregor'],Lowy Institute for International Policy 
0,6589,2841.0,"['“We have to look at it in the current environment based off what we’re learning through the science and through the medical community,” said Vincent, who oversees football operations for the NFL.']",['Vincent'],Dragonfly
0,6620,2928.0,"[""The Hill's media reporter Joe Concha said the mainstream media's reflex is always to blame President Trump -- no matter the topic.""]",Trump,The Beacon Hill Institute
0,6621,2930.0,"[""The mainstream\xa0media\xa0is so eager\xa0to blame President Trump\xa0for his handling of the coronavirus\xa0outbreak that important health information isn't getting out to the\xa0public, The Hill's media reporter Joe Concha said Saturday.""]",Joe Concha,The Beacon Hill Institute
