,0,1,2,3,4
0,11842,3854.0,"['On Monday, Lowe said that he and “American Horror Story” creator Ryan Murphy would be “developing our own version of this insane story,” and according to People magazine, the project is currently in discussion.']",Ryan Murphy,Amazon Institute of People and the Enviroment
0,11845,3860.0,"['This June 15, 2019 file photo shows John Prine performing at the Bonnaroo Music and Arts Festival in Manchester, Tenn.\xa0\n      (Amy Harris/Invision/AP, File)\n\n\n“This is hard news for us to share,” Prine’s family said at the time.']",Prine,Vision
0,11852,3884.0,"['“I approached Kaiser [Permanente] and I asked them if there were opportunities to do telemedicine they said absolutely we would love to get you on board,” Schuman said.']",Schuman,Kaiser Permanente Institute for Health Policy
0,11854,3889.0,"['CALIFORNIA INMATES MAKE FACE MASKS TO DISTRIBUTE IN HOPES TO CURB CORONAVIRUS SPREAD\n\n      Mugshot for Ronald Rice\n      (Illinois Department of Corrrections)\n\n\nOn Sunday, Illinois Department of Public Health Director Dr. Ngozi Ezike said 60 Stateville inmates have tested positive for the coronavirus, according to the Times newspaper in Ottawa, Ill.\n”To further support our efforts to safely quarantine men at Stateville, the facility is temporarily reopening its \'roundhouse,\'"" Illinois Department of Corrections spokeswoman Lindsay Hess told the paper.']",Lindsay Hess,The Times Think Tank
0,11862,3910.0,"[""(Photo by Nelson Ching/Bloomberg via Getty Images)\n      \n\n\nTRUMP ADMINISTRATION WEIGHS LEGAL ACTION OVER ALLEGED CHINESE HORDING OF PPE\nRen, 69, has also gone on record to say China's state-run news media should serve the people of China and not the Communist Party, something Xi strongly disagrees with.""]",Xi,Party School of the Communist Party of China Inner Mongolia Autonomous Region
0,11879,3949.0,"['ROGER GOODELL: NFL MOVING FORWARD WITH VIRTUAL FORMAT FOR DRAFT AMID CORONAVIRUS SHUTDOWNS\n“Yeah, big concern,” Harbaugh said.']",Harbaugh,Dragonfly
0,11885,3962.0,"[""(Photo by Kevin Winter/ACMA2012/Getty Images for ACM)\n      \n\n\nROGER GOODELL: NFL MOVING FORWARD WITH VIRTUAL FORMAT FOR DRAFT AMID CORONAVIRUS SHUTDOWNS\n“We're so used to using the industrial machines that it's a little bit of a transition to go back to using a home machine,” Tomlin said.""]",Tomlin,Dragonfly
0,11913,4043.0,"['He said that teams will reopen their facilities when “it is safe to do so based on medical and public health advice, and in compliance with government mandates.”\nTOM BRADY, J.J. WATT, AARON DONALD, ADRIAN PETERSON HEADLINE NFL 2010S ALL-DECADE TEAM\nThe draft was originally set to be held in Las Vegas, but the NFL canceled all public events last month amid the coronavirus pandemic, which has drastically affected the sports world.']",ADRIAN PETERSON,Dragonfly
0,11975,4227.0,"['“… In the hospital, she said, ‘Every day I wake up and decide today I’m going to love my life.’ And that was her mantra.”\nBack in 2018, Burnett told People magazine that she thought of Hamilton “every day.”\nCLICK HERE TO GET THE FOX NEWS APP\n“She never leaves me,” said Burnett.']",Burnett,Amazon Institute of People and the Enviroment
0,11992,4274.0,"['Johnson claimed that Amazon uses “knockoffs as leverage to pressure sellers to do what Amazon wants.”\nBezos said that is “unacceptable” and “if those are the facts,” then Amazon would look into it.']",Bezos,Amazon Environmental Research Institute
0,12045,4435.0,"['(AP Photo/Mark Lennihan, FIle)\n      \n\n\n“Our communities, as well as the majority of restaurant and bar owners and staff, have endured great sacrifices to bend the curve, and the SLA will not hesitate to take immediate action against those who threaten the progress our state has made,” said Vincent Bradley, chairman of the State Liquor Authority.']",Vincent Bradley,Islands Society
0,12080,4537.0,"['The award honors people who “demonstrated a commitment to social change” and have “utilized their platform for the public good.”\nFAUCI EXPLAINS WHY HIS PITCH WAS OFF THE MARK\n“At a time when the courageous pursuit of equality and justice has become political and riddled with adversity, Robert F. Kennedy Human Rights stands with these modern-day human rights defenders in their inspirational fight for progress,""\xa0the organization said in a statement.']",Robert F. Kennedy,Human Rights Now
0,12082,4541.0,['Former NFL linebacker Dhani Jones weighs in on the return of sports amid the coronavirus pandemic on ‘The Daily Briefing.’\n\n\n\n\nPittsburgh Steelers defensive end Stephon Tuitt said on Monday that he will not kneel during the national anthem this upcoming NFL season.'],Stephon Tuitt,Dragonfly
0,12093,4571.0,"['I mean, he’s had many of his employees quit because of racism, he called [Colin]\xa0Kaepernick an ‘ISIS guy’...\xa0over a dozen women, Barstool Sports reporters refused to sit down with HBO because they feared rape threats, he’s been on video using the n-word and, so, it’s not surprising to me that Trump would sit down with someone with that kind of reputation,” Hostin said.']",Hostin,International Crisis Group
0,12109,4629.0,"['Other related developments:\n- American protests: Demonstrations, violent riots expected to continue throughout the country\n\n- Gohmert: Democrats\' \'strategy\' is to \'keep America in turmoil\' to make it easier to dump Trump\n\n- Portland rioters use \'cover of crowd\' to commit crimes, launch fireworks at officers\n\n- DHS Secretary Wolf says Portland protests different from \'normal criminal activity\'\n\nStanley Kurtz praises Trump\'s latest \'tremendous accomplishment,\' and why media largely overlooked it\nStanley Kurtz, a senior fellow at the Ethics and Public Policy Center, spoke glowingly to Fox News about what he termed a ""tremendous accomplishment"" of the Trump administration -- one the mainstream media apparently failed to even notice.']",Trump,Ethics and Public Policy Center
0,12139,4718.0,"['Ren published an essay accusing Xi of covering up the early stages of the outbreak, saying that no one in the party “took responsibility,” the Independent reported.']",Xi,Centre for Independent Studies
0,12162,14.0,"['""Defendant\'s case is not an isolated one, but instead appears to be part of a program conducted by the PLA –\xa0and specifically, the FMMU or associated institutions –\xa0to send military scientists to the United States on false pretenses with false covers or false statements about their true employment,"" the FBI said, singling out Chen Song, another suspected spy.']",['Chen Song'],Plan Eval
0,12176,33.0,"[""Locking down civilians will not eradicate the coronavirus -- despite several governors' claims and actions to the contrary,\xa0Hoover Institution fellow Dr. Scott Atlas said Thursday.""]",['Scott Atlas'],"Hoover Institution on War, Revolution and Peace"
0,12177,34.0,"['And\xa0the U.S. is also not handling the virus as badly as some have claimed, Atlas said on Fox News\' ""The Ingraham Angle.""']","[""Fox News'""]",Atlas Foundation 1853
0,12189,48.0,"['On Wednesday, Cotton slammed The Times for publishing an op-ed essay written by a Chinese scientist who criticized the U.S. government’s response to the coronavirus pandemic.']",['Cotton'],The Times Think Tank
0,12217,80.0,"['Director of CEI’s Center for Energy and Environment Myron Ebell said that the first part of the bill, catching up on the billions of backlogged maintenance for federal parks and public lands was “long over due,” but should be considered as a separate bill.']",['Myron Ebell'],MIT Center for Energy and Environmental Policy Research
0,12222,86.0,"['INHALED DRUG SHOWS PROMISE IN CORONAVIRUS TREATMENT: STUDY\n“Our study is consistent with the promising findings from Britain, but for the first time, we are able to demonstrate that people can see the same life-saving benefits with steroid formulations other than dexamethasone,” said Dr. Marla Keller,\xa0vice chair for research in the Department of Medicine at Einstein and Montefiore, in a hospital news release.']",['Marla Keller'],The Feinstein International Center
0,12224,88.0,"['“Our findings suggest that steroid therapy should be reserved for people with high inflammation, as indicated by markedly elevated CRP levels,"" said Dr. William Southern, professor of medicine and chief of the Division of Hospital Medicine at Einstein and Montefiore,\xa0in the release.']",['William Southern'],Vision
0,12256,120.0,"['And one reason that the reporters don\'t like me, and it\'s not just the Times, it\'s that I call people out on mistakes,"" Berenson said, noting he criticized media for misreporting the amount of Hospital beds used in Houston, Texas.']",['Berenson'],The Times Think Tank
0,12335,209.0,"['“There’s no finish line with health and safety and I think these protocols are very much living and breathing documents, which means they will change as we gain new knowledge about this virus, as we gain new knowledge about transmission, as we gain new knowledge about testing and there are new tests and new techniques that come online,” said Dr. Allen Sills, NFL chief medical officer.']",['Allen Sills'],Dragonfly
0,12347,221.0,"[""(Joshua Morrison/Mount Vernon News via AP)\n      \n\n\nOSHA also said the homes did not provide evaluations to determine employees' ability to use a respirator.""]",['Joshua Morrison'],Vitosha Research
0,12348,222.0,"['“OSHA’s investigation found that, although the company was making efforts to protect its employees from the coronavirus, it had not fully implemented an appropriate respiratory protection program,” OSHA Cleveland Area Office Director Howard Eberts said in a news release.']",['Howard Eberts'],Vitosha Research
0,12375,249.0,"['Europe is united,” European Council President Charles Michel, who hosted the summit, said in a press conference.']",['Charles Michel'],European Council on Foreign Relations
0,12447,323.0,"['CLICK HERE FOR THE FOX NEWS APP\nRonald Richards, an attorney for companies associated with the Novals, said in an email to the Times that the foreign national who transferred the funds at the center of the dispute had been verified as a member of the Kuwait royal family.']",['APP Ronald Richards'],The Times Think Tank
0,12474,351.0,"['CLICK HERE TO GET THE FOX NEWS APP\xa0\nFace-covering rules contain exceptions for people with certain health conditions, too –\xa0putting police officers at risk of bias if they pursue\xa0the wrong\xa0people, said Leslie Gielow Jacobs, a professor at the University of the Pacific, McGeorge School of Law in Sacramento.']",['Leslie Gielow Jacobs'],Research Centre of the University of the Pacific
0,12511,391.0,"['The canine was the first animal in South Carolina to be infected with COVID-19, said Dr. Boyd Parr, state veterinarian and director of Clemson Livestock Poultry Health (LPH).']",['Boyd Parr'],Adelphi
0,12534,415.0,"['NEA HEAD ISSUES WARNING OVER SCHOOL REOPENING PUSH\n""We have students that their\xa0computer is a cell phone, many of our families use their smartphone\xa0as the only computer that they have, but the kids are using that to have remote schooling and that is just not appropriate,"" said Scott Muri, Ector County school district superintendent in Odessa, Texas.']",['Scott Muri'],Samuel Neaman Institute
0,12535,416.0,"['CLICK HERE FOR COMPLETE CORONAVIRUS COVERAGE\nLosing its creatives is a “huge threat” to the city’s fabric overall, said Eli Dvorkin, editorial and policy director at the Center for an Urban Future, which advocates for policies that make New York City more equitable.']",['Eli Dvorkin'],Center for an Urban Future
0,12545,426.0,"['Barr said that the Chinese Communist Party’s “Made in China 2025” initiative “poses a real threat to U.S. technological leadership,” as China seeks to dominate a number of high-tech industries.']",['Barr'],Party School of the Communist Party of China Inner Mongolia Autonomous Region
0,12553,434.0,"[""Raab's statement came as the newly installed Intelligence and Security Committee in Parliament said it would release the report on previous allegations of Russian interference before Parliament’s summer break starts next week.""]",['Raab'],Parliamentary Institute of Benin
0,12579,460.0,"['“This is a Chinese Communist Party that is acting in a way that poses real threats to the world, and the United States is going to respond in each of those venues to make sure that we preserve American national security and impose costs on the Chinese Communist Party in order to achieve the change in behavior that will have a good outcome,” Pompeo said Wednesday.']",['Pompeo'],Party School of the Communist Party of China Inner Mongolia Autonomous Region
0,12641,524.0,"['“When you have an event of this magnitude...that says there is an alternative to this regime and when one speaks about regime change, one does not have to think of putting boots on the ground, but empowering and enabling the people of Iran and the opposition to bring about that change,” Ali Safavi, a member of Iran’s Parliament in Exile and member of the NCRI, told Fox News in an interview.']",['Ali Safavi'],Parliamentary Institute of Benin
0,12657,541.0,"['In the Foreign Policy article, reporter Tracy Wen Liu said\xa0she was ""repeatedly shut down by authorities"" when she tried reporting on the virus.']",['Tracy Wen Liu'],Foreign Policy Initiative BH
0,12666,551.0,"['We have taken measures with signage, distancing markers, hand sanitizers, and cleaning; beyond anything any retailer or public space we have surveyed,"" Observatory President Jean-Yves Ghazi said in a statement.']",['Jean-Yves Ghazi'],Observatory for Children’s Rights 
0,12670,555.0,"['(Photo by Walt Disney Television via Getty Images Photo Archives/Walt Disney Television via Getty Images)\n\n\nJOHN TRAVOLTA TAKES TO THE SKY IN PRIVATE PLANE DURING CORONAVIRUS QUARANTINE\n“I gave her great joy in the last months of her life,” he said.']",['JOHN TRAVOLTA'],Vision
0,12691,576.0,"['“The player feedback was integral in coming up with this design,"" said Dr. Jeff Crandall, chairman of the NFL’s Engineering Committee.']",['Jeff Crandall'],Dragonfly
0,12739,624.0,"['""If it was someone in my family [who was high risk] I would suggest that they not go to a gym,""\xa0Dr. Saadia Griffith-Howard, an infectious disease expert at Kaiser Permanente, reportedly said.']",['Saadia Griffith-Howard'],Kaiser Permanente Institute for Health Policy
0,12747,632.0,"['CLICK HERE FOR MORE SPORTS COVERAGE ON FOXNEWS.COM\n“DeSean’s comments were highly inappropriate, offensive and divisive and stand in stark contrast to the NFL’s values of respect, equality and inclusion,"" the league said in a statement.']",['DeSean'],Dragonfly
0,12773,662.0,"['In the Foreign Policy article, reporter Tracy Wen Liu said that she was ""repeatedly shut down by authorities"" when she tried reporting on the virus.']",['Tracy Wen Liu'],Foreign Policy Initiative BH
0,12881,773.0,"['A source previously told People magazine, saying that the divorce was\xa0""a hard decision"" for Pearce to make.']",['Pearce'],Amazon Institute of People and the Enviroment
0,12887,779.0,"['TRUMP SAYS HE DISAGREES WITH CDC SCHOOL REOPENING GUIDELINES\nIn its push to reopen schools, McEnany said the administration was standing against child abuse, which she said goes underreported during school closures and for education equality, citing a McKinsey study which said learning loss during school closures would be greatest among Black and Brown students.']",['McEnany'],McKinsey Global Institute
0,12939,831.0,"['CLICK HERE FOR MORE SPORTS COVERAGE ON FOXNEWS.COM\n“The results demonstrate that the financial impact of COVID-19 on European clubs … is already a seismic shock,” ECA chief executive Charlie Marshall said.']",['Charlie Marshall'],Forecast Thinktank
0,12970,866.0,"['And that the solipsistic sophistry of the past has been revealed as more vacuous than virtuous.”\nAMAZON, APPLE, FACEBOOK AND GOOGLE CEOS TO TESTIFY IN HISTORIC ANTITRUST HEARING\nThomson said that News Corp. has already reached an agreement with\xa0Mark Zuckerberg’s\xa0Facebook in the United States.']",['Mark Zuckerberg'],Amazon Environmental Research Institute
0,12977,873.0,"['Speaking at an event hosted by the Hudson Institute\xa0in Washington, Wray said that Chinese thefts amount to “one of the largest transfers of wealth in human history,” and that the American people are the victims.']",['Wray'],Hudson Institute
0,12996,892.0,"['(Spirit Airlines)\n\n\nAfter the girl received medical attention at a local hospital, “dozens” of Spirit employees began brainstorming ways to get the Santiago Rodriguez’s home, the spokesperson said.']",['Santiago Rodriguez'],Business Spirit Development Center
0,13004,901.0,"['He added that handling the prison outbreak “remains a top priority for our administration.”\nNewsom said\xa0he hopes efforts can ""responsibly"" move prisoners out, reducing the population count by nearly 1,000 prisoners in the upcoming weeks, the Times added.']",['Newsom'],The Times Think Tank
0,13075,977.0,"['(AP Photo/Eugene Hoshiko)\n      \n\n\n""No single exposure site has been the primary driver for our increase in cases,"" Apa said.']",['Eugene Hoshiko'],Asian Forum Japan
0,13076,978.0,"['You continue to be in our thoughts every day,” said Barbara Ferrer, Director of Public Health.']",['Barbara Ferrer'],Center for Research in Public Health
0,13078,981.0,['The Times says President Trump “signaled even more clearly that he would exploit race and cultural flash points”; isn’t that what Democrats have done?'],['Trump'],The Times Think Tank
0,13108,1011.0,"['(Reuters)\n      \n\n\nAlthough Ono still owns more than 600 acres near the town of Franklin, NY, locals say it’s been ages since they saw her in the area where she used to vacation with Sean and groups of friends.']",['Sean'],Center for Bioeconomy
0,13109,1012.0,"['“We haven’t seen her for a very long time,” said Roland Greefkes, an iron artisan who made a wrought-iron gate for Ono’s property.']",['Roland Greefkes'],Center for Bioeconomy
0,13119,1022.0,"['NFL PLAYERS UNION VOTES FOR RECOMMENDATION TO CANCEL ENTIRE PRESEASON: REPORT\n“I think he’s getting frustrated because he’s starting to feel better and he wants to get back here,"" Indians manager Terry Francona said.']",['Terry Francona'],Dragonfly
0,13217,1128.0,"[""NFL VETERAN QUARTERBACK WARNS 2020 SEASON 'WILL NOT BE RECOGNIZABLE'\nCowher, 63, said he and his wife both lost their sense of smell when they were returning from a trip to Honolulu.""]",['Cowher'],Dragonfly
0,13283,1195.0,"['“Iowa’s hospitality businesses have suffered greatly due to the harsh financial impacts of COVID-19,”\xa0Dale Szyndrowski, DISCUS vice president of state government relations, said in a statement.']",['Dale Szyndrowski'],Valdai International Discussion Club
0,13304,1216.0,"['We don’t have national TV revenues,” National Association president Pat O’Conner said during a digital news conference.']",['Pat O’Conner'],National Association of Financial Institutions - Centre for Economic Studies
0,13322,1234.0,"['Manhattan Institute Fellow Heather Mac Donald said on Tuesday that Black Lives Matter is not only dangerous, but it is also based on a lie that the police are systemically racist.']",['Heather Mac Donald'],Manhattan Institute
0,13360,1274.0,"['A spike in the number of coronavirus cases in Cleveland came immediately the Black Lives Matter protest on May 30 in the city’s downtown area, Public Health Director Merle Gordon said.']",['Merle Gordon'],Center for Research in Public Health
0,13369,1283.0,"['“GAO found that more than $1 trillion in taxpayer funds have already been obligated — including more than $1 billion to deceased individuals — with little transparency into how that money is being spent,"" Rep. Carolyn Maloney, D-N.Y., chair of the House Oversight and Reform Committee, said in a statement.']",['Carolyn Maloney'],Reform
0,13384,1298.0,['Amazon said Smalls was fired for “violating social distancing guidelines and putting the safety of others at risk.” \nBezos said on Instagram earlier this month that he was “happy to lose” customers\xa0who did not support\xa0Black Lives Matter.'],['Bezos'],Amazon Environmental Research Institute
0,13474,1393.0,"['… In the Times poll, four in five registered voters said that race shouldn’t be a factor in Mr. Biden’s selection of a running mate.']",['Biden'],The Times Think Tank
0,13490,1413.0,"[""Robert Johnson, the founder of Black Entertainment Television, says it's\xa0time America atones for slavery and systemic racism by paying African-Americans reparations to make them economically equal to white Americans.""]",['Robert Johnson'],Vision
0,13492,1415.0,['This Q  A has been\xa0edited for clarity and brevity:\n\n      Black Entertainment Television (BET) founder Robert Johnson says American owes African Americans $14 trillion in reparations.'],['Robert Johnson'],Vision
0,13499,1422.0,"['(Credits: NASA, ESA, and STScI)\n      \n\n\nHUBBLE SPOTS \'DYNAMIC DUO\' IN DEEP SPACE\n“You have a star that is surrounded by a disk, and the disk is not like Saturn’s rings – it’s not flat,"" Klaus Pontoppidan, the study\'s lead author, said in a statement.']",['Klaus Pontoppidan'],ESA Consultants
0,13500,1423.0,"[""NHL SEATTLE, AMAZON PARTNER TO BUILD CLIMATE PLEDGE ARENA\n“Players have protected the owners income with escrow, including throughout this pandemic crisis, even as owners' equity continues to grow exponentially,” Panarin said.""]",['Panarin'],Amazon Environmental Research Institute
0,13509,1434.0,"['“The NFLPA and the NFL are in the same exact place, which is we want whatever makes the safest possible environment for all of our constituents, whether they be players, coaches, trainers, medical staff [or] anyone in that team environment,” Sills said.']",['Sills'],Dragonfly
0,13534,1459.0,"['NFL TO CANCEL HALL OF FAME GAME BETWEEN COWBOYS, STEELERS OVER CORONAVIRUS: REPORT\n“The NBA’s a lot different than the NFL because they can actually quarantine all of their players or whoever’s going to participate, where we have over 2,000 players, even more coaches and staff,” Jenkins said on CNN.']",['Jenkins'],Dragonfly
0,13557,1482.0,"['Amnesty International has singled out certain countries rushing apps into development that “run roughshod over people’s privacy, with highly invasive surveillance tools which go far beyond what is justified in efforts to tackle COVID-19,” said Claudio Guarnieri, the head of Amnesty International’s Security Lab.']",['Claudio Guarnieri'],Amnesty International
0,13560,1485.0,"['“Those who know her say there is a real core of strength, and she did set her mind to the job,” Sarah Gristwood, author of “Elizabeth: The Queen and the Crown,” told People magazine on Wednesday.']",['Sarah Gristwood'],Amazon Institute of People and the Enviroment
0,13581,1507.0,"['""Quraishi was a longtime, founding member of ISIS -- considered to be both a military commander and someone with religious credibility,"" he said.']",['Quraishi'],International Crisis Group
0,13638,1570.0,"['Again, the officials of the league in consultation with the players will make their own decisions.”\nFauci said that his original statements about the NFL season have been misinterpreted and taken out of context.']",['Fauci'],Dragonfly
0,13639,1571.0,"['“I was asked by officials from the NFL about risks associated with various scenarios that the NFL might face in consideration of the upcoming season,” Fauci said.']",['Fauci'],Dragonfly
0,13683,1618.0,"['In an interview with Scripps Television Stations Monday, Trump declined to say whether he had asked for the pace of testing to be slowed, saying: ""If it did slow down, frankly, I think we\'re way ahead of ourselves, if you want to know the truth.']",['Trump'],Vision
0,13733,1675.0,"['""The article doesn’t even provide any evidence, it just says a bunch of teenagers said they ruined the rally and the reporter/editors at the Times took their word for it,"" said The Washington Examiner\'s Joe Gabriel Simonson, referring to an article in The New York Times.']",['Joe Gabriel Simonson'],The Times Think Tank
0,13783,1728.0,"[""McVay shared the sentiment of many in the NFL on Thursday when he said that he doesn’t see how the league can implement certain social distancing guidelines without it impacting players' abilities to perform.""]",['McVay'],Dragonfly
0,13820,1771.0,"['Having friends who are police officers, Josh Stivers, another co-owner of Homeland Patrol Division,\xa0says he can sense their angst and frustration.']",['Josh Stivers'],Vision
0,13873,1826.0,"[""The global health body announced the decision during a\xa0news conference, saying it was based on data\xa0from a hydroxychloroquine trial in the United Kingdom and\xa0separate data from\xa0the WHO's Solidarity trial, launched in an effort to find treatment for COVID-19, said\xa0Ana Maria Henao Restrepo, head of the WHO’s research and development group.""]",['Ana Maria Henao Restrepo'],Specified Nonprofit Corporation Solidarity Network with Migrants Japan
0,13924,1881.0,"['“It\'s so interesting with the whole nanny conversation,"" Baldwin, 36, said\xa0on the June 10 episode of the “Mom School” podcast, according to\xa0People magazine.']",['Baldwin'],Amazon Institute of People and the Enviroment
0,13950,1914.0,"['We can have families jump in the car, get them out on Saturday night,"" Brooks said on ""GMA.""']",['Brooks'],Sigma
