,0,1,2,3,4
0,36,39.0,"['Piet van Lier, a researcher with Policy Matters Ohio, said:\xa0“I don’t think it takes an expert to understand that if all a sudden you have lots of cases coming out of the prisons, it’s going to overwhelm the medical centers and hospitals, as well.”\nThe inmate is being housed at Pickaway Correctional Institute (PCI) and said he and many in his unit have been experiencing coronavirus symptoms for over a week.']",['Piet van Lier'],Policy Matters Ohio
0,48,52.0,['SEIU spokesman Steve Trossman told the Times the union “was trying to save the lives of healthcare workers and patients” and that union officials “were proud of having made that attempt.”\nHe said the name of the supplier had been turned over to a federal task force investigating suppliers of medical equipment related to COVID-19.'],['Steve Trossman'],The Times Think Tank
0,62,67.0,['(Feeding America)\n      \n\n\nFox News and Facebook also made a joint donation of $1 million to Feeding America’s COVID-19 Response Fund and Amazon founder Jeff Bezos said Thursday that he plans to donate $100 million.'],['Jeff Bezos'],Amazon Environmental Research Institute
0,95,102.0,"['Goodell said the\xa0NFL’s\xa0Management Council Executive Committee was ""unanimous and unequivocal that the draft should go forward as scheduled.” The NFL has already canceled its planned draft festivities in Las Vegas and will proceed with an altered format to protect participants from risks related to the outbreak.']",['Goodell'],Dragonfly
0,103,113.0,"['“By keeping her behind bars, they expose their true motive\xa0—\xa0they are willing to punish health professionals who dare contradict the official Russian narrative and expose flaws in the public health system,” Natalia\xa0Zviagina, Russia director of Amnesty International, said in a statement.']",['Natalia Zviagina'],Amnesty International
0,106,116.0,"['SXSW, AMAZON PARTNER UP TO BRING THE FILM FESTIVAL ONLINE\n“What we do later in the year would clearly be a differently programmed festival than what we would have done in April,” Rosenthal said in a phone interview Thursday.']",['Rosenthal'],Amazon Environmental Research Institute
0,150,167.0,"['""He’s not smart, or articulate, and to the extent the press wants to focus on us versus him, we will be in a much stronger PR position than simply explaining for the umpteenth time how we’re trying to protect workers,"" Amazon General Counsel David Zapolsky said, according to Vice News.']",['David Zapolsky'],Amazon Environmental Research Institute
0,151,168.0,"['Amazon previously justified its firing of Smalls by saying that Smalls ""was found to have had close contact with a diagnosed associate with a confirmed case of COVID-19 and was asked to remain home without pay for 14-days...']",['Smalls'],Amazon Environmental Research Institute
0,168,186.0,"['Dr. Alex Billioux, assistant secretary for the state Office of Public Health, said, “If there is a place to draw hope here it is that these new data reveal our COVID-19 related hospitalization and death rates, while still concerningly high, are trending more in line with the national average.”\nAmid the shortages, the state is also converting the Ernest N. Morial Convention Center in New Orleans into a temporary hospital with 2,000 beds, The Advocate reported.']",['Alex Billioux'],Advocates Coalition for Development and Environment
0,177,198.0,"['Amazon founder Jeff Bezos said Thursday that he plans to donate $100 million to food banks across America, which is currently facing a severe and steep economic downturn because of the\xa0coronavirus epidemic.']",['Jeff Bezos'],Amazon Environmental Research Institute
0,202,227.0,"[""CELEBRITIES REACT TO TRUMP'S CORONAVIRUS ADDRESS: 'EVIL EMPIRE MUST GO'\n“In times of need, a plate of food is both vital nourishment and a message of hope from the community, that we care and we’re here to make sure that tomorrow, things will be better,” Andrés said on the Fund’s page.""]",['Andrés'],Fundación Pensar
0,257,288.0,"['(AP Photo/Patrick Semansky)\n      \n\n\nNEW CORONAVIRUS TEST CAN RETURN RESULTS IN FIVE MINUTES\nIn addition to temperature checks, Amazon said it has finally been able to secure the ""millions of masks"" it ordered weeks ago.']",['Patrick Semansky'],Amazon Environmental Research Institute
0,280,311.0,"['CORONAVIRUS PANDEMIC FORCES HHS TO ALLOW APPLE FACETIME, ZOOM, OTHER APPS FOR TELEHEALTH SERVICES\n“It’s never been more critical to ensure people stay safely connected to one another,"" Activision Blizzard CEO Bobby Kotick said in the statement.']",['Bobby Kotick'],Vision
0,314,347.0,"['SAT and ACT college tests canceled due to coronavirus fears has students worried\nJohn A. Pérez, chair of the Board of Regents, the governing board for UC, said the school wants to alleviate the ""tremendous disruption and anxiety that is already overwhelming prospective students due to COVID-19.""']",['John A. Pérez'],ArmActive Youth Center
0,350,384.0,"['Paul Sullivan, the senior vice president of donor services for the American Red Cross, said the coronavirus has presented the Red Cross with several challenges.']",['Paul Sullivan'],Red Cross / Red Crescent Climate Centre
0,391,428.0,"['(AP Photo/Mark Lennihan)\n\n\nThe company provides its services via 13 co-located data centers in Australia, Brazil, Canada, China, Germany, India, Japan, the Netherlands and the U.S., the IPO prospectus said.']",['Mark Lennihan'],Dipol Group
0,393,431.0,"['Colin Watson, acting executive director of the Christian Reformed Church, said they need to reframe ""social distancing"" as ""physical distancing,"" a sentiment shared by many other leaders.']",['Colin Watson'],Reform
0,411,449.0,"['Magna’s director of new technology and\xa0innovation, Scott Mitchell, said research has shown that this type of treatment can also kill viruses, including the H1N1 flu that caused a global pandemic in 2009, and that the company is moving quickly to have the Puro tested against the coronavirus that causes COVID-19.']",['Scott Mitchell'],Magna Carta Foundation
0,425,463.0,"['The government has been reluctant to oppose them,"" said Jeff Smith, a research fellow for South Asia at the Heritage Foundation.']",['Jeff Smith'],Heritage Foundation
0,429,467.0,"['“Politics is very, very much involved in the decision-making going on right now,"" said Janine Ramsey, an infectious disease expert who works for Mexico\'s National Public Health Institute, a federal research agency, and has spent 35 years of her public health career in Mexico.']",['Janine Ramsey'],National Institute of Public Health
0,431,469.0,"['After\xa0Amazon\xa0announced it fired a worker at its Staten Island, N.Y., warehouse after he helped organize a walkout over its\xa0coronavirus responses, New York City Mayor Bill de Blasio\xa0said he was\xa0calling for an investigation into the Jeff Bezos-led tech giant.']",['Bill de Blasio'],Amazon Environmental Research Institute
0,432,470.0,"['I have ordered the city’s Commission on Human Rights to investigate Amazon immediately to determine if that’s true,” de Blasio said at a Tuesday press conference.']",['de Blasio'],Amazon Environmental Research Institute
0,433,471.0,"['In a previous statement to Fox News, Amazon said it had terminated\xa0Smalls because he violated several terms of his employment.']",['Smalls'],Amazon Environmental Research Institute
0,469,512.0,"['""February and March is when we should have been testing everybody,” said Janine Ramsey, an infectious disease expert who works for Mexico\'s National Public Health Institute.']",['Janine Ramsey'],National Institute of Public Health
0,475,519.0,"['“Prisons and jails can be disease incubators for people who are incarcerated and staff,” Piet van Lier, a researcher for Policy Matters Ohio, said in a news release.']",['Piet van Lier'],Policy Matters Ohio
0,484,529.0,"['“Since the outbreak of the epidemic at the end of last year, China has covered it up and manipulated the WHO to pretend that everything is going well,” said Cho Jung-tai, chairman of Taiwan’s ruling Democratic Progressive Party, according to Reuters.']",['Cho Jung-tai'],Progress
0,510,555.0,['Former CEO of CKE Restaurants\xa0Andy Puzder\xa0said on “America’s Newsroom” on Tuesday that he thinks companies like Amazon and online grocery-delivery service Instacart “are\xa0doing what they can” to protect their employees amid the coronavirus pandemic.'],['Andy Puzder'],Amazon Environmental Research Institute
0,511,556.0,"['“These people at Amazon and Instacart, these aren’t stupid people,” Puzder\xa0said.']",['Puzder'],Amazon Environmental Research Institute
0,512,557.0,['CORONAVIRUS: WHAT TO KNOW\nPuzder\xa0said Amazon and Instacart “should be very concerned\xa0about these demonstrations\xa0because if people get afraid to\xa0order online they’re going to stop\xa0ordering online and that would be a disaster for the\xa0country right now with the\xa0current crisis.”\nInstacart and Amazon say they are working to make sure workers have sanitation gear and have taken steps to increase pay and extend paid sick time.'],['Puzder'],Amazon Environmental Research Institute
0,520,565.0,"['(Photo by Robin Alam/Icon Sportswire via Getty Images)\n      \n\n\n“The current suspension of sanctioned rugby activities caused by the ongoing COVID-19 pandemic has accelerated the existing financial challenges facing the Union, and a reorganization process will now be progressed with input from World Rugby,” the organization said in a news release.']",['Robin Alam'],The Union of Albanian Roma 
0,558,604.0,"['AMAZON OFFERS HIGHER PAY FOR SWITCHING TO GROCERY WORK AMID INCREASED FOOD DEMAND\n“It is disgraceful that Amazon would terminate an employee who bravely stood up to protect himself and his colleagues,"" James said in a statement.']",['James'],Amazon Environmental Research Institute
0,559,605.0,"[""Smalls himself said he was not surprised by Amazon's response.""]",['Smalls'],Amazon Environmental Research Institute
0,560,606.0,"['I’ve seen it all.”\nIn a statement obtained by Fox News, an Amazon spokesman said Smalls was terminated because he violated several terms of his employment.']",['Smalls'],Amazon Environmental Research Institute
0,561,607.0,"['Sign up here\nWhile it is a ""difficult"" and ""bad"" time both for hospitals and patients strained under the surge of of coronavirus (COVID-19)\xa0patients, America can make it past this virus by working together,\xa0former NFL player-turned-neurosurgeon\xa0Myron Rolle said Tuesday.']",['Myron Rolle'],Dragonfly
0,568,614.0,"['WIMBLEDON FACES POSSIBILITY OF POSTPONEMENT OR CANCELLATION OVER CORONAVIRUS OUTBREAK\n“The site is likely to be non-COVID\xa0patients, and we will evaluate based on need,” New York City Emergency Management spokesman Omar Bourne said, adding the city is “actively working to identify spaces that can be used to expand hospital capacity throughout the five boroughs.”\nAdditionally, Louis Armstrong Stadium, which is part of\xa0the Billie Jean King National Tennis Center, will be used for meal packaging, according to the USTA.']",['Omar Bourne'],Sustainable Chile
0,613,661.0,"['“This COVID-19-contaminated material is considered ‘Category B’ infectious substance by the CDC, OSHA, and DOT, and can be managed as other normal regulated medical waste is managed, but some facilities are taking extra precautions to make sure that it is double-bagged and then boxed accordingly and labeled as COVID-19 so that everyone, including the medical waste collection companies and the treatment companies that process the materials, like Covanta, understands what the material is.”\nWright said the material then goes to a waste management facility that is permitted to handle such material.']",['Wright'],Vitosha Research
0,683,734.0,"['The father of former NFL quarterback Bobby Hebert\xa0died after being diagnosed with coronavirus, his family said Saturday.']",['Bobby Hebert'],Dragonfly
0,684,735.0,"[""BUCCANEERS' TOM BRADY OFFERS TIPS TO STAY HEALTHY AMID CORONAVIRUS THREAT: 'WE'RE GOING TO GET THROUGH THIS'\n“Without my father I never would have been able to accomplish my dreams, I never would have made it to NFL,” the statement said.""]",['TOM BRADY'],Dragonfly
0,707,758.0,"['Do your job, or resign,"" Mother Jones National Affairs editor Mark Follman said.']",['Mark Follman'],Australian Institute of International Affairs
0,766,818.0,"['“Restricting the eating of wildlife while promoting medicines containing wildlife parts exemplifies the mixed messages being sent by the Chinese authorities on wildlife trade,” White said in a statement via the EIA website.']",['White'],Semeia Institute
0,772,824.0,"['Brett Schaefer, a Senior Research Fellow in International Regulatory Affairs, the Heritage Foundation, said China has ""a well-established record of suppressing information that it considers harmful,"" a notion not new to the WHO.']",['Brett Schaefer'],Heritage Foundation
0,808,864.0,['ESPN college football analyst Kirk Herbstreit said he’d be “shocked” if the 2020 NFL and college football seasons take place amid the coronavirus.'],['Kirk Herbstreit'],Dragonfly
0,813,869.0,"['The lack of seriousness in Belarus could trickle down from President Aleksandr Lukashenko who, despite telling people to practice social distancing, called the disease a “psychosis.”\n“It is yet another psychosis, which will benefit some people and harm others,” he said last week, according to the Times.']",['Aleksandr Lukashenko'],The Times Think Tank
0,821,878.0,"['Although the American public has stepped up to the plate and helped to maintain a blood supply during the coronavirus (COVID-19) pandemic, there is still a critical need for blood, Red Cross spokesman\xa0Anthony Tornetta said Friday.']",['Anthony Tornetta'],Red Cross / Red Crescent Climate Centre
0,836,893.0,['Amazon CEO Jeff Bezos said the e-commerce giant is working directly with the World Health Organization (WHO) in a number of different capacities as the world attempts to tackle the coronavirus pandemic.'],['Jeff Bezos'],Amazon Environmental Research Institute
0,873,932.0,"['According to the Philadelphia Inquirer, Krasner has said he would respond to the coronavirus outbreak by seeking the release of people charged with nonviolent offenses and misdemeanors and asked police to consider the prospect of prison overcrowding when making arrests.']",['Krasner'],Adelphi
0,941,1004.0,"['Donors give blood at an American Red Cross blood drive in Boothbay, Maine during the coronavirus pandemic\n      (David Stires)\n\n\nOne worried Red Cross staff member who spoke to Fox News on the condition of anonymity said she loves her job, but because staff and donors cannot possibly stand six\xa0feet apart during the blood collection, she fears that she and her colleagues are exposed to COVID-19.']",['David Stires'],Red Cross / Red Crescent Climate Centre
0,994,1059.0,"['CLICK HERE FOR COMPLETE CORONAVIRUS COVERAGE\n“We know it’s had an impact on bending that curve and buying us time,” Newsom said of the “Safer at Home” order, according to The Times.']",['Newsom'],The Times Think Tank
0,1026,1093.0,"['NFL COACHES, OFFICIALS PESSIMISTIC ABOUT 2020 SEASON STARTING ON TIME OVER CORONAVIRUS: REPORT\n“We have it all mapped out,” Boras said according to the Los Angeles Times.']",['Boras'],Dragonfly
0,1060,1132.0,"['""It\'s either reckless disregard of people\'s life or he knows what\'s occurring and pushing forward anyway,"" he said, adding that Xi believes the dominance of the Communist Party is above all else.']",['Xi'],Party School of the Communist Party of China Inner Mongolia Autonomous Region
0,1157,1232.0,"['“The 30-day shutdown, I can’t imagine that’s going to be the extent of it -- I think it’s going to be at least three months and people are saying even longer than that, but the longer it is the deeper the problem,” Dr. Stephen Miller, professor and director of UNLV’s Center for Business and Economic Research, told Fox News.']",['Stephen Miller'],Center for Business and Economic Research
0,1183,1259.0,"['""It could be that Japan, while on the front lines of the outbreak, was exposed at an early stage and might have dodged a bullet by focusing on preventing the virus from entering the country,"" said Nicholas Szechenyi, senior fellow and deputy director, Japan chair at the Center for Strategic and International Studies (CSIS).']",['Nicholas Szechenyi'],Center for Strategic and International Studies
0,1240,1324.0,"['20, Trump said that chloroquine and hydroxychloroquine if used together\xa0could help in treating the virus, the Times reported.']",['Trump'],The Times Think Tank
0,1244,1332.0,"['20, President Trump said that chloroquine and hydroxychloroquine if used together\xa0could help in treating the virus, the Times reported.']",['Trump'],The Times Think Tank
0,1254,1344.0,"[""We don't even know,” said Allyson Jaffe, the Improv’s co-owner.""]",['Allyson Jaffe'],International Maize and Wheat Improvement Center
0,1276,1366.0,"['European Union\nThe EU’s chief Brexit negotiator, Michel Barnier, said on Twitter last Thursday that he tested positive for the coronavirus last week.']",['Michel Barnier'],European Union Institute of Security Studies
0,1308,1412.0,"['The NFL has not made a public announcement regarding changes to the draft, but commissioner Roger Goodell said in a\xa0memo to league employees in mid-March:\xa0""Planning for the (NFL) Draft is a good example of how we need to think differently, embrace technology and collaborate.']",['Roger Goodell'],Dragonfly
0,1353,1458.0,"['Rapid testing and isolation of suspected cases, and painstaking tracing of contacts, helped by police, surveillance videos and ATM records, have helped prevent a worse local outbreak, said Tikki Pangestu, a visiting professor at the Lee Kuan Yew School of Public Policy and former director of WHO’s research policy and cooperation department.']",['Tikki Pangestu'],Lee Kuan Yew School of Public Policy
0,1372,1485.0,"[""Kim Yo Jong, first vice department director of the Central Committee of the Workers' Party of Korea, said her brother appreciated the letter during this time of “big difficulties and challenges,” according to a statement obtained by official Korean Central News Agency.""]",['Kim Yo Jong'],Party School of the Central Committee of C.P.C. (National Academy of Governance)
0,1450,1571.0,"['(Jason Mendez/Invision/AP, File)\n\n\nCohen had said earlier on Friday that he would\xa0be taping episodes at his New York City apartment instead of shutting down production completely.']",['Jason Mendez'],Vision
0,1455,1576.0,"['Claus Zehner, ESA’s Copernicus Sentinel-5P mission manager, said in a statement: “The decline in nitrogen dioxide\xa0concentrations over the Po Valley in northern Italy is particularly evident.""']",['Claus Zehner'],ESA Consultants
0,1456,1577.0,"[""((ESA))\n\n\nHIV DRUGS DON'T WORK AS CORONAVIRUS TREATMENT, CLINICAL TRIAL REVEALS\nJosef Aschbacher, ESA’s director of earth observation programs, said in a statement: “Satellites offer a unique vantage point to monitor the health of our planet.""]",['Josef Aschbacher'],ESA Consultants
0,1457,1578.0,"[""Peter Weber said on Thursday that his former airline, Compass, is 'ceasing operations.'""]",['Peter Weber'],Compass
0,1461,1582.0,"[""It's mainly just about getting my spin back.”\nRoethlisberger, who led the NFL with 5,129 passing yards in 2018, said he will gradually ramp up the number of days,\xa0throws, and the distance and velocity as time goes on.""]",['Roethlisberger'],Dragonfly
0,1467,1588.0,"['“The NICS center,\xa0where they do the background checks, they’ve confirmed that they have seen what they describe as astronomical increases,” Keane said.']",['Keane'],Environics Trust
0,1468,1589.0,"['The NICS section appreciates the public’s patience during this period of\xa0national emergency.”\n“If a check goes into delay status, those are going to take a while to get sorted out because they just don’t have the resources to do both the checks that are coming in as well as investigations for delayed checks,” Keane said.']",['Keane'],Environics Trust
0,1476,1597.0,"['In fact, Shea said, the NYPD Movie and Television Unit was called in to fill in depleted ranks at the 1st Precinct.']",['Shea'],Vision
0,1539,1664.0,"['“We decided because we’re all housebound as most of you are -- or should be -- that we would have a little fun,” Foster said Tuesday, according to People.']",['Foster'],Amazon Institute of People and the Enviroment
0,1550,1677.0,"['“We would expect physicians to follow CDC clinical criteria,” Quest spokeswoman Wendy Bost said.']",['Wendy Bost'],The Institute for 21st Century Questions
0,1590,1720.0,"['Telehealth and telemedicine help to keep “people safe and out of hospitals and doctors’ offices, map the virus and triage individuals needing medical care,” said Ann Mond Johnson, CEO of ATA, in a statement.']",['Ann Mond Johnson'],Swatantrata Center
0,1612,1747.0,"['""We thought a complimentary slice of cheesecake would provide our guests with some happiness during this time of uncertainty,"" said\xa0Donald Evans, the chief marketing officer of\xa0Cheesecake Factory, in a statement shared with People.']",['Donald Evans'],Amazon Institute of People and the Enviroment
0,1638,1775.0,"['“We need to be highly alert toward imported infection cases,” Dr. Zhong Nanshan, a Chinese government advisor, said at a news conference this week, according to The Times.']",['Zhong Nanshan'],The Times Think Tank
0,1654,1791.0,"['He deserves no platform,"" The Hill\'s Joe Concha said.']",['Joe Concha'],The Beacon Hill Institute
0,1674,1813.0,"['“This is an unprecedented challenge to the business,” said John Fithian, president and chief executive of NATO.']",['John Fithian'],Women's Coordinator
0,1684,1823.0,"['Rep. Carolyn Maloney, D-N.Y., chairwoman of the Committee on Oversight and Reform, said the changes to field operations ""[do]\xa0not affect your ability to self-respond,"" and she\xa0encouraged citizens to take the census online.']",['Carolyn Maloney'],Reform
0,1710,1850.0,"['That is why we are today making Fox News and FOX Television stations available to everyone in the country,” Fox Corporation Executive Chairman and CEO Lachlan Murdoch said.']",['Lachlan Murdoch'],Vision
0,1728,1871.0,"['IRELAND GIVING INMATES ALCOHOL-FREE HAND SANITIZERS TO FIGHT CORONAVIRUS OVER FEARS THEY WOULD MAKE MOONSHINE\nDistrict Attorney Larry Krasner,\xa0the Philadelphia Inquirer says, announced his office is trying to release most of those charged with non-violent offenses\xa0and\xa0misdemeanors without\xa0needing to post bail.']",['Larry Krasner'],Adelphi
0,1786,1932.0,"['(Department of State)\n\n\nAl-Mawla, an Iraqi national, was a member of\xa0ISIS’s predecessor organization, Al Qaeda, in Iraq, and helped drive the abduction, killing and trafficking of\xa0Yazidi religious minorities in northwest Iraq, the government said.']",['Al-Mawla'],International Crisis Group
0,1804,1953.0,"['In a press release, Met General Manager Peter Gelb said the hope is “to provide some grand opera solace to opera lovers in these extraordinarily difficult times.""']",['Peter Gelb'],ECONOMETRICA`
0,1841,1991.0,"[""But Trump's\xa0comments were said to have been\xa0taken out of context by the Times.""]",['Trump'],The Times Think Tank
0,1887,2041.0,"['Smith said the College Board faces particular difficulty because it gives all its tests on paper, while the ACT has developed some electronic exams.']",['Smith'],ArmActive Youth Center
0,1922,2079.0,"['FILE: Associates move bins filled with products at the loading dock of Amazon\'s then-new fulfillment center in Livonia, Mich.\n      (Detroit News via AP)\n\n\n""We are seeing a significant increase in demand, which means our labor needs are unprecedented for this time of year,"" said Dave Clark, who oversees Amazon\'s warehouse and delivery network.']",['Dave Clark'],AAN Associates
0,1963,2123.0,"['“This decision reflects our foremost priority – the health and safety of all fans and citizens,” NFL Commissioner Roger Goodell said in a statement.']",['Roger Goodell'],Dragonfly
0,1980,2140.0,"['“It’s farewell from us as we’re going home to be quarantined,” Bloom said, according to People.']",['Bloom'],Amazon Institute of People and the Enviroment
0,1993,2154.0,"['The outspoken tycoon who put Chinese President Xi Jinping and the Communist Party on blast for their abysmal handling of the coronavirus has gone missing, his friends say.']",['Xi Jinping'],Party School of the Communist Party of China Inner Mongolia Autonomous Region
0,1998,2160.0,"['Now, to have multiple teams hit me up, it definitely feels good,"" Harris said on the eve of the NFL\'s two-day legal tampering period that begins Monday.']",['Harris'],Dragonfly
0,2024,2187.0,"['Despite backlash and accusations of profiteering, Noah Colvin defended his methods to The Times, saying there was ""crushing overwhelming demand"" in areas not carrying the products.']",['Noah Colvin'],The Times Think Tank
0,2035,2199.0,"['""Unfortunately, rather than using best practices, this outbreak in Wuhan was covered up,"" O\'Brien said at the Heritage Foundation, a conservative-leaning think tank in Washington.']","[""O'Brien""]",Heritage Foundation
0,2045,2209.0,"['CORONAVIRUS: WHAT YOU NEED TO KNOW\xa0\n“While we knew we would arrive at this day at some point, it doesn’t lessen the impact,” OHA Director Patrick Allen said in a statement.']",['Patrick Allen'],Brookings Doha Center
0,2066,2232.0,"['When reached Friday after the Amazon suspension, Ranga said he objected to the way he and his wife were portrayed in the previous day’s story.']",['Ranga'],Amazon Environmental Research Institute
