,0,1,2,3,4
0,4550,7413.0,"['“It’s just shoveling money to her friends and not actually solving the problem,” Sen. Ted Cruz (R-Texas) said of House Speaker Nancy Pelosi in a separate Sunday interview on CBS.']",Nancy Pelosi,Congress—U.S. House of Representatives
0,4551,7417.0,"['White House press secretary Kayleigh McEnany said last week that Trump is the “most tested man in America,” sometimes taking “multiple” tests in one day.']",Trump,White House
0,4552,7419.0,"['You\'re in an auto, car boom right now"" -- with unemployment over 11 percent, Larry Kudlow wants you to believe the economy is great pic.twitter.com/62Dh6Lti5t\n— Aaron Rupar (@atrupar) July 26, 2020\n\nTreasury Secretary Steven Mnuchin said Sunday that the Senate Republicans’ draft relief bill would be released Monday.']",Steven Mnuchin,Department of the Treasury
0,4553,7423.0,['White House economic adviser Larry Kudlow said Sunday that the Trump administration plans to “lengthen” the current eviction moratorium that’s set to expire Friday — but he provided no details.'],Trump,White House
0,4556,7435.0,['White House economic adviser Larry Kudlow on Sunday said the Trump administration plans to “lengthen” the four-month federal eviction moratorium that is set to expire Friday.'],Trump,White House
0,4560,7444.0,['Homeland Security acting Secretary Chad Wolf denied that federal agents were inflaming the situation in Portland and said Wheeler legitimized criminality by going to the front of the crowd of demonstrators where fires were lit and people were trying to pull down the protective fence.'],Wheeler,Department of Homeland Security (DHS)
0,4564,7454.0,"['“In fact, we have a letter that we created that well over 100 members of Congress signed to send to the Treasury ― Democrats and Republicans alike ― asking them to help solve this problem,” Rogers said in an interview with Rupesh Patel, a Florida hotel owner and industry analyst.']",Rupesh Patel,Congress—U.S. House of Representatives
0,4574,7482.0,"['Glosser also denied the Trump administration’s claim that his mother didn’t die of COVID-19 complications, saying the White House had attempted to conceal the underlying cause of her death.']",Trump,White House
0,4578,7496.0,"['He told HuffPost that Bernhardt said at the start of the meeting, which included the leaders of four tribal nations along with local officials and Rep. Doug LaMalfa (R-Calif.), that he wouldn’t be wearing a mask because people were sitting spaced apart.']",Doug LaMalfa,House of Representatives
0,4587,7524.0,"['Jon Gustin, a Federal Bureau of Prisons official, said in a court filing that he made the decision to send\xa0Cohen\xa0back to prison.']",Cohen,Federal Bureau of Prisons (BOP)
0,4588,7529.0,"['Almost every major Democratic presidential candidate released a disability rights platform during the primaries, starting with Sen. Kamala Harris (D-Calif.), who focused on issues such as disability employment, accessible transportation and “Medicare for All.”\n\n\nFormer Rep. Beto O’Rourke (D-Texas) became the first 2020 presidential candidate to\xa0mention the disability community during a primary debate, saying in October that “any American with disabilities knows just how hard it is to make it and get by in this country.” Other candidates held Twitter town halls to answer questions from the disability community, including former Housing Secretary Julián Castro and Sen. Elizabeth Warren (D-Mass.']",Elizabeth Warren,Centers for Medicare and Medicaid Services (CMS)
0,4589,7536.0,"['Almost every major Democratic presidential candidate released a disability rights platform during the primaries, starting with Sen. Kamala Harris (D-Calif.), who focused on issues such as disability employment, accessible transportation and “Medicare for All.”\n\nFormer Rep. Beto O’Rourke (D-Texas) became the first 2020 presidential candidate to\xa0mention the disability community during a primary debate, saying in October that “any American with disabilities knows just how hard it is to make it and get by in this country.” Other candidates held Twitter town halls to answer questions from the disability community, including former Housing Secretary Julián Castro and Sen. Elizabeth Warren (D-Mass.']",Elizabeth Warren,Centers for Medicare and Medicaid Services (CMS)
0,4595,7549.0,"['White House staff just got an email that says there is “no reason for panic or alarm,” but the cafeterias in the two buildings next to the White House — the Executive Office Building and the New Executive Office Building — are closed because a staffer tested positive for Covid-19\n— Kaitlan Collins (@kaitlancollins) July 23, 2020\n\nEmail says contract tracing has been done and no West Wing staff need to quarantine at the time.']",Kaitlan Collins,White House
0,4596,7552.0,"['Nearly 3,500 public health experts sent an open letter to President Donald Trump amid a spate of attacks launched over the last two weeks at Dr. Anthony Fauci, the nation’s top infectious disease expert, calling those seeking to undercut him a “dangerous distraction.”\n\nIn the letter, which was organized by the Center for Science in the Public Interest, the group calls the coronavirus pandemic “one of the greatest challenges the United States has faced in its history.” But the signatories, which include two previous heads of the Food and Drug Administration, a former U.S. surgeon general and a former secretary of the Department of Health and Human Services, said they were troubled by efforts to smear Fauci, who they said has provided a clear voice to Americans during the health crisis.']",Fauci,"Civil Rights, Department of Health and Human Services Office for"
0,4597,7554.0,"['“We know now that it would,” she said, adding that White House coronavirus response coordinator Dr. Deborah Birx briefed Trump a day earlier ― before his first coronavirus briefing in months ― that “we have these studies now that prove what we suspected: which is that masks help prevent you from spreading it.”\xa0\n\nHealth experts, including those at the U.S. Centers for Disease Control and Prevention and the World Health Organization,\xa0changed their guidance more than three months ago.']",Trump,White House
0,4598,7556.0,"['“We know now that it would,” she said, adding that White House coronavirus response coordinator Dr. Deborah Birx briefed Trump a day earlier ― before his first coronavirus briefing in months ― that “we have these studies now that prove what we suspected: which is that masks help prevent you from spreading it.”\xa0\n\n\nHealth experts, including those at the U.S. Centers for Disease Control and Prevention and the World Health Organization,\xa0changed their guidance more than three months ago.']",Trump,White House
0,4611,7600.0,"['Johnson, a conservative who takes hardline stances of federal spending, said that while he supported honoring the day that has come to mark slavery’s end in the U.S., said doing so with a new holiday would “give federal workers a paid day off that the rest of America has to pay for.”\n\n\nHe also estimated that\xa0creating another federal holiday would cost the private sector “up to $600 million a year.”\n\n\nSenate Democrats, joined by Republican Sen. John Cornyn of Texas, proposed the federal holiday in June, one of the responses to nationwide protests spurred by the police killing of George Floyd in Minneapolis.']",George Floyd,Senate
0,4612,7602.0,"['Cornyn, in a speech Wednesday advocating for the federal holiday, said it presented Congress an opportunity to “demonstrate our nonpartisan support for this act of racial reconciliation in our country.”\n\n\nJohnson proposed a compromise.']",Johnson,Congress—U.S. House of Representatives
0,4613,7606.0,"['Johnson, a conservative who takes hardline stances of federal spending, said that while he supported honoring the day that has come to mark slavery’s end in the U.S., said doing so with a new holiday would “give federal workers a paid day off that the rest of America has to pay for.”\n\nHe also estimated that\xa0creating another federal holiday would cost the private sector “up to $600 million a year.”\n\nSenate Democrats, joined by Republican Sen. John Cornyn of Texas, proposed the federal holiday in June, one of the responses to nationwide protests spurred by the police killing of George Floyd in Minneapolis.']",George Floyd,Senate
0,4614,7608.0,"['Cornyn, in a speech Wednesday advocating for the federal holiday, said it presented Congress an opportunity to “demonstrate our nonpartisan support for this act of racial reconciliation in our country.”\n\nJohnson proposed a compromise.']",Johnson,Congress—U.S. House of Representatives
0,4624,7638.0,"['It was not established to be the president’s personal militia,” former Homeland Security Secretary Tom Ridge said during an interview with Sirius XM host Michael Smerconish.']",Michael Smerconish,Department of Homeland Security (DHS)
0,4634,7664.0,"['Jorge Sampaio, chairman of the prize’s grand jury, praised Thunberg’s ability to mobilize youth, saying her “tenacious struggle to alter a status quo that persists, makes her one of the most remarkable figures of our days.”\n\nAlong with this award, Thunberg has also been nominated for the Nobel Peace Prize twice and was named Time’s “Person of the Year” in 2019.']",Thunberg,Federal Maritime Commission
0,4636,7669.0,"['Jorge Sampaio, chairman of the prize’s grand jury, praised Thunberg’s ability to mobilize youth, saying her “tenacious struggle to alter a status quo that persists, makes her one of the most remarkable figures of our days.”\n\n\nAlong with this award, Thunberg has also been nominated for the Nobel Peace Prize twice and was named Time’s “Person of the Year” in 2019.']",Thunberg,Federal Maritime Commission
0,4637,7673.0,"['Wyden said he’s hoping to fold his proposal into the next major coronavirus legislation Congress passes, which Senate Majority Leader Mitch McConnell (R-Ky.) has said should happen in the next few weeks.']",Mitch McConnell,Senate
0,4650,7725.0,"['“In Congress, it’s important that we center the voices of people formerly incarcerated,” Haynes said, saying that members of Congress who craft legislation around issues like restoring voting rights for the formerly incarcerated need to “understand the impact these laws have on people’s lives.”\xa0\n\n\nDue to her felony record, Haynes had to petition a court earlier this year to restore her civil rights, without which she wouldn’t have been eligible to run for office.']",Haynes,Congress—U.S. House of Representatives
0,4651,7727.0,"['“In Congress, it’s important that we center the voices of people formerly incarcerated,” Haynes said, saying that members of Congress who craft legislation around issues like restoring voting rights for the formerly incarcerated need to “understand the impact these laws have on people’s lives.”\xa0\n\nDue to her felony record, Haynes had to petition a court earlier this year to restore her civil rights, without which she wouldn’t have been eligible to run for office.']",Haynes,Congress—U.S. House of Representatives
0,4655,7737.0,"['China’s ambassador to the U.S. has called Daines China’s “ambassador to Congress.”\n\n\n“It’s kind of hard to have this career in the private sector and then in Congress support this free trade with China and then come out as someone who is attacking China,” said David Parker, a Montana State University political scientist whose book, “Battle for the Big Sky,” chronicled Daines’ 2014 election.']",David Parker,Congress—U.S. House of Representatives
0,4659,7755.0,"['China’s ambassador to the U.S. has called Daines China’s “ambassador to Congress.”\n\n“It’s kind of hard to have this career in the private sector and then in Congress support this free trade with China and then come out as someone who is attacking China,” said David Parker, a Montana State University political scientist whose book, “Battle for the Big Sky,” chronicled Daines’ 2014 election.']",David Parker,Congress—U.S. House of Representatives
0,4665,7772.0,"['On his relationship with Anthony Fauci, the top infectious disease expert on the White House’s coronavirus task force, Trump told Wallace that it was “very good.”\n\n\n“I spoke to him yesterday at length,” the president said.']",Wallace,White House
0,4666,7777.0,"['On his relationship with Anthony Fauci, the top infectious disease expert on the White House’s coronavirus task force, Trump told Wallace that it was “very good.”\n\n“I spoke to him yesterday at length,” the president said.']",Wallace,White House
0,4670,7790.0,"['“It was a great day for Maryland.”\n\n\nThe White House fired back at Hogan’s editorial the same day it was published, with press secretary Kayleigh McEnany calling the governor’s words “revisionist history” and referencing the fact that Hogan had praised Trump during a video teleconference on March 19 for his “great communication.”\n\n\n“What is so striking to me about reading that op-ed is Governor Hogan begins with this dramatic April 18th scene where South Korea delivered tests, but just the day prior, he said something entirely different,” McEnany added.']",McEnany,White House
0,4705,30.0,"['And I think it’s clear that the urgency is just really present.”\n\n\nWhen he was considering a run for Senate, Booker said, at least one Kentucky Democrat openly dismissed the idea that a young, Black man could win in Kentucky.']",['Booker'],Senate
0,4710,37.0,['Democrats said in a May letter to Labor Secretary Eugene Scalia that the department should tell states to “proactively” help people with health conditions make the switch from state to federal benefits.'],['Eugene Scalia'],Bureau of International Labor Affairs
0,4721,51.0,"['Asked how he works with such a chaotic White House, Fauci said, “Well, that is a bit bizarre.']",['Fauci'],White House
0,4725,57.0,['McConnell has said Senate negotiations on the next aid package will begin in earnest next week when senators return to Washington from a recess.'],['McConnell'],Senate
0,4727,60.0,"['The benefits end on July 31, but Senate Majority Leader Mitch McConnell (R-Ky.) said Monday that senators won’t start negotiating in earnest until next week, when lawmakers return to the Capitol from recess.']",['Mitch McConnell'],Senate
0,4733,73.0,"['“I lead with love and I lead with grace, and I understand that people are stressed and they’re going through a lot, but I’ve dealt with some of the worst, meanest, rudest people that I’ve ever dealt with since I started selling products five years ago.” The USPS was hit with massive delivery delays in the first months of the pandemic, and customers whose masks arrived late threatened Godfrey with lawsuits and promises to “blast me on social media,” she said.']",['Godfrey'],Postal Service (USPS)
0,4746,87.0,"['A second White House adviser, who also spoke on condition of anonymity, said he expects some 15,000 attendees to end up coming to celebrate Trump’s nomination for a second term, while fundraising has now reached $20 million in commitments.']",['Trump'],White House
0,4747,89.0,"['These people were arguing about “re-skilling” during the slow recovery from the Great Recession, too, said Heidi Shierholz, director of policy at the progressive Economic Policy Institute and a former chief economist for the U.S. Department of Labor.']",['Heidi Shierholz'],Department of Labor (DOL)
0,4777,126.0,"['“Because people remember how good their lives were back in February.”\n\n\nPressing his point, Tillis said, “Can you imagine if we had had a Democrat president and a Democrat majority in the Senate and the House, what our economy would’ve looked like at the worst possible time?']",['Tillis'],Senate
0,4778,127.0,"['“Because people remember how good their lives were back in February.”\n\nPressing his point, Tillis said, “Can you imagine if we had had a Democrat president and a Democrat majority in the Senate and the House, what our economy would’ve looked like at the worst possible time?']",['Tillis'],Senate
0,4791,141.0,"['Both The Washington Post and NBC News said they received statements from the White House trying to discredit Fauci, who has given bleak interviews and issued dire warnings in recent days as the number of infections climb to record-breaking levels.']",['Fauci'],White House
0,4792,143.0,"['“Go be a blogger, go start a podcast, get out of the U.S. Senate, if that’s what you want to talk about,” Hayes said.']",['Hayes'],U.S. Senate
0,4793,144.0,"['Education Secretary Betsy DeVos said on Sunday that her department did not have its own safe reopening plans to promote, and each school district and state must devise their own plans based on their local coronavirus infection rates.']",['Betsy DeVos'],Barry M. Goldwater Scholarship and Excellence in Education Program
0,4794,146.0,"['He further criticized COVID-19 school safety guidelines released by the Centers for Disease Control and Prevention, calling them “very tough & expensive.”\n\n“May cut off funding if not open!” Trump said on Twitter Wednesday.']",['Trump'],Centers for Disease Control and Prevention (CDC)
0,4796,149.0,"['He further criticized COVID-19 school safety guidelines released by the Centers for Disease Control and Prevention, calling them “very tough  expensive.”\n\n\n“May cut off funding if not open!” Trump said on Twitter Wednesday.']",['Trump'],Centers for Disease Control and Prevention (CDC)
0,4805,164.0,"['Companies with ties to Congress that received loans in later rounds of PPP funding include the law firm that formerly employed the husband of Rep. Nita Lowey (D-N.Y.); he is retired from the firm and retains “no economic interest,” her spokesperson has said.']",['Nita Lowey'],Congress—U.S. House of Representatives
0,4810,172.0,"['!” Vice President Mike Pence, chair of the administration’s coronavirus task force, then said that\xa0there would be new guidance for schools and that the White House never intended for states to actually follow the original recommendations.']",['Mike Pence'],White House
0,4811,173.0,"['“The severe negative impacts of keeping schools closed, including mental and social development, are well documented, including by pediatricians,” White House spokesman Judd Deere said in an email.']",['Judd Deere'],White House
0,4813,175.0,"['“We have a dangerous and deadly virus out there, and we are now seeing a regular increase in cases in Kentucky.”\n\nHealth departments and “others” will be enforcing the rule, Beshear said.']",['Beshear'],Agency for Healthcare Research and Quality (AHRQ)
0,4815,178.0,"['“Some farms, who sell direct to consumers through CSAs and farmers markets, have expanded or offered online ordering, pickup and delivery to adapt to market closures or limited market access, and the need to provide products with minimal contact,” said Lillie Weiya Zeng, a U.S. Department of Agriculture spokesperson.']",['Lillie Weiya Zeng'],Department of Agriculture (USDA)
0,4816,181.0,"['A senior GOP aide said Senate Republicans are pushing for $1 trillion overall, and McConnell himself has said the Senate won’t come close to the $3 trillion amount that the Democratic House passed in May.']",['McConnell'],Senate
0,4827,194.0,"['Because Congress has not said otherwise, we hold the government to its word,”\xa0Justice Neil Gorsuch wrote in the majority opinion.']",['Neil Gorsuch'],Congress—U.S. House of Representatives
0,4833,203.0,"['And last week, Biden said educators should have more say in the new “teacher-oriented” Department of Education.']",['Biden'],Department of Education (ED)
0,4837,208.0,"['The informal Republican White House adviser said Republicans’ superior voter turnout operation would, in the end, let Trump win Florida.']",['Trump'],White House
0,4839,211.0,"['“That’s the reason why next week, the CDC is going to be issuing a new set of tools, five different documents that will be giving even more clarity on the guidance going forward.”\n\nThe CDC is under clear pressure from the White House to amend its current nonbinding guidelines for schools, which say, among other things, that teachers and students should wear cloth masks and that desks should be “at least 6 feet apart when feasible.” Trump tweeted earlier Wednesday that he disagreed with the CDC “on their very tough & expensive guidelines for opening schools” and “will be meeting with them!!']",['Trump'],White House
0,4841,219.0,"['“That’s the reason why next week, the CDC is going to be issuing a new set of tools, five different documents that will be giving even more clarity on the guidance going forward.”\n\n\nThe CDC is under clear pressure from the White House to amend its current nonbinding guidelines for schools, which say, among other things, that teachers and students should wear cloth masks and that desks should be “at least 6 feet apart when feasible.” Trump tweeted earlier Wednesday that he disagreed with the CDC “on their very tough  expensive guidelines for opening schools” and “will be meeting with them!!']",['Trump'],White House
0,4842,220.0,"['Senate Majority Leader Mitch McConnell (R-Ky.) said Monday that he would likely address schools in a bill to be unveiled sometime this month, though he said his top priority is blocking coronavirus-related lawsuits.']",['Mitch McConnell'],Senate
0,4843,221.0,['House Minority Leader Kevin McCarthy (R-Calif.) also said Congress should stop “frivolous lawsuits” and that the Department Health and Human Services should study whether the coronavirus is as transmissible among children as it is among adults.'],['Kevin McCarthy'],Congress—U.S. House of Representatives
0,4852,232.0,"['Michael Linden, director of the liberal advocacy group Groundwork Action, which commissioned the poll, said Congress shouldn’t cut the benefits “in the middle of a pandemic while it’s not safe for workers to get back on the job.”\n\n\nCongress added $600 to weekly unemployment benefits in March as part of the Coronavirus Aid, Relief and Economic Security (CARES) Act, but the extra money is set to expire on July 31.']",['Michael Linden'],Congress—U.S. House of Representatives
0,4853,235.0,"['Michael Linden, director of the liberal advocacy group Groundwork Action, which commissioned the poll, said Congress shouldn’t cut the benefits “in the middle of a pandemic while it’s not safe for workers to get back on the job.”\n\nCongress added $600 to weekly unemployment benefits in March as part of the Coronavirus Aid, Relief and Economic Security (CARES) Act, but the extra money is set to expire on July 31.']",['Michael Linden'],Congress—U.S. House of Representatives
0,4868,252.0,"['Speaking about protective equipment on the call, U.S. Health and Human Services Secretary Alex Azar said Tuesday that it’s important for gear to be reused and repurposed as a way to stretch the stocks and avoid shortages.']",['Alex Azar'],"Civil Rights, Department of Health and Human Services Office for"
0,4873,263.0,"['Senate Majority Leader Mitch McConnell (R-Ky.) said Monday that his “number one” policy for a bill sometime this month is to block “an epidemic of lawsuits” against businesses, schools and health care providers from employees, customers, students and patients.']",['Mitch McConnell'],Senate
0,4875,265.0,"['Rebecca Dixon, the Employment Law Project’s executive director, testified before a Senate committee in May against the idea of granting employers immunity related to coronavirus, saying “the courthouse doors have already been slammed shut” for many workers.']",['Rebecca Dixon'],Senate
0,4878,269.0,"['“These latest record-breaking numbers reflect the growing interest in these Senate battlegrounds and an unprecedented motivation to hold Republicans accountable,” Democratic Senatorial Campaign Committee spokesperson Lauren Passalacqua said in a statement.']",['Lauren Passalacqua'],Senate
0,4882,275.0,"['Grassley said he’d attended every previous Republican convention throughout his 40-year career in the Senate, reported the Register.']",['Grassley'],Senate
0,4887,282.0,"['Pence, who leads the White House coronavirus task force, has said on multiple occasions that a “whole of government approach” is being used to tackle the public health crisis.']",['Pence'],White House
0,4902,302.0,"['“While some areas were notably busy such as Soho and Portobello Road, we are pleased there were no significant issues or incidents in the capital.”\n\n\nHealth secretary Matt Hancock said most people were abiding by social distancing measures.']",['Matt Hancock'],Agency for Healthcare Research and Quality (AHRQ)
0,4905,305.0,['Former Food and Drug Administration Commissioner\xa0Scott Gottlieb said the nation is “right back where we were” when the first peak in coronavirus infections occurred earlier this year and noted concerning distinctions about the new surge.'],['Scott Gottlieb'],Food and Drug Administration (FDA)
