,0,1,2,3,4
0,2930,4130.0,"['The chairman of the Indonesian Red Cross, Jusuf Kalla, a former vice president of Indonesia, also said it was possible that the disease had already entered the country and that Indonesians might not recognize the symptoms as being coronavirus.']",['Jusuf Kalla'],Red Cross / Red Crescent Climate Centre
0,2936,4136.0,"['Dr. Jennifer Huang Bouey, an epidemiologist and senior policy researcher at the RAND Corporation, a research organization, said China had become a leader in the study of contagious disease.']",['Jennifer Huang Bouey'],RAND Corporation
0,2938,4138.0,"['Yanzhong Huang, a senior fellow for global health at the Council on Foreign Relations, said the official tendency to control and suppress remained strong.']",['Yanzhong Huang'],Council on Foreign Relations
0,2983,4186.0,"['“Unfortunately, many disease surveillance systems throughout African countries are weak and most of the continent lacks diagnostic capability,” said Dr. Ngozi Erondu, associate fellow in the Global Health Program at Chatham House, an international affairs research group in London.']",['Ngozi Erondu'],Chatham House
0,2996,4208.0,"['“Tariffs to date have clearly had a significant impact on imports from China,” said Brad Setser, a senior fellow at the Council on Foreign Relations.']",['Brad Setser'],Council on Foreign Relations
0,2997,4209.0,"['“They equally clearly have not led to a stronger U.S. manufacturing sector.”\nRather than bringing manufacturing back to the United States, the clash with China has caused American companies and consumers to shift purchases to other countries, like Mexico, Vietnam and South Korea, said Mary E. Lovely, a senior fellow at the Peterson Institute for International Economics.']",['Mary E. Lovely'],Peterson Institute for International Economics
0,2998,4210.0,"['China’s profits from what it sells to the United States and other nations helps fund its efforts to expand its influence around the globe, like its Belt and Road infrastructure building project, activities that do not benefit the United States, said Derek Scissors, a resident scholar at the American Enterprise Institute.']",['Derek Scissors'],American Enterprise Institute 
0,3042,4255.0,"['“We are paying attention to this issue,” Ma Guoqiang, the Chinese Communist Party secretary of Wuhan, said at a news conference there last Tuesday.']",['Ma Guoqiang'],Party School of the Communist Party of China Inner Mongolia Autonomous Region
0,3099,4316.0,"['“What you’ll see take place is a significant further slowdown in Chinese economic growth, and Chinese growth has been so important,” said Edward Alden, a senior fellow at the Council on Foreign Relations.']",['Edward Alden'],Council on Foreign Relations
0,3138,4356.0,"['Yanzhong Huang, a senior fellow for global health at the Council on Foreign Relations, said that China had invested a lot in building a robust public health infrastructure in the wake of SARS and that many of them were mostly well equipped to deal with infectious diseases.']",['Yanzhong Huang'],Council on Foreign Relations
0,3143,4364.0,"['Yanzhong Huang, a senior fellow for global health at the Council on Foreign Relations, said China had invested a lot in building a robust public health infrastructure in the wake of SARS and that many of them were mostly well equipped to deal with infectious diseases.']",['Yanzhong Huang'],Council on Foreign Relations
0,3148,4369.0,"['Mr. Xu had already secured free shipping through a Chinese airline, he said, and was working on an official channel with the Hubei Province Red Cross to accept and distribute donations of supplies.']",['Xu'],Red Cross / Red Crescent Climate Centre
0,3243,4500.0,"['Rashawn Ray, a sociologist and fellow at The Brookings Institution, said one crucial difference between the two plagues is that the coronavirus, like past diseases, may one day dissipate with a vaccine or medical breakthrough.']",['Rashawn Ray'],Brookings Institution
0,3244,4501.0,"['“We have seen incredible hardheartedness when it comes to the responses of governments such as France that talk the talk about human rights,” said Letta Tayler, a senior counterterrorism researcher at Human Rights Watch.']",['Letta Tayler'],Human Rights Watch
0,3255,4512.0,"['“Islam lost its brakes in 1979” — its resistance to extremism was badly compromised — said Mamoun Fandy, an expert on Arab politics.']",['Mamoun Fandy'],Institute of Islamic Understanding 
0,3270,4527.0,"['But young residents, unaffiliated with particular organizations, have led a more spontaneous uprising, said Mr. Griffin, a senior organizer with Community Change, a national activist group.']",['Griffin'],Center for Community Change
0,3291,4548.0,"['A one-way chartered flight from New York to Los Angeles, for example, would typically cost around $30,000 for a jet that seats eight people, said Jean De Looz, head of Americas for MySky, which helps jet owners manage costs.']",['Jean De Looz'],Institute of the Americas
0,3323,4582.0,"['“We would do everything in our power to raise awareness of the Chinese Communist Party influence in Australia,” Mr. Yiu said.']",['Yiu'],Party School of the Communist Party of China Inner Mongolia Autonomous Region
0,3338,4597.0,"['“It is not yet the time for parties, movidas and gatherings of all sorts,” Mr. Conte said in an address to Parliament on May 21, using a Spanish word for nightlife favored by older Italians.']",['Conte'],Parliamentary Institute of Benin
0,3339,4598.0,"['Gemma Calamandrei, who leads the behavioral science and mental health department at Italy’s National Health Institute, said that young people became an easy target for a general population that has lost a sense of control.']",['Gemma Calamandrei'],National Institute of Public Health
0,3361,4620.0,"['“Some clearly will be privately owned, but having empty cars running errands or circling for their owners is something that city streets were simply not designed for,” Philippe Crist, adviser for innovation and foresight at the International Transport Forum of the Organization for Economic Cooperation and Development, said via email.']",['Philippe Crist'],Trade Union Advisory Committee to the Organization for Economic Cooperation and Development
0,3394,4654.0,"['“When we think about what to do when benefits expire, it would be helpful to know how many people are actually getting them,” said Elizabeth Pancotti, a research assistant at the National Bureau of Economic Research.']",['Elizabeth Pancotti'],National Bureau of Economic Research
0,3417,4677.0,"['Carl Zimmer, who writes about science for The Times, said the study demonstrated that most people who get the virus do not end up passing it on; rather, outbreaks stem from a small number of super-spreaders.']",['Carl Zimmer'],The Times Think Tank
0,3423,4685.0,"['He once said that members of a hard-line pro-Brexit caucus in Parliament, the European Research Group, “should be treated like a metastasizing tumor and excised from the U.K. body politic.”\n\n\nDuring the referendum, he observed that some of these Conservative pro-Brexit lawmakers were too busy “shooting, skiing or chasing girls to do any actual work.” Among those he singled out for criticism was Bernard Jenkin, the chairman of the parliamentary committee that met digitally on Wednesday.']",['Bernard Jenkin'],Parliamentary Institute of Benin
0,3443,4705.0,"['Jonathan Stern, a distinguished research fellow at the Oxford Institute for Energy Studies, said Snam was a “really decently proactive company” that was “actually doing things.”\n\n\nSnam, whose home city of Milan has been hit hard by the coronavirus pandemic, has managed to keep the gas network humming throughout the country’s lockdown, partly by having key control room technicians spend 15-day shifts living in isolated accommodations at the company’s headquarters.']",['Jonathan Stern'],Oxford Institute for Energy Studies
0,3470,4732.0,"['Derek Norman, a news assistant at The Times, says that in the worst moments of his illness, when he felt short of breath and panicky, he would sit upright, focus on breathing steadily and picture a vivid memory.']",['Derek Norman'],The Times Think Tank
0,3473,4735.0,"['“There was definitely tension for a few days over what was an acceptable MSC,” Ms. Regev said.']",['Regev'],Gramsci Onlus Foundation
0,3474,4736.0,"['The decision was made by Nordstrom, which bought Jeffrey in 2005, “due to the impacts of Covid-19,” Mr. Kalinsky said when he broke the news on Instagram.']",['Kalinsky'],Jeffrey Cheah Institute on Southeast Asia
0,3475,4737.0,"['“We had a discussion yesterday” about answering a reporter’s query from The Times, Mr. King said.']",['King'],The Times Think Tank
0,3478,4740.0,"['“We’re fortunate enough that we aren’t seeing anyone say, ‘I’m not worried about sustainability, I’m just going to focus on survival right now,’” said Troy Swope, co-founder and chief executive of Footprint, which produces fiber-based alternatives to single-use plastics (cardboard, essentially).']",['Troy Swope'],Global Footprint Network
0,3494,4756.0,"['“This is why we need a federal nutrition safety net — hunger does not have state borders,” said Crystal FitzSimons of the Food Research and Action Center, a Washington advocacy group.']",['Crystal FitzSimons'],Food Research & Action Center
0,3544,4810.0,"['“Crises lead to accelerations, and this is best chance ever for online learning,” said Sebastian Thrun, a co-founder and chairman of Udacity.']",['Sebastian Thrun'],Audacity Africa Institute
0,3575,4841.0,"['The split management will make Parliament’s overhaul difficult to put into action, said Santiago Lago Peñas, a professor of economics at the University of Vigo.']",['Santiago Lago Peñas'],Parliamentary Institute of Benin
0,3589,4855.0,"['“If you accumulated $18 billion and you are a not-for-profit hospital system, what’s it for if other than a reserve for an emergency?” said Dr. Robert Berenson, a physician and a health policy analyst for the Urban Institute, a Washington research group.']",['Robert Berenson'],Urban Institute
0,3613,4879.0,"['Henry Timms, president of Lincoln Center in New York, said he hopes for performances on the center’s sizable outdoor plaza as soon as that is allowed.']",['Henry Timms'],Lincoln Center Center for Applied Ethics
0,3652,4918.0,"['“We hope there are safeguards in place,” said Norman J. Ornstein, a scholar at the American Enterprise Institute who participated in the task force.']",['Norman J. Ornstein'],American Enterprise Institute 
0,3661,4931.0,"['The restart, said Mike Bass, the spokesman, would be at the ESPN Wide World of Sports Complex, which would act as “a single site for an N.BA.']",['Mike Bass'],Stefan Batory Foundation
0,3667,4937.0,"['“We’re still learning who the best people are to do this,” said Dr. John Welch, who is overseeing recruitment and training of contact tracers for Massachusetts in collaboration with the nonprofit Partners in Health.']",['John Welch'],Partners in Health
0,3680,4950.0,"['He conceded that there is a struggle for investment now, but insisted that NATO militaries had shown their usefulness during the pandemic and that “investing in defense can be a powerful engine for economic recovery.”\n\n\nBut it was obvious, Mr. Stoltenberg said, that “the European Union cannot defend Europe” without the United States.']",['Stoltenberg'],Women's Coordinator
0,3681,4951.0,"['“Any European leader who talks of strategic autonomy and a European army and can’t come up with a single euro for mobility — well, no one will take that seriously, either in the United States or among adversaries,” said Mr. Hodges, who works with the Center for European Policy Analysis.']",['Hodges'],Center for European Policy Analysis
0,3682,4952.0,"['Anna Wieslander, a Swedish defense expert with the Atlantic Council, said that the funding debacle dashes dreams of European autonomy.']",['Anna Wieslander'],Atlantic Council
0,3683,4953.0,"['“It will be harder for European governments, like Italy, to say that we need to spend more on defense to reach 2 percent” of GDP, the NATO guideline that obsesses Mr. Trump, he said.']",['Trump'],Women's Coordinator
0,3684,4954.0,"['“It’s not that the Americans won’t want to come to Europe’s defense,” she said, “but will they be able to?”\n\n\nIn Britain, still a key to European and NATO defense, the virus has postponed a review of foreign and defense policy, meant to run in parallel with a spending review, said Malcolm Chalmers, deputy director of RUSI, a defense think tank.']",['Malcolm Chalmers'],Women's Coordinator
0,3700,4970.0,"['“There is more responsiveness required,” said Richard Shaw, a politics professor at Massey University in Palmerston North, New Zealand.']",['Richard Shaw'],Center for Justice and Peace Development - Massey University
0,3712,4983.0,"['Among white evangelical Protestants who favor Republicans, 77 percent said Mr. Trump was doing a good job dealing with the pandemic, down from 83 percent who thought so in March, according to a poll by the Pew Research Center.']",['Trump'],Pew Research Center
0,3775,5046.0,"['Mr. Biden also said he thought large corporations like Amazon should begin to pay their taxes, though he sidestepped a question on whether the large conglomerate should be broken up by the government.']",['Biden'],Amazon Environmental Research Institute
0,3776,5047.0,"['“I think Amazon should start paying their taxes,” Mr. Biden said.']",['Biden'],Amazon Environmental Research Institute
0,3780,5051.0,"['“They eliminated their own competitive advantage they had built over 20 years,” said John Ghiorso, who runs Orca Pacific, an agency that helps brands run their Amazon business.']",['John Ghiorso'],Amazon Environmental Research Institute
0,3781,5052.0,"['Amazon “pushed the rabbit through the python,” said Eric Heller, a former Amazon senior manager who advises major brands at Wunderman Thompson Commerce.']",['Eric Heller'],Amazon Environmental Research Institute
0,3792,5063.0,"['If a disaster struck a part of the country that was under large-scale quarantine, “we would really have to back away from some of our response in those areas,” Mary Casey-Lockyer, a senior associate with the disaster health program for the American Red Cross, said during a webinar for nonprofits last week.']",['Mary Casey-Lockyer'],Red Cross / Red Crescent Climate Centre
0,3798,5069.0,"['• The Times’s Conor Dougherty wondered whether workers would move farther into the suburbs rather than completely leaving, say, the Bay Area.']",['Conor Dougherty'],The Times Think Tank
0,3799,5070.0,"['Speaking to editors and reporters from The Times yesterday, Mr. Greenberg said that the pandemic had turned businesses upside down, but that it doesn’t mean every business with a policy has a valid claim.']",['Greenberg'],The Times Think Tank
0,3801,5072.0,"['Our special guest, Sapna Maheshwari, who covers the retail industry for The Times, said that stores were planning to reopen by the end of July and hoping that the trickle of revenue keeps them afloat until the holiday season.']",['Sapna Maheshwari'],The Times Think Tank
0,3841,5114.0,"['“Beijing seems to have made the calculation that there is no financial price it won’t pay in order to eliminate the sight of millions of Chinese clamoring for democracy on a daily basis,” said Elizabeth Economy, the director for Asia studies at the Council on Foreign Relations.']",['Elizabeth Economy'],Council on Foreign Relations
0,3896,5172.0,"['This essay is part of The Big Ideas, a special section of The Times’s philosophy series, The Stone, in which more than a dozen artists, writers and thinkers answer the question, “Why does art still matter?”\n\n\nI was home schooling my 5-year-old daughter almost two weeks into our Covid-19-induced lockdown when our pug, Doug, suddenly began chasing his tail.']",['Doug'],The Times Think Tank
0,3965,5245.0,"['“The Armory is the way we used to feel about going to BAM back in the ’80s,” Mr. Jones said, referring to the Brooklyn Academy of Music.']",['Jones'],Alabama Policy Institute
0,3974,5254.0,"['“I often say that celebrities get the worst treatment,” Richard Friedman, a psychiatrist at Weill Cornell Medical College (and a contributing opinion writer for The Times), told me.']",['Richard Friedman'],The Times Think Tank
0,3994,5275.0,"['They insist it is a simple matter of fairness: the government cannot ask other people to go back to their jobs while exempting members of Parliament, said Jacob Rees-Mogg, the leader of the House of Commons, whose self-consciously archaic mannerisms earned him the nickname, “the honorable member for the 18th century.”\n\n                  But the Conservatives also believe a more crowded House of Commons would function better than the current one, in which a handful of lawmakers attend in person while the rest join virtually from their homes.']",['Jacob Rees-Mogg'],Parliamentary Institute of Benin
0,3995,5276.0,"['“It’s much easier to manage, control and communicate with members of Parliament if they are on site, rather than having them dispersed and communicating with each other via WhatsApp,” said Ruth Fox, director of the Hansard Society, a research organization focused on Parliament.']",['Ruth Fox'],Hansard Society
0,3996,5277.0,"['Still, they said, the image of a prime minister, isolated and wilting under the scrutiny of a confident Labour leader could chip away at the breezy triumphalism Mr. Johnson has shown since his landslide election victory.']",['Johnson'],Labour Market Information System
0,4017,5317.0,"['“A war is less likely to happen, but there is still the risk of a confrontation,” said Randa Slim, a senior fellow at the Middle East Institute.']",['Randa Slim'],Middle East Institute
0,4020,5320.0,"['“What we’ve been seeing coming out of Iran over the past couple of months is more easily explained as a tactical shift in each theater that makes sense in that theater, rather than a strategic change” said Jarrett Blanc, a senior fellow at the Carnegie Endowment for International Peace.']",['Jarrett Blanc'],Carnegie Endowment for International Peace
0,4021,5321.0,"['“Iran considers Iraq one of its two most important countries in terms of its security because it knows that what happens in Iraq is not going to stay in Iraq,” said Ariane Tabatabai, a Middle East fellow at the German Marshall Fund.']",['Ariane Tabatabai'],German Marshall Fund of the United States
0,4023,5323.0,"['“This crisis tells us something about leadership, and how important the Franco-German engine is, and how bad things can go without that,’’ said Nathalie Tocci, an adviser to the European Union and head of Italy’s Institute of International Affairs.']",['Nathalie Tocci'],Institute of International Affairs
0,4033,5341.0,"['Mayor, I echo your framing and I just want to clarify that there was always a spirit of collaboration.”\n\n\nMr. de Blasio said that her absence from news conferences after the articles in The Post and The Times last week was a simple matter of her not being needed those days.']",['de Blasio'],The Times Think Tank
0,4036,5346.0,"['Mayor, I echo your framing and I just want to clarify that there was always a spirit of collaboration.”\n\n                  Mr. de Blasio said that her absence from news conferences after the articles in The Post and The Times last week was a simple matter of her not being needed those days.']",['de Blasio'],The Times Think Tank
0,4053,5373.0,"['billy collins\nAnd another — in The Times last week, this guy writing from Paris said you could hear ducks quacking on the Seine.']",['billy collins'],The Times Think Tank
0,4102,5439.0,"['Dave Clark, who runs Amazon’s global operations, said in a statement that “we were earlier than most when rolling out broad protective measures for our teams, and we’ve adapted every day to make improvements.” He pointed out that the warehouse is in a region with a high community infection rate and said he didn’t think employees had caught the virus at work.']",['Dave Clark'],Amazon Environmental Research Institute
0,4162,5539.0,"['“We’ve never seen a surge like this across a range of products,” said Robert Margevicius, executive vice president of Specialized, one of the largest bicycle companies in the United States.']",['Robert Margevicius'],Specialized Institute of Research and Training in Legal Sciences
0,4171,5551.0,"['But Ghana’s finance minister, Ken Ofori-Atta, said in a video interview with the Center for Global Development that China needed to do more and “come on stronger.”\n\n\nChinese officials insist that they will continue to do projects in the developing world.']",['Ken Ofori-Atta'],Center for Global Development
0,4173,5558.0,"['“China is politically on the back foot,” said Andrew Small, senior fellow at the German Marshall Fund.']",['Andrew Small'],German Marshall Fund of the United States
0,4175,5560.0,"['“China wants to keep Belt and Road countries divided, as they are stronger than each country individually,” said Benn Steil, the director of international economics at the Council of Foreign Relations.']",['Benn Steil'],Council on Foreign Relations
0,4176,5561.0,"['But Ghana’s finance minister, Ken Ofori-Atta, said in a video interview with the Center for Global Development that China needed to do more and “come on stronger.”\n\n                  Chinese officials insist that they will continue to do projects in the developing world.']",['Ken Ofori-Atta'],Center for Global Development
0,4177,5562.0,"['“It’s a reckoning for China,” said Scott Morris, a senior fellow at the Center for Global Development, a think tank.']",['Scott Morris'],Center for Global Development
0,4183,5569.0,"['“Far too much of the onus is on the workers to find out if they are covered,” said Jessica Mason, a policy analyst with the National Partnership for Women and Families.']",['Jessica Mason'],National Partnership for Women and Families
0,4198,5590.0,"['John Welch, a director of operations with Partners in Health, said he was impressed with the range of people who wanted to help.']",['John Welch'],Partners in Health
0,4216,5620.0,"['“In a country where impunity reigns, the administration is effectively granting police a license to kill,” said Ilona Szabó, executive director of the Igarapé Institute, which studies public safety.']",['Ilona Szabó'],Igarapé Institute
0,4217,5621.0,"['“But you can’t expect that the criminals will respect you.”\n\n\nPaulo Roberto Cunha, a prosecutor who specializes in police violence, said the rise in killings by officers in the 41st Battalion is alarming, and he noted that no officers were killed or wounded in the confrontations analyzed by The Times.']",['Paulo Roberto Cunha'],The Times Think Tank
0,4253,5673.0,"['“Rather than paralysis that is being manifested by consecutive election campaigns, we could have paralysis with a government that cannot decide anything,” said Yohanan Plesner, president of the nonpartisan Israel Democracy Institute.']",['Yohanan Plesner'],Israel Democracy Institute
0,4276,5713.0,"['France had decided “that it was no longer necessary to keep massive stocks in the country, considering that production plants were able to be operational very quickly, especially in China,” the health minister, Olivier Véran, said in Parliament in March.']",['Olivier Véran'],Parliamentary Institute of Benin
0,4281,5727.0,"['Mr. Goldberg, the College Board spokesman, said that when it became clear the A.P.']",['Goldberg'],Sou da Paz Institute
0,4289,5741.0,"['Lyudmila Denisova, a human rights ombudsman for Ukraine’s Parliament, said the stranded babies underscore a pressing need for the country to bar foreigners from hiring Ukrainian women as surrogate mothers.']",['Lyudmila Denisova'],Parliamentary Institute of Benin
0,4312,5776.0,"['“A lot of things that were free may not be free anymore,” said Kristin Smith Diwan, an analyst at the Arab Gulf States Institute in Washington.']",['Kristin Smith Diwan'],The Arab Gulf States Institute in Washington
0,4313,5777.0,"['But at current oil prices and government spending levels, Saudi Arabia would run out of money in three to five years, forcing it to take on additional debt, said Karen Young, a fellow at the Arab Gulf States Institute in Washington.']",['Karen Young'],The Arab Gulf States Institute in Washington
0,4328,5796.0,"['Jean-François Bérot, a member of the Sud-Solidaires union, which brought the case against Amazon last month, said the accord represented a “true compromise.”\n\n\nUnder the deal, he said, Amazon managers would meet with a workers’ committee and unions once a week to evaluate safety conditions.']",['Jean-François Bérot'],Amazon Environmental Research Institute
0,4330,5798.0,"['Jean-François Bérot, a member of the Sud-Solidaires union, which brought the case against Amazon last month, said the accord represented a “true compromise.”\n\n                  Under the deal, he said, Amazon managers would meet with a workers’ committee and unions once a week to evaluate safety conditions.']",['Jean-François Bérot'],Amazon Environmental Research Institute
0,4469,6014.0,"['“Health care has always been viewed as recession-proof, but it’s not pandemic-proof,” said Dr. David Blumenthal, president of the Commonwealth Fund, a health research organization.']",['David Blumenthal'],The Commonwealth Fund
0,4480,6025.0,"['“They are smart to take advantage of the lag and lack of disciplined delivery of education,” said Jeanne Allen, the chief executive of the Center for Education Reform.']",['Jeanne Allen'],Reform
