,0,1,2,3,4
0,1,1.0,"['Melissa Knapp, a moderator for the Sew Face Masks for Quincy, IL Healthcare Workers Facebook group, said she has received numerous messages threatening to limit her posts.']",['Melissa Knapp'],Quincy Institute
0,12,13.0,"['“There’s no playbook for how you cover sports when sports are not being played,” said Randal Archibold, the Sports editor for The Times.']",['Randal Archibold'],Sports Think Tank
0,13,14.0,"['Benjamin Hoffman, a senior Sports editor, said that covering the coronavirus hadn’t been as difficult as one might expect because sports coverage prepares reporters and editors to respond immediately to drastic change.']",['Benjamin Hoffman'],Sports Think Tank
0,21,22.0,"['Eric Heller, a former Amazon senior manager who advises major brands at Wunderman Thompson Commerce, said his clients saw canned meat sales rise 700 percent.']",['Eric Heller'],Amazon Environmental Research Institute
0,22,23.0,"['“We’re not going to ship a prom dress or a Ping-Pong table if that’s going to slow down in any way the intake or outflow of essential items.”\nA ‘particularly insufficient’ response\n\n\nWhen Amazon announced unlimited unpaid leave, it also said it would pay two weeks of sick time for “all Amazon employees diagnosed with Covid-19 or placed into quarantine.” On Friday, a day after it received questions from The Times about the situation, Amazon said it had issued a check for Mr. Manrique’s father-in-law, who is ending his second week of quarantine.']",['Manrique'],Amazon Environmental Research Institute
0,52,57.0,"['“The reason why we in Germany have so few deaths at the moment compared to the number of infected can be largely explained by the fact that we are doing an extremely large number of lab diagnoses,” said Dr. Christian Drosten, chief virologist at Charité, whose team developed the first test.']",['Christian Drosten'],Prisma Charity Association
0,54,59.0,"['That, too, could help Mr. Starmer, analysts said, by making Labour look more plausible as a governing party.']",['Starmer'],Labour Market Information System
0,58,63.0,"['“I think a lot of it will remain this way after this crisis,” said Beccy Baird, a senior fellow at the King’s Fund, a health care research charity.']",['Beccy Baird'],The King's Fund
0,101,124.0,"['“In the 10 years I took to write her biography, I observed many Janes,” she wrote in an essay for The Times in 2011.']",['Janes'],The Times Think Tank
0,119,146.0,"['“The speed of the job losses is unlike anything we’ve ever seen,” said Gabriel Mathy, an assistant professor at American University whose specialty is economic history.']",['Gabriel Mathy'],"Center of Gender Development and Studies,  American University of Iraq"
0,141,174.0,"['“It’s the longest running live thing The Times has ever done,” said Rebecca Blumenstein, a deputy managing editor.']",['Rebecca Blumenstein'],The Times Think Tank
0,155,188.0,"['“It’s easy to get your words in” during team meetings, said Vicki Crosson, a software engineer on The Times’s search team.']",['Vicki Crosson'],The Times Think Tank
0,160,193.0,"['“Exempting health care providers and emergency responders threatens our nation’s ability to fight back against the coronavirus and makes us all more vulnerable,” said Heather Boushey, the president of the Washington Center for Equitable Growth, a think tank focused on inequality and growth.']",['Heather Boushey'],Washington Center for Equitable Growth
0,201,238.0,"['They have thoughts\nGreg Bensinger, a member of The Times editorial board, said our reliance right now on big companies like Amazon and Walmart should not override questions about whether they mistreat workers or unfairly muscle out rivals.']",['Greg Bensinger'],The Times Think Tank
0,215,256.0,"['“To me it’s very short sighted,” Dmitri Trenin, the director of the Moscow Carnegie Center, said of the former Soviet leaders’ minimizing the epidemic.']",['Dmitri Trenin'],Carnegie Moscow Center
0,265,321.0,"['“The matching part may take longer, and it’s legitimate for them to say that one group will get payments faster and one group will be slower,” said Sharon Parrott, senior vice president for federal policy and program development with the Center on Budget and Policy Priorities.']",['Sharon Parrott'],Center on Budget and Policy Priorities
0,325,390.0,"['There’s a report led by Dr. Scott Gottlieb from the American Enterprise Institute that says we need a national capacity to do 750,000 tests a week.']",['Scott Gottlieb'],American Enterprise Institute 
0,348,415.0,"['Ren Hong, an infrastructure development inspector at the National Development and Reform Commission, said China had only 173 air freighters while the United States had more than 550.']",['Ren Hong'],Energy Research Institute National Development and Reform Commission
0,372,443.0,"['“We cannot afford to lose hours in this crisis, much less days, in the production of ventilators,” Mr. Navarro said, adding that G.M.']",['Navarro'],Stiftung Marktwirtschaft
0,376,447.0,"['“The decision that the Hungarian Parliament took yesterday is a watershed moment,” Mr. Freund said.']",['Freund'],Parliamentary Institute of Benin
0,377,448.0,"['Daniel Kelemen, a professor European Union politics and law at Rutgers University, said the epidemic could prove an opportunity for the Hungarian leader.']",['Daniel Kelemen'],European Union Institute of Security Studies
0,437,514.0,"['\u200b“Given the global shortage of supplies and items being available in different locations, we are still in the process of procuring the items,” said Ellie Van Baaren, a Red Cross spokeswoman.']",['Ellie Van Baaren'],Red Cross / Red Crescent Climate Centre
0,439,516.0,"['“There is a lack of a single coherent lead agency or a single coherent policy for maritime security,” said Evan Laksmana, a senior researcher at the Center for Strategic and International Studies in Jakarta, the Indonesian capital.']",['Evan Laksmana'],Center for Strategic and International Studies
0,461,540.0,"['Timothy Carter, an Amazon spokesman, said the accusations were unfounded.']",['Timothy Carter'],Amazon Environmental Research Institute
0,463,544.0,"['Seth Hanlon, a senior fellow at the liberal Center for American Progress, said the same logic was also a reason not to lift the limit in the next economic rescue bill.']",['Seth Hanlon'],Center for American Progress
0,474,555.0,"['“The math is now clear,” said Guy Cecil, the chairman of Priorities.']",['Guy Cecil'],Center on Budget and Policy Priorities
0,478,559.0,"['“These are cascades that, once they get going, are very hard to stop,” said Claudia Sahm, head of macroeconomic policy for the Washington Center for Equitable Growth.']",['Claudia Sahm'],Washington Center for Equitable Growth
0,494,575.0,"['But when the government ordered the closing of all schools, and initially capped gatherings at 10 people — the minimum needed for a quorum, or minyan, for Jewish worship services — ultra-Orthodox rabbis did not all acquiesce, said Gilad Malach, an expert on the ultra-Orthodox at the Israel Democracy Institute.']",['Gilad Malach'],Israel Democracy Institute
0,503,586.0,"['Ms. Lanier, the Met’s social media manager, said the museum was trying several approaches.']",['Lanier'],ECONOMETRICA`
0,504,591.0,"['“They are going to be very badly hurt,” said Santiago Levy, a Mexican economist and senior fellow at the Brookings Institution in Washington, D.C.']",['Santiago Levy'],Brookings Institution
0,506,593.0,"['Eligible recipients, he said, would be “humble, hard-working people.”\n\n\nMr. Levy of the Brookings Institution said that even if governments go through with these cash handouts and other compensatory programs, many workers in the region’s informal labor sector are invisible to government agencies because they don’t appear on social security or tax registries.']",['Levy'],Brookings Institution
0,516,603.0,"['Ehab Fares, the chief executive of BSocial, a digital agency in Cairo, said he could never have imagined that Mecca would be closed when he began working on an updated version of Experience Mecca, an app that offers a virtual walk-through of the Kaaba, Islam’s holiest site.']",['Ehab Fares'],Institute of Islamic Understanding 
0,554,650.0,"['“We are doing it for the community; it seems to be a good thing, a release that people need right now,” Jeff Hanle, a spokesman for the Aspen Skiing Company, said of permitting uphill access at Aspen’s four otherwise shuttered ski areas.']",['Jeff Hanle'],Aspen France Institute
0,558,654.0,"['“In 2014, Iraq was fighting against ISIS and could bank on the support of its partners, on other countries, but now the whole world is occupied with the coronavirus and it may be more difficult to raise the money,” said Mr. Birol, of the International Energy Agency.']",['Birol'],International Crisis Group
0,559,655.0,"['Senator Richard Gordon, the head of the Philippine Red Cross, said that medical teams had been dispatched to the airport to respond to the crash involving Lion Air Flight 5880.']",['Richard Gordon'],Red Cross / Red Crescent Climate Centre
0,570,668.0,"['And there are instances where the police treat them inhumanely,” said Ashwin Parulkar, a senior researcher specializing in India’s homeless population for the Center for Policy Research in Delhi.']",['Ashwin Parulkar'],Ehime Center for Policy Research
0,596,696.0,"['The mobilization in the medical field recalls organizing efforts during World War II, said Robert Citino, executive director of the Institute for the Study of War and Democracy at the National World War II Museum in New Orleans.']",['Robert Citino'],Institute for the Study of War
0,647,764.0,"['“It’s like a shadow state,” said Michael Knights, an analyst at the Washington Institute for Near East Policy, who has studied the group for more than a decade.']",['Michael Knights'],Washington Institute for Near East Policy
0,661,785.0,"['Rondello, a disaster epidemiologist at the College of Nursing and Public Health at Adelphi University in New York, said he had been trying to remember these efforts even as he despairs over the patchwork response around the country.']",['Rondello'],Adelphi
0,663,787.0,"['The mobilization in the medical field recalls organizing efforts during World War II, said Robert Citino, executive director of the Institute for the Study of War and Democracy at the National WWII Museum in New Orleans.']",['Robert Citino'],Institute for the Study of War
0,679,814.0,"['“People had opinions about this president very early in his administration, and they were strongly held opinions,” Alec Tyson, a senior researcher at the Pew Research Center, said in an interview.']",['Alec Tyson'],Pew Research Center
0,681,816.0,"['After matching with a New Zealand musician on Hinge, a dating app, Morgane Clément-Gagnon, an artist and photographer, said she was giddy after the two began a video call: He was handsome, the banter was easy and they shared a passion for the arts.']",['Morgane Clément-Gagnon'],Greenhinge Institute
0,696,834.0,"['Clark Neily, the vice president of criminal justice at the Cato Institute, a libertarian policy research group, said he was all for reducing the jail population because he believed way too many people were locked up to begin with.']",['Clark Neily'],Cato Institute
0,697,835.0,"['“This is an opportunity for us to dissect some of these policies to ensure that they’re right,” said Danyelle Solomon, the vice president of race and ethnicity at the Center for American Progress, a liberal think tank.']",['Danyelle Solomon'],Center for American Progress
0,703,841.0,"['Farmers will face more dire prospects as travel is cut off altogether to contain the epidemic, said Sarah Boparan, operational director at HOPS, a recruiter that typically brings in workers from Romania, Bulgaria and other European Union countries.']",['Sarah Boparan'],European Union Institute of Security Studies
0,714,859.0,"['But Jeffrey Gettleman, The Times’s New Delhi bureau chief, says that inadequate planning and confusion about the rules have led to chaos after just one day.']",['Jeffrey Gettleman'],The Times Think Tank
0,725,876.0,"['“China clearly no longer sees Western journalists as useful or critical to getting its message out,” said Daniel M. Kliman, a senior fellow at the Center for a New American Security and a former Asia policy official in the Pentagon.']",['Daniel M. Kliman'],Center for a New American Security
0,740,891.0,"['About 11 million of the nation’s roughly 44 million renters were paying half their incomes in rent before the pandemic, said Mary Cunningham, the vice president for metropolitan housing at the Urban Institute.']",['Mary Cunningham'],Urban Institute
0,746,897.0,"['“These challenges all started when people began to stay home and go into quarantine,” said Taylor Loren, head of content marketing at Later, an Instagram marketing platform.']",['Taylor Loren'],Laterite data research advisory
0,770,924.0,"['“I never believed that the Parliament elections could be beneficial for the Arabs,” said Yazeed Baloum, a 33-year-old building contractor, after voting in the Arab town of Taybeh.']",['Yazeed Baloum'],Parliamentary Institute of Benin
0,775,929.0,"['Mr. Muscarella said he would use a loan to give low-wage employees an incentive not to abandon their jobs, as home delivery services like Amazon and GrubHub begin to lure workers away.']",['Muscarella'],Amazon Environmental Research Institute
0,791,951.0,"['Dr. Tomoya Saito, director of the department of health crisis management at the National Institute of Public Health, said the limited testing was intentional.']",['Tomoya Saito'],National Institute of Public Health
0,793,953.0,"['Matthew Downie, director of policy at Crisis, a national homeless charity, welcomed the effort but said it was nowhere near the scale it needed to be.']",['Matthew Downie'],International Crisis Group
0,804,966.0,"['“Health care was always going to be a big issue in the general election, and the coronavirus epidemic will put health care even more top of mind for voters,” said Larry Levitt, the executive vice president for health policy at the Kaiser Family Foundation, a nonpartisan research organization.']",['Larry Levitt'],Kaiser Family Foundation
0,811,974.0,"['“The bottom has dropped out of the luxury market,” Marc Lotenberg, the chief executive of W’s parent company, Future Media Group, said on Wednesday evening.']",['Marc Lotenberg'],Tomorrow's Company
0,835,1005.0,"['“This is very clearly a consequence of the hardball game that the Americans are playing right now,” said Wolfgang Petritsch, a former European Union envoy in Kosovo.']",['Wolfgang Petritsch'],European Union Institute of Security Studies
0,836,1006.0,"['“This is not a matter for our president and the President of Serbia — that time is gone,” Mr. Kurti said in an interview with The Times in Kosovo last month.']",['Kurti'],The Times Think Tank
0,853,1023.0,"['“It is incredibly important that policymakers credibly convince business owners that these conditional loans will indeed be forgiven and that firms’ owners will be treated equitably,” said Stan Veuger, an economist at the conservative American Enterprise Institute.']",['Stan Veuger'],American Enterprise Institute 
0,856,1026.0,"['“Much of the small business community is facing an extinction-level event,” said John Lettieri, the chief of the Economic Innovation Group think tank in Washington, who pushed heavily for a package of small business loans in the agreement.']",['John Lettieri'],Economic Innovation Group
0,864,1035.0,"['“Ideally you want all those small and medium-sized businesses that were solvent and doing a great job as of Feb. 1 to still be around and able to do business when folks can get back to work,” said Heather Boushey, president of the Washington Center for Equitable Growth.']",['Heather Boushey'],Washington Center for Equitable Growth
0,883,1056.0,['Colton Underwood: The leading man on Season 23 of the ABC reality show “The Bachelor” and former NFL football player said in an Instagram post on March 20 that he had tested positive.'],['Colton Underwood'],Dragonfly
0,907,1085.0,"['Citing the virus, Mr. Edelstein first disbanded Parliament last week and then let it reconvene but said he would not allow a vote to choose a new speaker.']",['Edelstein'],Parliamentary Institute of Benin
0,908,1086.0,"['“I think that the prime minister would have been infinitely more bruised if the decision happened in the context of where Japan was just a few weeks ago,” said Mireya Solís, co-director of the Center for East Asia Policy Studies at the Brookings Institution in Washington.']",['Mireya Solís'],Brookings Institution
0,952,1147.0,"['Around half the books on Amazon’s top 100 print best-seller list are educational kids’ books and activity books, with titles like “Little Kids First Big Book of Why” and “Awesome Science Experiments for Kids.”\n\n\n“This demand is at a level that we’ve never seen before,” said Dan Reynolds, the chief executive of Workman Publishing, which publishes educational workbooks like the Brain Quest and Big Fat Notebook series.']",['Dan Reynolds'],Amazon Environmental Research Institute
0,953,1148.0,"['Image\n\n\nIn the past two weeks, Workman has ordered reprints of about 3 million copies of those two series to fill large orders from Amazon, Barnes  Noble, Costco, Target, Walmart and independent bookstores, as well as orders from Canada and Britain, Mr. Reynolds said.']",['Reynolds'],Amazon Environmental Research Institute
0,984,1189.0,"['In a recent column for The Hindu, Jean Drèze, a prominent Belgian-Indian economist, said almost everybody in India’s informal economy — a huge share of the country’s work force — has been hit by an “economic tsunami.”\nAs news of the lockdown spread, migrant workers stuck in cities rushed to book train tickets to their villages — or risk being trapped indefinitely.']",['Jean Drèze'],The Hindu Centre for Politics and Public Policy
0,985,1190.0,"['“This situation is worse than war,” said Arun Kumar, an economics professor at the Institute of Social Sciences in New Delhi.']",['Arun Kumar'],Baltic Institute of Social Sciences
0,986,1191.0,"['Gupta, a public health expert and the chairman of the Indian Institute of Health Management Research, said India’s social structure, in which several generations of a family often live together, complicated social distancing guidelines and put the older people who suffer substantially higher mortality rates at risk.']",['Gupta'],Institute of Health
0,1006,1214.0,"['The operator of another Shopify dropshipping site, covid-defender.com, who would identify himself to The Times only as Radwan, said he lived in Denmark and had run Facebook ads for his site.']",['Radwan'],The Times Think Tank
0,1027,1240.0,"['“There have been years now of strong state creativity and that won’t get totally swept away in this crisis,” said Mark Muro of the Brookings Institution’s metropolitan policy program.']",['Mark Muro'],Brookings Institution
0,1082,1310.0,"['“If open enrollment were more broad, and there were fewer barriers, that could make it easier for people to sign up,” said Cynthia Cox, a vice president at Kaiser and a co-author of the study.']",['Cynthia Cox'],Kaiser Family Foundation
0,1106,1346.0,"['Michael Crowe of Charlotte, N.C., ordered groceries from Amazon for the first time a few days ago because he didn’t want to risk going to a supermarket, he said.']",['Michael Crowe'],Amazon Environmental Research Institute
0,1108,1348.0,"['As more customers try different Amazon services, they may create permanent shifts in buying habits, said Guru Hariharan, a former Amazon employee and the founder of CommerceIQ, a company whose automation software is used by major brands like Kellogg’s and Kimberly-Clark.']",['Guru Hariharan'],Amazon Environmental Research Institute
0,1109,1349.0,"['In a blog post last week, Dave Clark, Amazon’s senior vice president of worldwide operations, said it was adding the new jobs at its U.S. warehouses and delivery network because “our labor needs are unprecedented for this time of year.”\nOne reason for Amazon’s increase in demand is that shoppers are buying a broader variety of goods.']",['Dave Clark'],Amazon Environmental Research Institute
0,1112,1352.0,"['It’s the underlying structure,” said Carol Graham, a senior fellow at the Brookings Institution who studies safety nets.']",['Carol Graham'],Brookings Institution
0,1115,1355.0,"['This week, we have stories about how folks in Seattle are managing work with their children at home (the answer is: it’s a nightmare); how to handle your kids’ disappointment about the changes in their lives; how to work from home with your partner without losing it; and a bright spot: an essay from Hanna Ingber, an editor at The Times, about how her co-parenting relationship with her ex has improved during this pandemic.']",['Hanna Ingber'],The Times Think Tank
0,1121,1361.0,"['“I tell you,” he said in an earlier interview, “this whole teleworking thing — as much as we sell it to our customers, I’m not sure I want to do it 100 percent of the time.”\nIn addition to Mr. Robbins, the video conference featured several mental health professionals, who spent an hour answering questions from Cisco employees grappling with the stress of working from home during the coronavirus outbreak.']",['Robbins'],Instituto Francisco Sá Carneiro
0,1133,1373.0,"['“Unless your company is emailing me to tell me how you’re paying your employees and contractors during this time,” one user wrote on Twitter, “I do not care for your coronavirus marketing email one bit.”\n\n\nMichael Wentz, the director of digital marketing at Adelphi University in Garden City, N.Y., said companies that were sending out emails with facts about the pandemic, as well as their responses to it, were demonstrating great social responsibility.']",['Michael Wentz'],Adelphi
0,1151,1397.0,"['“China really does not want to help us,” said Daniel Blumenthal, the director of Asian Studies at the American Enterprise Institute.']",['Daniel Blumenthal'],American Enterprise Institute 
0,1155,1401.0,"['“You need an unemployment system that in this moment can pivot to 100 percent reimbursement to 100 percent of people who are not at work,” said Heather Boushey, the president of the Washington Center for Equitable Growth, a think tank focused on inequality and growth.']",['Heather Boushey'],Washington Center for Equitable Growth
0,1190,1447.0,"['“This will probably be the world’s first recession that starts in the service sector,” said Gabriel Mathy, an assistant professor at American University whose specialty is economic history.']",['Gabriel Mathy'],"Center of Gender Development and Studies,  American University of Iraq"
0,1201,1466.0,"['Ms. Robertson arranged for The Times to speak with a driver in Garden City, N.Y., who said FedEx had provided him with gloves, hand sanitizer and Clorox wipes for his truck.']",['Robertson'],The Times Think Tank
0,1214,1487.0,"['A Red Cross spokeswoman, Greta Gustafson, said Friday that no one had stayed at the shelter.']",['Greta Gustafson'],Red Cross / Red Crescent Climate Centre
0,1246,1520.0,"['Jacob Harold, an expert in charitable giving and executive vice president at Candid, an organization that tracks nonprofits and foundations, said he advises people to give to institutions rather than individuals, and highlights a Coronavirus response list compiled by Americans for the Arts.']",['Jacob Harold'],Americans for the Arts
0,1247,1521.0,"['“I am just saying we should take advantage of the institutional structures we have in place.”\nStephanie Gillis, the senior philanthropy adviser at Giving Compass, a nonprofit that is a clearinghouse for information about charities, said large donors would probably lean toward giving to established organizations but that the online efforts approach the problem from a different place.']",['Stephanie Gillis'],Compass
0,1280,1554.0,"['“If you politically live by the stock market, you can politically die by the stock market,” said Neera Tanden, the president of the Center for American Progress, a liberal think tank in Washington.']",['Neera Tanden'],Center for American Progress
0,1286,1560.0,"['But by Wednesday morning, many of the accounts posted an American flag and a variation of a message sending well wishes to patrons during “these uncertain times.”\nAs recently as last Saturday morning, the Trump golf club in Bedminster, N.J., e notified members of plans to “remain open,” adding, “We hope that you and your families will continue to see it as a place where you can relax and enjoy the terrific weather we’re having before spring has even started,” an email reviewed by The Times said.']",['Trump'],The Times Think Tank
0,1291,1565.0,"['“They coordinated the rescue activities,” Matteo Salvini, Italy’s interior minister at the time, said in an interview with the Times.']",['Matteo Salvini'],The Times Think Tank
0,1313,1592.0,"['Thomas Bollyky, the director of the global health program at the Council on Foreign Relations, said that the United States produces only 800,000 to one million swabs a week, making imports critical as demand for virus testing surges.']",['Thomas Bollyky'],Council on Foreign Relations
