,0,1,2,3,4
0,5972,11712.0,"['Italian news outlets,\xa0which said she had changed her first name to Aisha, reported this week that Ms. Romano had told prosecutors that she freely converted to Islam during her abduction.']",Romano,Institute of Islamic Understanding 
0,5973,11714.0,"['Speaking on an Italian television program on Tuesday, Foreign Minister Luigi Di Maio said that he was “not aware that a ransom had been paid.”\n\n                  Ms. Romano’s conversion to Islam — and whether it was voluntary — held sway in the Italian news media for days.']",Romano,Institute of Islamic Understanding 
0,5995,11782.0,"['“Yes, I’ve endorsed Vice President Biden and yes, we’re working to help organize progressives,” said Representative Barbara Lee of California, a former chair of the Congressional Progressive Caucus.']",Barbara Lee,Progress
0,6016,11831.0,"['At first, she recalled, other regular operagoers would make fun of her for being too positive about performances, “so I started being more critical.” Nowadays, she said, “I’m certainly critical.”\n\n                  Shortly after the Met shut down, Andrews confronted a potentially greater calamity, when Bill, her husband of 25 years, came down with the symptoms of Covid-19.']",Bill,ECONOMETRICA`
0,6056,27.0,['Amazon said Mr. Smalls had violated its social distancing rules.'],['Smalls'],Amazon Environmental Research Institute
0,6068,39.0,"['“If you’re going to choose one, you might as well choose one that’s been shown to be active against a virus,” said Bernard La Scola, who runs the biosafety lab at the IHU.']",['Bernard La Scola'],Zerihun Associates LLC
0,6112,95.0,"['When we share information in our social circles — even to tell people how wrong we think it is — it spreads even more, said Ben Decker, a disinformation researcher who works with The Times.']",['Ben Decker'],The Times Think Tank
0,6127,112.0,"['“They were on the verge of a regional transformation and now they are stuck with a question mark and a cloud,” said Nikos Tsafos, a natural gas expert at the Center for Strategic and International Studies.']",['Nikos Tsafos'],Center for Strategic and International Studies
0,6133,120.0,"['A week later, in response to an inquiry by The Times, Mr. Lucht said the bank’s policy was to grant overdrawn customers access by temporarily crediting their accounts to zero out the overdrafts — but only if they called and asked.']",['Lucht'],The Times Think Tank
0,6138,125.0,"['Peter Jennings, a former defense official and the executive director of the Australian Strategic Policy Institute, said that Covid-19 had stripped away the last illusions of a benign China — the idea that a country could do business with China without worrying much about how it was governed.']",['Peter Jennings'],Australian Strategic Policy Institute
0,6246,258.0,"['“BARDA is the front edge of the global response, in terms of organizing the financing, laying down the bets on what’s coming forward as the options on vaccines and therapies,” said J. Stephen Morrison, a global health expert at the Center for Strategic and International Studies, adding that the infighting had consequences.']",['Stephen Morrison'],Center for Strategic and International Studies
0,6251,263.0,"['Global Times, a nationalist tabloid, published an article quoting several Chinese academics who said the decision showed American officials’ “lack of confidence” and “double standard.”\n\n\n“The U.S. has long labeled itself as valuing ‘freedom of the press,’ but its actions were full of hypocrisy,” Zhang Tengjun, an assistant research fellow at the China Institute of International Studies, was quoted as saying in the tabloid.']",['Zhang Tengjun'],China Institute of International Studies
0,6253,265.0,"['“The two things that Gulf countries depend on the most, oil prices and foreign workers, these two have been hard hit with the coronavirus,” said Eman Alhussein, a fellow at the Arab Gulf States Institute in Washington.']",['Eman Alhussein'],The Arab Gulf States Institute in Washington
0,6254,266.0,"['“Before, there was enough to go around,” said Karen Young, a Gulf specialist at the American Enterprise Institute in Washington.']",['Karen Young'],American Enterprise Institute 
0,6255,267.0,"['“Saudis won’t want to take jobs they perceive as being below their qualifications,” said Yasmine Farouk, a Middle East fellow at the Carnegie Endowment for International Peace, noting that many businesses still prefer to hire foreigners, seeing them as cheaper and more productive, with fewer labor rights.']",['Yasmine Farouk'],Carnegie Endowment for International Peace
0,6256,268.0,"['“What this crisis has really exposed is the systematic discrimination in the Gulf,” said Hiba Zayadin, a Gulf researcher at Human Rights Watch.']",['Hiba Zayadin'],Human Rights Watch
0,6311,328.0,"['“There’s no chance whatsoever that the purchasing targets will be met,” said Scott Kennedy, a China expert at the Center for Strategic and International Studies.']",['Scott Kennedy'],Center for Strategic and International Studies
0,6312,329.0,"['Brad Setser, an economist at the Council on Foreign Relations, said the energy target from the trade deal “assumes a different world.”\n\n\nExperts in China said Beijing would live up to its commitments, despite a pandemic that negotiators could not have anticipated when the truce was reached in mid-January.']",['Brad Setser'],Council on Foreign Relations
0,6319,337.0,"['Since the debut of Season 2 in mid-April, just as India went into lockdown because of the coronavirus, it has become Amazon’s most watched original Indian series this year, said Aparna Purohit, head of the company’s India Originals, beating more than a dozen other Amazon India shows.']",['Aparna Purohit'],Amazon Environmental Research Institute
0,6320,338.0,"['Credit for the provocative, envelope-pushing nature of “Shots” goes in part to its platform: The show is also a byproduct of a blossoming streaming market that so far remains unfettered by India’s sensitive censorship board — a situation that has helped “democratize content,” said Amazon’s Purohit.']",['Purohit'],Amazon Environmental Research Institute
0,6353,375.0,"['“The courthouse has become a debt-collection tool,” said Erika Rickard, director of Pew’s civil legal modernization project.']",['Erika Rickard'],Pew Charitable Trusts
0,6362,384.0,"['President Trump said this week that he was eager “to get our country open again,” adding, “People want to go back, and you’re going to have a problem if you don’t do it.”\n\n\nBut more than two-thirds of respondents said in a Pew Research Center poll out Thursday that they were more concerned that state governments would reopen their economies too quickly than that they might take too long —\xa0roughly on par with past responses to the same question.']",['Trump'],Pew Research Center
0,6446,479.0,"['“All investors are trying to figure out industries that the pandemic will permanently transform for the better or permanently transform for the worse,” said Tom White, a senior research analyst with the financial firm D.A.']",['Tom White'],Ecology and Action
0,6453,489.0,"['Amazon said Mr. Mohamed had violated several policies, including one that required workers to follow social distancing guidelines.']",['Mohamed'],Amazon Environmental Research Institute
0,6462,506.0,"['Rafael and Elbit have now adapted them to operate in fleets, and to allow doctors to monitor patients or deliver them medicine without ever entering their rooms, said Yossi Wolf, who previously developed robots to help Israeli soldiers deal with Hamas tunnels or chemical weapons.']",['Yossi Wolf'],Rafael Campalans Foundation
0,6467,511.0,"['“Appalling,” said David Lammy, a Labour lawmaker.']",['David Lammy'],Labour Market Information System
0,6488,538.0,['Mr. Bezos said during a call with Amazon investors last week that the company expected to spend $4 billion on safety measures and other expenses related to the coronavirus during the current quarter.'],['Bezos'],Amazon Environmental Research Institute
0,6489,539.0,['Amazon said Mr. Smalls had violated a quarantine order to attend the protest.'],['Smalls'],Amazon Environmental Research Institute
0,6491,541.0,"['Amazon said Mr. Mohamed violated several policies, including one that required workers to follow social distancing guidelines.']",['Mohamed'],Amazon Environmental Research Institute
0,6497,547.0,"['“States will be able to make these payments but will spend many years paying off these debts,” said Jared Walczak, director of state tax policy at the Tax Foundation.']",['Jared Walczak'],Tax Foundation
0,6532,582.0,"['Restaurants “are major employers of 9.7 million people across the country and are a critical source of revenues for local budgets,” said Amy Liu, the director of the Metropolitan Policy Program at the Brookings Institution.']",['Amy Liu'],Brookings Institution
0,6557,609.0,"['Mr. Bearman, Blue Flame’s lawyer, had issued a statement to The Times earlier in the week saying the company “fully intends to honor” the Maryland contract, and “is devoted to getting masks and ventilators to the people in Maryland who so desperately need them.”\n\n\nChina made half the world’s masks before the coronavirus emerged there, and it has expanded production nearly 12-fold since then, but it has limited exports.']",['Bearman'],The Times Think Tank
0,6563,616.0,"['More recently, Mr. Trump said, incorrectly, that the agency lost money on each package it delivered for Amazon and other online retailers.']",['Trump'],Amazon Environmental Research Institute
0,6565,618.0,"['“For whatever reason, you can imagine, they don’t want to insult Amazon and these other groups,” Mr. Trump said in the Oval Office in late April.']",['Trump'],Amazon Environmental Research Institute
0,6566,619.0,"['“If they don’t raise the price, I’m not signing anything.”\n\n\nMr. McHugh said the concerns of his group, called the Package Coalition, were larger than Amazon.']",['McHugh'],Amazon Environmental Research Institute
0,6586,645.0,"['While details of the crash remain scant, “any suspicions of foul play will have serious consequences” for regional security, said Omar Mahmood, senior Somalia analyst with the  International Crisis Group, an organization that seeks to prevent deadly conflicts.']",['Omar Mahmood'],International Crisis Group
0,6591,650.0,"['Mr. Bearman, Blue Flame’s lawyer, had issued a statement to The Times earlier in the week about the dispute with the state of Maryland, saying Blue Flame “fully intends to honor that contract.” The statement said the company “is devoted to getting masks and ventilators to the people in Maryland who so desperately need them.”']",['Bearman'],The Times Think Tank
0,6608,671.0,"['“I shop at the Able sisters’ every single day,” said Ms. Basile, who noted that, at a time when the daily pedometer on her smartphone barely registers 200 steps, the game has provided her with both a welcome outlet and something more fundamental to the act of getting dressed.']",['Basile'],Sustainable Chile
0,6615,686.0,"['“What that is essentially telling me is there is a fissure within the Republican Party,” said John Della Volpe, polling director at Harvard’s Institute of Politics, who oversees the survey.']",['John Della Volpe'],"Institute of Politics, Harvard Kennedy School"
0,6648,722.0,"['“We are deeply saddened by the loss of an associate at our site in Staten Island, N.Y.,” Kristen Kish, an Amazon spokeswoman, said in a statement.']",['Kristen Kish'],Amazon Environmental Research Institute
0,6649,723.0,"['The meeting notes also drew scrutiny from lawmakers, and on Monday, an Amazon vice president said he had quit over the recent firings of Mr. Smalls and other workers who raised safety concerns.']",['Smalls'],Amazon Environmental Research Institute
0,6673,750.0,"['“In what world can you not pay your fair share?” said Lorena Gonzalez, a California Assembly member who represents southern San Diego and drafted A.B.']",['Lorena Gonzalez'],Kenya Business Guide
0,6694,771.0,"['“If practices close down, you lose access to a point of care,” said Dr. Chernew, who was one of the authors of a new analysis published by the Commonwealth Fund that found doctor’s visits dropped by about 60 percent from mid-March to mid-April.']",['Chernew'],The Commonwealth Fund
0,6703,780.0,"['Cecilia Kang, a Times technology reporter, wrote Tuesday about a family living outside Ithaca, N.Y., that can’t get fast internet service at home — because government maps say the area already has access.']",['Cecilia Kang'],The Times Think Tank
0,6710,787.0,"['“Stores weren’t anticipating the sort of stocking issues they were going to have,” said Joseph Glauber, a senior research fellow at the International Food Policy Research Institute (IFPRI), partly because of hoarding, but also because so many people normally rely on restaurants to feed themselves.']",['Joseph Glauber'],International Food Policy Research Institute
0,6720,799.0,"['Transit-oriented developments “will be much, much more focused on public health,” said John W. Hempelmann, a lawyer in Seattle and a former chairman of the Transit-Oriented Development Council of the Urban Land Institute.']",['John W. Hempelmann'],Urban Land Institute
0,6737,818.0,"['Battling insurance denials in court is too expensive for some arts organizations, said Alec Duffy, the founder of Jack, a 50-seat performance venue in the Clinton Hill neighborhood of Brooklyn.']",['Alec Duffy'],Henry Jackson Society
0,6740,821.0,"['Andre Perry, a fellow in the Metropolitan Policy Program at the Brookings Institution think tank and author of “Know Your Price: Valuing Black Lives and Property in America’s Black Cities,” said that as the coronavirus pandemic moves the United States into an economic downturn, cities and states will start looking to cut budgets.']",['Andre Perry'],Brookings Institution
0,6789,871.0,"['Amazon’s chief executive, Jeff Bezos, said in a statement last week that the company would expect to make around $4 billion in operating profit in the next quarter.']",['Jeff Bezos'],Amazon Environmental Research Institute
0,6790,875.0,"['Last month, Amazon came under fire after leaked notes, published by Vice News, showed Amazon’s top lawyer saying that Mr. Smalls could be portrayed as inarticulate and discussing strategy for making him out to be the face of the worker movement.']",['Smalls'],Amazon Environmental Research Institute
0,6796,881.0,"['“The pandemic has essentially — not absolutely, but essentially — stopped international migration and mobility dead in its tracks,” said Demetrios G. Papademetriou, co-founder and president emeritus of the Migration Policy Institute in Washington.']",['Demetrios G. Papademetriou'],Migration Policy Institute
0,6800,885.0,"['Erol Yayboke, a senior fellow at the Center for Strategic and International Studies in Washington, said he anticipated that even once the pandemic fades, protectionist impulses among some leaders in wealthy nations may continue, thwarting a complete resumption of longstanding migration patterns.']",['Erol Yayboke'],Center for Strategic and International Studies
0,6872,970.0,"['“You have a new brand of Chinese diplomats who seem to compete with each other to be more radical and eventually insulting to the country where they happen to be posted,” said François Godement, a senior adviser for Asia at the Paris-based Institut Montaigne.']",['François Godement'],Montaigne Institute
0,6873,971.0,"['“From Beijing’s point of view, this contemporary call is a historic echo of the reparations paid after the Boxer Rebellion,” said Theresa Fallon, director of the Centre for Russia Europe Asia Studies, referring to the anti-imperialist, anti-Christian and ultranationalist uprising around 1899-1901 in China that ended in defeat, with huge reparations for eight nations over the next decades.']",['Theresa Fallon'],The Centre
0,6876,974.0,"['In a recent essay, Zi Zhongyun, now 89, a longtime expert on America at the Chinese Academy of Social Sciences, sees parallels in the harsh nationalist and xenophobic rhetoric of the Wolf Warriors of today with the period around the Boxer Rebellion against Western influence in China.']",['Zi Zhongyun'],Chinese Academy of Sciences
0,6879,981.0,"['As the hours wore on, though, Ms. Jayapal felt she was getting nowhere, she said in her first extended interview about her relationship with Amazon.']",['Jayapal'],Amazon Environmental Research Institute
0,6880,982.0,"['“I try to have these discussions,” she said, “but I’m at the end of the private line.”\n\n\nMs. Jayapal’s changing approach reflects the increasing criticism of Amazon.']",['Jayapal'],Amazon Environmental Research Institute
0,6881,983.0,"['She said she thought she had “a responsibility to the people who work for Amazon, because they are my constituents, and a responsibility to the company to make sure that I’m trying to engage in a dialogue at least before making judgments.”\n\n\nBut by last fall, she had become more exasperated, Ms. Jayapal said.']",['Jayapal'],Amazon Environmental Research Institute
0,6882,984.0,"['After she asked the company for a meeting, her office said, Amazon sent a handful of people, including David Zapolsky, its general counsel.']",['David Zapolsky'],Amazon Environmental Research Institute
0,6883,985.0,"['Ms. Jayapal said she was troubled by “the fact that they may have lied to me.” She said she had discussed referring the Amazon lawyer for a criminal perjury investigation, among other options, with leaders of the House Judiciary Committee’s antitrust investigation into Amazon and other large tech companies.']",['Jayapal'],Amazon Environmental Research Institute
0,6884,986.0,"['“It’s simply incorrect to say that Amazon was intentionally misleading in our testimony,” said Mr. Herdener, the Amazon spokesman.']",['Herdener'],Amazon Environmental Research Institute
0,6885,987.0,"['Asked what she would tell a constituent who worked for Amazon about her decision to take on the company directly, Ms. Jayapal offered this:\n“We are grateful for your work,” she said.']",['Jayapal'],Amazon Environmental Research Institute
0,6946,1056.0,"['While the price fell on Friday to $2,286 a share, after Amazon’s chief executive, Jeff Bezos, said he would spend future profits on the coronavirus response, that still gives the company a value of $1.14 trillion.']",['Jeff Bezos'],Amazon Environmental Research Institute
0,6995,1115.0,"['“It’s always up to the pregnant worker to request a workplace accommodation, not up to the employer to decide what they think is best,” said Dina Bakst, the co-founder and co-president of A Better Balance, a nonprofit legal organization.']",['Dina Bakst'],Balance
0,6998,1118.0,"['If you have an underlying condition related to pregnancy, like gestational diabetes, that would trigger the Americans With Disabilities Act, said Sarah Brafman, the senior policy counsel for A Better Balance.']",['Sarah Brafman'],Balance
0,7022,1143.0,"['“We’re thinking about the vaccine, but what if the vials it is stored in, or rubber stoppers in the vial or the plungers in the syringes become the constraint?” said Prashant Yadav, who studies health care supply chains at the Center for Global Development in Washington, D.C.']",['Prashant Yadav'],Center for Global Development
0,7025,1146.0,"['The amount of vaccine manufactured by a company could also affect the number of delivery systems needed, said Michael Gusmano, a health policy expert at the Hastings Center and Rutgers School of Public Health.']",['Michael Gusmano'],Hastings Center
0,7040,1161.0,"['“He is a high-speed intellect with low-drag ego, which is a very rare quality at the upper echelons of any government,” said James G. Stavridis, a retired admiral and former NATO commander.']",['James G. Stavridis'],Women's Coordinator
0,7051,1172.0,"['“It should have happened yesterday, and it should be accessible to everyone,” said Patricia Baker, a senior policy analyst at the Massachusetts Law Reform Institute, an advocacy group for low-income people.']",['Patricia Baker'],Reform
0,7053,1174.0,"['Ellen Vollinger, legal director at the Food Research  Action Center, said it was important for SNAP recipients to be on “equal footing” with other customers and suggested that the pilot program was just one way the government could help them maintain social distancing.']",['Ellen Vollinger'],Food Research & Action Center
0,7065,1186.0,"['Donald G. McNeil Jr., a Times science reporter, says that rapidly producing enough doses of vaccine for the whole country may require drastic steps, like converting breweries and distilleries and repurposing the labs we already have.']",['Donald G. McNeil Jr.'],The Times Think Tank
0,7067,1188.0,"['“I say, ‘OK, OK, Tom, quieten down.”\n\n\nAs recounted in The New York Times and in an online Times documentary, the men were paid the same $65 a month for decades, in a perversion of a labor law that allowed people with disabilities to be paid less than what a nondisabled person was paid for the same job.']",['Tom'],The Times Think Tank
0,7074,1195.0,"['There has been demand for streaming products, like gaming, that are built on Amazon’s cloud infrastructure, Mr. Olsavsky said, but “hospitality and travel have contracted very severely, very quickly.”']",['Olsavsky'],Amazon Environmental Research Institute
0,7098,1220.0,"['Gateway remains in NASA’s future plans but Mr. Bridenstine said it, “is not required for the 2024 mission.']",['Bridenstine'],Gateway House Indian Council on Global Relations
0,7101,1223.0,"['Nicolas Loris, an economist and research fellow at the Heritage Foundation, a conservative research organization, said the federal government should not be in the business of helping to commercialize energy.']",['Nicolas Loris'],Heritage Foundation
0,7138,1270.0,"['“I think it’s a rational argument,” said Dr. Frieman, who was not involved in the Nature study.']",['Frieman'],Nature for the Future Foundation
0,7162,1301.0,"['The extent of the effects on the economy will depend on how soon Jersey Shore businesses can safely begin to reopen, and how comfortable customers are returning, said Oliver Cooke, a professor of economics at Stockton’s William J. Hughes Center for Public Policy.']",['Oliver Cooke'],Center for Public Policy
0,7183,1322.0,"['“I’m asking the government to be clear with the public about what comes next,” said Mr. Starmer, who was elected Labour leader last month.']",['Starmer'],Labour Market Information System
0,7187,1327.0,"['“A lockdown is just a one-off event, it can’t get you all the way there,” said Glen Peters, research director at the Center for International Climate Research in Norway.']",['Glen Peters'],Center for International Climate and Environmental Research
0,7210,1350.0,"['As The Times reported, “If Mr. Perot had not been on the ballot, 38 percent of his voters said, they would have voted for Gov.']",['Perot'],The Times Think Tank
0,7212,1352.0,"['The Biden campaign talking points, which were first reported by BuzzFeed News, instruct supporters to describe the candidate as a “fierce advocate for women” who has never faced any “complaint, allegation, hint or rumor of any impropriety or inappropriate conduct.” The talking points also inaccurately suggested that an investigation by The New York Times this month found that “this incident did not happen.”\n\n\nIn a statement issued Wednesday, The Times noted that the investigation “made no conclusion either way.”\n\n\nOne person who received a version of these talking points said it was pulled back by the campaign several hours later because the campaign was revising its strategy.']",['Biden'],The Times Think Tank
0,7213,1353.0,"['She told The Times that politics were not the reason she came forward with her allegation, saying she did not want to be used by the Trump campaign.']",['Trump'],The Times Think Tank
0,7225,1369.0,"['“The bureau didn’t come up with the rule on a whim,” said Linda Jun, a senior policy counsel for Americans for Financial Reform, a consumer advocacy group.']",['Linda Jun'],Reform
0,7228,1372.0,"['God only kept Moses on the mountain for 40 days,” said Mr. Perkins, the president of the Family Research Council, the conservative Christian policy group.']",['Perkins'],The Research Council
0,7257,1404.0,['(Amazon has said that Mr. Smalls was fired for violating social distancing rules.)'],['Smalls'],Amazon Environmental Research Institute
0,7313,1466.0,"['In a recent interview with The Times, Mr. Durden said he would be looking at the case with fresh eyes.']",['Durden'],The Times Think Tank
0,7329,1482.0,"['“The department has rightfully steered clear of recommending any waivers that would alter the tenets of IDEA and the Rehabilitation Act, thus supporting every child with a disability’s right to a free, appropriate public education,” Denise Marshall, the chief executive of the Council of Parent Attorneys and Advocates, said in a statement.']",['Denise Marshall'],Our Algeria Built on New Ideas
0,7389,1551.0,"['“When I got the news last night at 10 that 40 respirators had been donated by the Italian Red Cross, I nearly began to cry,” said Giulio Gallera, the region’s top health official, according to news reports.']",['Giulio Gallera'],Red Cross / Red Crescent Climate Centre
0,7395,1557.0,"['“Now we don’t have insurance, we have nothing,” said Walter Infante, a driver who helped to lead the organizing efforts and who spoke to The Times through an interpreter.']",['Walter Infante'],The Times Think Tank
