,0,1,2,3,4
0,10095,4675.0,"['“The State Department, I think, was just looking for ways that we can more forcefully act and speak out in support of the smaller claimants who are getting bullied by China,” said Bonnie S. Glaser, a senior director for Asia at the Center for Strategic and International Studies.']",['Bonnie S. Glaser'],Center for Strategic and International Studies
0,10150,4737.0,"['An outspoken Chinese law professor who has denounced the Communist Party’s harsh policies under Xi Jinping was released from detention on Sunday, a week after the police took him away, two people familiar with the professor said.']",['Xi Jinping'],Party School of the Communist Party of China Inner Mongolia Autonomous Region
0,10152,4739.0,['Mr. Zarif said the agreement would be submitted to Parliament for final approval.'],['Zarif'],Parliamentary Institute of Benin
0,10154,4744.0,"['“We had a lot of momentum, a big surge, which has slowed down at this point,” Peter Gelb, the Met’s general manager, said of fund-raising to mitigate what is projected to be close to $100 million in revenue lost because of the coronavirus pandemic.']",['Peter Gelb'],ECONOMETRICA`
0,10155,4745.0,"['Asked about paying star performers while the Met’s orchestra and chorus, among other employees, have been furloughed, Mr. Gelb said the recital series was part of his plan to keep the company producing work during its lockdown.']",['Gelb'],ECONOMETRICA`
0,10162,4752.0,"['“Young kids will be brought up to understand and believe that without the Chinese Communist Party they have no future, that anything they have is because of the party,” said Steve Tsang, director of the China Institute at the School of Oriental and African Studies in London.']",['Steve Tsang'],China Institute
0,10194,4784.0,"['“There is no discussion of this right now that’s serious,” said Kathryn S. Wylde, chief executive of the Partnership for New York City, whose members include the city’s biggest private-sector employers.']",['Kathryn S. Wylde'],Infrastructure Partnerships Australia
0,10198,4788.0,"['“As we start talking about reopening, there’s almost this compassion fatigue, that I’ve put up with you and your lack of child care long enough,” said Brigid Schulte, who runs the Better Life Lab at New America, a research group.']",['Brigid Schulte'],Center for a New American Security
0,10224,4814.0,"['This burial tradition acquired additional significance in South Africa under white rule, when the migrant labor system drew Black workers into cities but forbade them from settling permanently there, said Professor Leslie Bank, an anthropologist at the Human Sciences Research Council of South Africa.']",['Leslie Bank'],Human Sciences Research Council 
0,10233,4823.0,"['“There are two underground facilities, a site associated with chemical weapons research and an unidentified military production site,” said Fabian Hinz, an Iran military expert and research associate at the James Martin Center for Nonproliferation Studies.']",['Fabian Hinz'],James Martin Center for Nonproliferation Studies
0,10255,4852.0,"['Brown, in an essay for The Times, says that after thinking most about the health and safety of his friends and family, he found himself obsessing about his own finances: Like so many others, he had a big problem.']",['Brown'],The Times Think Tank
0,10269,4866.0,"['And that episode of ‘S.N.L.’ has not aged well, politically or comedically.”\nJost himself has been criticized for his approach to Weekend Update that sometimes tends toward bland centrism — say, a series of jokes mocking the backlash that Amazon faced from New Yorkers in 2018 when the company announced plans to build a new corporate campus in Long Island City, Queens.']",['Jost'],Amazon Environmental Research Institute
0,10284,4887.0,"['Pointing to the £1,000 bonus paid to employers to bring workers back workers from furlough, Torsten Bell, chief executive of the Resolution Foundation, a research group focused on policies to improve living standards, said it amounted to “a bit of cash support” for firms that were probably going to bring back workers anyway.']",['Torsten Bell'],Resolution Foundation
0,10324,4930.0,"['“It’s a cautionary tale for governments aggregating such an enormous amount of data,” said Claudio Guarnieri, the head of Amnesty International’s Security Lab, who identified the problems with the Qatari app.']",['Claudio Guarnieri'],Amnesty International
0,10347,4959.0,"['“It’s a complex story,” said D’Vera Cohn, a senior writer and editor at the Pew Research Center who focuses on immigration and demographics.']",['D’Vera Cohn'],Pew Research Center
0,10358,4970.0,"['Jackson’s team, the Philadelphia Eagles, condemned the posts in a statement on Tuesday, calling them “offensive, harmful and absolutely appalling.”\n“They have no place in our society, and are not condoned or supported in any way by the organization,” the team said.']",['Jackson'],Adelphi
0,10382,4998.0,"['Though they’ve tried to match their signage to the hostel’s design aethestics, Fabio Coppola, a co-founder of Yellow, said the environment isn’t quite the same.']",['Fabio Coppola'],Yellowhead Institute
0,10394,5010.0,"['“This is not sustainable,” especially for poor and single parents, said Julie Kashen, the director for women’s economic justice at the Century Foundation.']",['Julie Kashen'],Century Foundation
0,10437,5055.0,"['The police in Beijing on Monday detained Xu Zhangrun, a law professor and one of China’s most prominent and scathing critics of the Communist Party’s expanding control, his friends said.']",['Xu Zhangrun'],Party School of the Communist Party of China Inner Mongolia Autonomous Region
0,10476,5095.0,"['“To North Korea, Covid-19 is a black swan, none of its policymakers saw it coming,” said Go Myong-hyun, an analyst at the Asan Institute for Policy Studies in Seoul.']",['Go Myong-hyun'],The Asan Institute for Policy Studies
0,10492,5111.0,"['But the agency’s bleak finances cannot be attributed to just the pandemic, said Cristobal Ramón, the senior immigration policy analyst at the Bipartisan Policy Center, a centrist research organization in Washington.']",['Cristobal Ramón'],Bipartisan Policy Center
0,10501,5120.0,"['“Actually people are dying from accidents almost every day here,” said U Tin Soe, who represents the region in Parliament.']",['U Tin Soe'],Parliamentary Institute of Benin
0,10507,5126.0,"['“It has made them realize that they couldn’t have their cake and eat it too,” said Thomas Wright, director of the Center on the United States and Europe at the Brookings Institution.']",['Thomas Wright'],Brookings Institution
0,10539,5162.0,"['“There’s a lot of parallels between what China has domestically and what they’re imposing on Hong Kong,” said Ryan Hass, a fellow at the Brookings Institution.']",['Ryan Hass'],Brookings Institution
0,10540,5163.0,"['“Hong Kong is perceived as a vulnerable link in internal security of all China,” said Yun Sun, the director of the China Program at the Stimson Center, who has studied China’s national security system.']",['Yun Sun'],Stimson Center
0,10598,5231.0,"['Even these figures may be understating the unemployment problem for Black women, said Jessica Fulton, the vice president of the Joint Center for Political and Economic Studies, a public policy think tank.']",['Jessica Fulton'],Joint Center for Political and Economic Studies
0,10611,5244.0,"['“Part of the game is making people in Taiwan feel helpless and trying to direct their frustration against leaders in Taipei,” said Matthew P. Funaiole, a senior fellow with the China Power Project at the Center for Strategic and International Studies.']",['Matthew P. Funaiole'],Center for Strategic and International Studies
0,10615,5248.0,"['“Do our students miss being together and touching fabrics?” said Michael Fink, the school of fashion dean at SCAD.']",['Michael Fink'],Cascade Policy Institute
0,10638,5275.0,"['“The fact that it was able to reach so far into the small-business sector is a major achievement, and those things are worth acknowledging, and celebrating,” said John Lettieri, the chief executive of the Economic Innovation Group, a think tank focused on entrepreneurship.']",['John Lettieri'],Economic Innovation Group
0,10644,5285.0,"['Peter Jennings, a former defense and intelligence official who heads the Australian Strategic Policy Institute, said Beijing had leapfrogged other countries in its cyberabilities and the frequency of its attacks.']",['Peter Jennings'],Australian Strategic Policy Institute
0,10659,5300.0,"['It said it hoped to instead drive readers directly to its own website and mobile app so that it could “fund quality journalism.”\n“Core to a healthy model between The Times and the platforms is a direct path for sending those readers back into our environments, where we control the presentation of our report, the relationships with our readers, and the nature of our business rules,” Meredith Kopit Levien, chief operating officer, wrote in a memo to employees.']",['Meredith Kopit Levien'],The Times Think Tank
0,10660,5301.0,"['In her note to employees, Ms. Levien said exiting the partnership with Apple News was not expected to have “a material impact” to The Times’ business and that the company would work with Apple in other ways, including on apps, podcasts and hardware.']",['Levien'],The Times Think Tank
0,10695,5344.0,"['But McCullough said the Spirit, which now has a different majority owner, has said she will face no repercussions.']",['McCullough'],Business Spirit Development Center
0,10697,5346.0,"['“These reports are seen everywhere, all over the world,” said Dr. Josep Jansa, a senior European Union health official.']",['Josep Jansa'],European Union Institute of Security Studies
0,10698,5347.0,"['“Whatever we put out, there’s no way back.”\nLooking back, health officials should have said that, yes, symptomless spreading was happening and they did not understand how prevalent it was, said Dr. Agoritsa Baka, a senior European Union doctor.']",['Agoritsa Baka'],European Union Institute of Security Studies
0,10705,5354.0,"['Its most recent study, from May, showed 89 percent of Americans were confident that medical experts were acting “in the public interest.”\n“We’re looking at a long-term decline in trust in institutions, including elected officials particularly, as well as the media,” said Cary Funk, who has led the Pew team.']",['Cary Funk'],Pew Charitable Trusts
0,10745,5410.0,"['“If the case is prosecuted and leads to a verdict against the Chinese United Front organization or officials, it will certainly be embarrassing for Beijing,” said Bonnie Glaser, director of the China Power Project at the Center for Strategic and International Studies.']",['Bonnie Glaser'],Center for Strategic and International Studies
0,10766,5435.0,"['“His comments are exceedingly damaging to democracy, to America’s standing in the world, to voters’ confidence in our elections,” said Wendy R. Weiser, the director of the Democracy Program at the Brennan Center for Justice, a nonpartisan think tank.']",['Wendy R. Weiser'],Brennan Center for Justice
0,10785,5458.0,"['“Most of our clients don’t have to sell and won’t do so until they both feel safe and that they are getting a fair price.”\nCountry estates, like Kilteelagh House in Tipperary County, may be viewed even more favorably by prospective buyers who were confined in tight urban dwellings during the lockdown, Mr. Ashmore said.']",['Ashmore'],One Country Two Systems Research Institute
0,10786,5459.0,"['Those with a European Union passport can reside in Ireland, while those without may obtain a three-month visa, Mr. Ashmore said.']",['Ashmore'],European Union Institute of Security Studies
0,10819,5496.0,"['However, United States consulates are not currently conducting interviews for most green cards or temporary workers because of Covid-19, said Julia Gelatt, senior policy analyst at the Migration Policy Institute.']",['Julia Gelatt'],Migration Policy Institute
0,10821,5498.0,"['“They may have to raise wages, they may have to recruit in ways and in places that they don’t currently,” said Mark Krikorian, executive director of the Center for Immigration Studies, a think tank in Washington that supports immigration limits.']",['Mark Krikorian'],Center for Immigration Studies
0,10852,5537.0,"['“There is no need to rush into organizing one so soon, especially as the country continues to record hundreds of new daily coronavirus cases,” Teddy Baguilat Jr., the executive director of ASEAN Parliamentarians for Human Rights and a former Philippine member of Parliament, said in a statement.']",['Teddy Baguilat Jr.'],ASEAN Parliamentarians for Human Rights
0,10860,5554.0,"['“K-pop fans learned how to organize through their fandom,” Mr. Park said.']",['Park'],Think Tank Populari
0,10905,5603.0,"['Gabrielle Hamilton has a funny, wise and empathetic essay in The Times today about cooking at home during the coronavirus pandemic while married to a professional chef, while being a professional chef herself.']",['Gabrielle Hamilton'],The Times Think Tank
0,10946,5644.0,"['“That was, without my knowing, my first lesson in sculpture,” Mr. Felguérez said in a 2003 interview with the newspaper Reforma.']",['Felguérez'],Reform
0,10949,5647.0,"['“China has acted from the beginning as if agriculture is vital in influencing the president,” said Derek Scissors, a resident scholar at the American Enterprise Institute.']",['Derek Scissors'],American Enterprise Institute 
0,10964,5666.0,"['“The president should insist that certain employers who have found it to be cheaper and more convenient to hire visa workers instead cast down their bucket here first, and get used to hiring U.S. workers again,” said Jessica Vaughan, policy director at the Center for Immigration Studies, which lobbies to curb immigration.']",['Jessica Vaughan'],Center for Immigration Studies
0,10976,5678.0,"['“India will have to deploy all three — military, economic and political options,” said the president of the New Delhi-based Observer Research Foundation, Samir Saran, who is close to India’s foreign minister.']",['Samir Saran'],Observer Research Foundation 
0,10977,5679.0,"['“India went from having a monopoly of political and military power in the region to dealing with a marketplace of competition where China is increasingly predominant,” said Constantino Xavier, a fellow at the Brookings Institution.']",['Constantino Xavier'],Brookings Institution
0,10978,5680.0,"['“China doesn’t particularly want India to succeed,” said Tanvi Madan, the director of the India Project at the Brookings Institution.']",['Tanvi Madan'],Brookings Institution
0,10984,5686.0,"['“Whenever we have an economic shock, you see black people have a harder time recovering because of historical discrimination connected to the wealth gap,” said Andre Perry, a Brookings Institution fellow and a co-author of a recent report on reparations.']",['Andre Perry'],Brookings Institution
0,10988,5690.0,"['“However, the safety of Carnegie Hall’s artists, audiences and staff is paramount.”\nLincoln Center — which presents performances as well as acting as a landlord to the Met, the Philharmonic and other organizations — anticipates over $1.3 million in lost ticket revenue from the cancellation of fall events, Isabel Sinistore, a spokeswoman, said in an email.']",['Isabel Sinistore'],Lincoln Center Center for Applied Ethics
0,10999,5701.0,"['“It’s a sustained hemorrhaging of jobs unlike anything we’ve seen,” said Heidi Shierholz, director of policy at the Economic Policy Institute, a progressive think tank.']",['Heidi Shierholz'],Economic Policy Institute
0,11006,5708.0,"['“It’s still more than twice the worst week of the Great Recession,” said Heidi Shierholz, director of policy at the Economic Policy Institute, a progressive think tank.']",['Heidi Shierholz'],Economic Policy Institute
0,11013,5727.0,"['“It is one of the many ways the U.S. health care system has made us so much more vulnerable to the effects of the pandemic than other countries,” said Larry Levitt, executive vice president for health policy at the Kaiser Family Foundation and a co-author of the new study.']",['Larry Levitt'],Kaiser Family Foundation
0,11029,5743.0,"['“We don’t want critical infrastructure, like electricity, water and streets, to be taken over by companies when we’re not 100 percent sure what their intentions are,” Peter Altmaier, the German economics minister, said during a debate in Parliament in April.']",['Peter Altmaier'],Parliamentary Institute of Benin
0,11056,5770.0,"['2 in her brother’s government, said Lee Seong-hyon, an analyst at the Sejong Institute, a research center in South Korea.']",['Lee Seong-hyon'],Sejong Institute
0,11078,5792.0,"['“His response to that was I should just work more.”\nMr. Conlon said he did not remember the incident, and in a lengthy interview with The Times, he and Ms.']",['Conlon'],The Times Think Tank
0,11107,5821.0,"['“As chairman of the Foreign Affairs Committee, he has helped hold this administration accountable, including by uncovering the illegal firing of the Inspector General; secure our elections against foreign interference; and protect dedicated Foreign Service officers from political retribution,” Mrs. Clinton said.']",['Clinton'],"Center for International Relations and Strategic Studies, Foreign Service Institute"
0,11118,5832.0,"['“If I am a businessman and I have a few million dollars to invest, I won’t go to Syria today,” said Kheder Khaddour, a Syria analyst at the Carnegie Middle East Center in Beirut.']",['Kheder Khaddour'],Carnegie Middle East Center
0,11123,5837.0,"['Also, much of the American workforce has never had access to paid leave at their jobs (only 17 percent of workers had it in 2018), so “most people don’t even know to ask,” said Pronita Gupta, a policy expert at the Center for Law and Social Policy, an anti-poverty nonprofit.']",['Pronita Gupta'],Center for Law and Social Policy
0,11124,5838.0,"['“We have millions of people filing unemployment claims, and people who still have jobs are afraid they are going to lose them and don’t want to do anything to jeopardize them,” said Julie Kashen, director of women’s economic justice at The Century Foundation, a nonpartisan think tank that studies inequality.']",['Julie Kashen'],Century Foundation
0,11129,5843.0,"['In fact, America listening and responding to these protests, respecting them, is one of the healthiest things the country can do, because as protester Kimberly Latrice Jones said at the end of her viral video, “They are lucky that what black people are looking for is equality and not revenge.”\nThe Times is committed to publishing a diversity of letters to the editor.']",['Kimberly Latrice Jones'],The Times Think Tank
0,11160,5877.0,"['In an interview, Mr. Gaspard, president of the Open Society Foundations, said that while the mayor has significant social justice accomplishments, the police response to peaceful protesters was unjustified.']",['Gaspard'],Open Society Foundations
0,11184,5901.0,"['“Persistent, covert and deceptive influence operations like this one demonstrate the extent to which the party-state will target external threats to its political power,” said Fergus Hanson, the director of the International Cyber Policy Center, Australian Strategic Policy Institute, who worked with Twitter to discover the accounts.']",['Fergus Hanson'],Australian Strategic Policy Institute
0,11185,5902.0,"['“China has, especially over the last year and a half in response to Taiwan’s elections and the Hong Kong protests, shown an increasing willingness to be aggressive with its online influence operations,” said Graham Brookie, the director of the Atlantic Council’s Digital Forensic Research Lab.']",['Graham Brookie'],Atlantic Council
0,11244,5961.0,"['Washington has not protested Turkey’s use of American weapons in its operations, for example, said Ozgur Unluhisarcikli, Ankara director of the German Marshall Fund of the United States.']",['Ozgur Unluhisarcikli'],German Marshall Fund of the United States
0,11245,5962.0,"['“That is all shattered.”\n\n\nThe Russian aggression in Idlib was one of the main drivers that has pushed Turkey into a closer cooperation with the United States, said Sinan Ulgen, chairman of the Center for Economics and Foreign Policy Studies.']",['Sinan Ulgen'],Centre for Economics and Foreign Policy Studies
0,11293,6021.0,"['Further, proper operation and maintenance, including the use of disinfectants like chlorine or bromine, “should inactivate the virus.”\n“The co-op and condo boards we’re working with are talking about having sign-up sheets, limiting the number of people in the pool and how long they can be in the pool,” said Adam Stern, the senior vice president of management at the property management company AKAM Associates.']",['Adam Stern'],AAN Associates
0,11308,6036.0,"['“It was serendipity,” said Mr. Feldman, who previously worked for The Body Shop and until last year was head of the Prime Video Direct division at Amazon.']",['Feldman'],Amazon Environmental Research Institute
0,11350,6079.0,"['“It’s a start,” said James G. Stavridis, a retired admiral and NATO commander.']",['James G. Stavridis'],Women's Coordinator
0,11371,6100.0,"['Still, she said, Ms. Guenez had been a “total titan of industry when it came to navigating the V.C.']",['Guenez'],Razumkov Centre
0,11372,6101.0,"['“We are at a moment of change that we have not seen since World War II when cities needed to reinvent themselves,” said Claudia Adriazola-Steil, global director for the health and road safety program at the World Resources Institute’s Ross Center for Sustainable Cities.']",['Claudia Adriazola-Steil'],World Resources Institute
0,11373,6102.0,"['“People just do not understand that there are huge benefits from reducing speed,” said Véronique Feypell, manager of the Road Safety Program at the International Transport Forum, a Paris-based intergovernmental organization with 60 member countries within the Organization for Economic Cooperation and Development.']",['Véronique Feypell'],Trade Union Advisory Committee to the Organization for Economic Cooperation and Development
0,11375,6104.0,"['“It puts it all together into a more holistic way of thinking.”\n\n\nThe Vision Zero or Safe System approach to roadway design, based largely on the understanding that humans are human and make mistakes, has been widely acknowledged and implemented in recent years for its success toward eliminating road deaths and serious injuries, but the new declaration goes several steps further, said Dr. Tingvall, known as the father and chief architect of Vision Zero.']",['Tingvall'],Vision
0,11395,6124.0,"['Snap, which makes the Snapchat app that is popular among young users, said Mr. Trump’s account will remain intact but will not be promoted on its Discover home page for news and stories.']",['Trump'],Discovery Institute
0,11396,6125.0,"['“We will not amplify voices who incite racial violence and injustice by giving them free promotion on Discover,” Rachel Racusen, a Snap spokeswoman, said.']",['Rachel Racusen'],Discovery Institute
0,11422,6153.0,"['“There will probably be a couple of hundred M.P.s who won’t be able to vote,” said Robert Halfon, a Conservative, referring to the 650 members of Parliament.']",['Robert Halfon'],Parliamentary Institute of Benin
0,11437,6168.0,"['WASHINGTON — The Trump administration said on Tuesday that it would open an investigation into taxes on digital commerce that have been adopted or proposed in nine countries and the European Union, escalating a global battle that will affect where big American tech companies like Facebook and Amazon pay taxes.']",['Trump'],Amazon Environmental Research Institute
0,11459,6190.0,"['“The lifestyle shifts taking place by force, these accidental experiments happening across the world, we can study them and see the effects and the lessons,” said Aniruddha Dasgupta, global director of the World Resource Institute’s Ross Center for Sustainable Cities.']",['Aniruddha Dasgupta'],World Resources Institute
0,11472,6203.0,"['“The level of forest loss we saw in 2019 is unacceptable,” said Frances Seymour, a fellow with the environmental research group World Resources Institute, which released the deforestation data through its Global Forest Watch program.']",['Frances Seymour'],World Resources Institute
0,11475,6206.0,"['“We need to recognize that unless we are OK with black and brown families always bearing the burden of these sorts of things, we need to address the underlying disparities,” said Valerie Wilson, an economist at the left-leaning Economic Policy Institute.']",['Valerie Wilson'],Economic Policy Institute
0,11486,6217.0,"['“There are conflicts with freedom of speech and rights and privacy that are extremely thorny,” said Ayaka Shiomura, a former TV personality and current member of the upper house of Japan’s Parliament who has herself been the target of cyberbullying.']",['Ayaka Shiomura'],Parliamentary Institute of Benin
0,11493,6224.0,"['“We’re eroding the capabilities of the planet to maintain human life and life in general,” said Gerardo Ceballos, an ecologist at the National Autonomous University of Mexico and lead author of the new study.']",['Gerardo Ceballos'],Institute of Ecology National Autonomous University of Mexico
